31686412,https://www.yapo.cl/autos-usados/maxus-g10-2-0/31686412,Maxus G10 2.0,,,Maxus,G10,,$18.000.000,18000000,,90'000,,Diesel
31732616,https://www.yapo.cl/autos-usados/peugeot-208-2024/31732616,PEUGEOT 208 2024,,,,,,,,,,,
31813771,https://www.yapo.cl/autos-usados/toyota-land-cruiser-prado-2023-vx/31813771,Toyota Land Cruiser Prado 2023 VX,,,,,,,,,,,
31533219,https://www.yapo.cl/autos-usados/kia-sorento-2019/31533219,KIA SORENTO 2019,,,Kia,Sorento,,$16.990.000,16990000,2019,108'737,108737,Bencina
31029850,https://www.yapo.cl/autos-usados/kia-seltos-2025/31029850,KIA SELTOS 2025,,,Kia,Seltos,,$19.990.000,19990000,2025,30,30,Bencina
31781695,https://www.yapo.cl/autos-usados/peugeot-301-1-6-hdi-2022/31781695,PEUGEOT 301 1.6 HDI 2022,,,Peugeot,301,,$10.990.000,10990000,2022,64'000,64000,Diesel
31781361,https://www.yapo.cl/autos-usados/kia-morning-2017/31781361,KIA MORNING 2017,,,Kia,Morning,,$6.490.000,6490000,2017,111'000,111000,Bencina
31701553,https://www.yapo.cl/autos-usados/chevrolet-sail-2022/31701553,CHEVROLET SAIL 2022,,,Chevrolet,Sail,,$6.990.000,6990000,2022,115'000,115000,Bencina
31370699,https://www.yapo.cl/autos-usados/nissan-navara-2023/31370699,NISSAN NAVARA 2023,,,Nissan,Navara,,$24.490.000,24490000,2023,41'088,41088,Diesel
31370712,https://www.yapo.cl/autos-usados/nissan-navara-2023/31370712,NISSAN NAVARA 2023,,,Nissan,Navara,,$24.490.000,24490000,2023,30'055,30055,Diesel
31034638,https://www.yapo.cl/autos-usados/mini-bus-ford-transit-2025-full-17-1-unico-dueno-turismo-al-dia/31034638,MINI BUS FORD TRANSIT 2025 FULL 17+1 UNICO DUEÑO TURISMO AL DIA,,,Ford,Transit Van,,$46.490.000 (Rebajado 1%),46490000,2025,7'000,7000,Diesel
31770647,https://www.yapo.cl/autos-usados/mazda-3/31770647,MAZDA 3,,,Mazda,3,,$16.790.000,16790000,2023,35'500,35500,Bencina
31533106,https://www.yapo.cl/autos-usados/peugeot-3008-2020-color-exclusivo/31533106,Peugeot 3008 2020 COLOR EXCLUSIVO,,,Peugeot,3008,,$13.990.000 (Rebajado 5%),13990000,2020,94'000,94000,Diesel
31770580,https://www.yapo.cl/autos-usados/hyundai-grand-i10-2023/31770580,HYUNDAI GRAND I10 2023,,,Hyundai,Grand i10,,$9.290.000,9290000,2023,57'487,57487,Bencina
31768155,https://www.yapo.cl/autos-usados/toyota-hilux-2021-4x2/31768155,TOYOTA HILUX 2021 4X2,,,Toyota,Hilux,,$17.990.000,17990000,2021,79'000,79000,Diesel
31459036,https://www.yapo.cl/autos-usados/ssangyong-rexton-aut-4x4-full-2018/31459036,SSANGYONG REXTON AUT 4x4 FULL 2018,,,SsangYong,Rexton,,$12.490.000 (Rebajado 11%),12490000,2018,173'000,173000,Diesel
31293950,https://www.yapo.cl/autos-usados/chevrolet-tahoe-z71-4x4-suv-ano-2021-full-ac-automatico-oferta/31293950,CHEVROLET TAHOE Z71 4X4 SUV AÑO 2021 FULL AC AUTOMATICO OFERTA,,,Chevrolet,Tahoe,,$44.990.000 (Rebajado 4%),44990000,2021,62'300,62300,Bencina
31256323,https://www.yapo.cl/autos-usados/toyota-yaris-sport-hb-1-5-mt-5-2021/31256323,TOYOTA YARIS SPORT HB 1.5 MT 5 2021,,,Toyota,Yaris,,$10.990.000 (Rebajado 4%),10990000,2021,41'667,41667,Bencina
31706888,https://www.yapo.cl/autos-usados/chevrolet-colorado-z71-4x4/31706888,CHEVROLET COLORADO Z71 4x4,,,Chevrolet,Colorado,,$8.990.000,8990000,2011,132'000,132000,Bencina
31747345,https://www.yapo.cl/autos-usados/changan-cs55-luxury-unico-dueno/31747345,Changan CS55 Luxury unico dueño,,,Changan,CS55,,$9.800.000,9800000,2021,76'500,76500,Bencina
31684887,https://www.yapo.cl/autos-usados/nissan-murano-4x4-3-5-aut-2016/31684887,NISSAN MURANO 4X4 3.5 AUT 2016,,,Nissan,Murano,,$10.900.000,10900000,2016,128'130,128130,Bencina
31656219,https://www.yapo.cl/autos-usados/oportunidad-unica-vendo-ford-explorer-2018/31656219,OPORTUNIDAD ÚNICA VENDO FORD EXPLORER 2018,,,Ford,Explorer,,$15.000.000,15000000,2018,88'000,88000,Bencina
31744690,https://www.yapo.cl/autos-usados/camioneta-marca-chevrolet-modelo-d-max-e5-dcab-2-5-ano-2018/31744690,CAMIONETA MARCA CHEVROLET MODELO D MAX E5 DCAB 2.5 AÑO 2018,,,Chevrolet,D-Max,,$8.600.000,8600000,2018,322'308,322308,Diesel
31746739,https://www.yapo.cl/autos-usados/volkswagen-golf-1-6-at-2019/31746739,VOLKSWAGEN GOLF 1.6 AT 2019,,,Volkswagen,Golf,,$12.890.000,12890000,2019,129'013,129013,Bencina
31799349,https://www.yapo.cl/autos-usados/mercedes-benz-e250-coupe-1-8-aut-2012/31799349,MERCEDES-BENZ E250 COUPE 1.8 AUT 2012,,,Mercedes Benz,E250,,$14.900.000,14900000,2012,122'222,122222,Bencina
31757625,https://www.yapo.cl/autos-usados/mitsubishi-l200-diesel-4x4-ano-2022/31757625,Mitsubishi L200 Diesel 4x4 año 2022,,,Mitsubishi,L 200,,$18.790.000,18790000,2022,48'000,48000,Diesel
31744580,https://www.yapo.cl/autos-usados/tation-wagon-marca-mazda-modelo-cx5-otto-2-0-aut-ano-2020/31744580,TATION WAGON Marca MAZDA Modelo CX5 OTTO 2.0 AUT Año 2020,,,Mazda,CX-05,,$15.000.000,15000000,2020,78'416,78416,Bencina
31746117,https://www.yapo.cl/autos-usados/furgon-renault-dokker-ano-2016/31746117,FURGON RENAULT DOKKER AÑO 2016,,,Renault,Dokker,,$3.900.000,3900000,2016,227'748,227748,Diesel
31815626,https://www.yapo.cl/autos-usados/great-wall-poer-plus-deluxe-4x4-at-2-0-2024/31815626,GREAT WALL POER PLUS DELUXE 4X4 AT 2.0 2024,,,Great Wall,POER,,$21.500.000,21500000,2024,62'557,62557,Diesel
31547466,https://www.yapo.cl/autos-usados/mazda-cx-5-gt-4x4-2-2-2016/31547466,Mazda Cx-5 Gt 4X4 2.2 2016,,,Mazda,CX-5,,$14.490.000 (Rebajado 3%),14490000,2016,106'000,106000,Diesel
31613899,https://www.yapo.cl/autos-usados/mitsubishi-outlander-2-0-at-4x2-2018/31613899,MITSUBISHI OUTLANDER 2.0 AT 4X2 2018,,,Mitsubishi,Outlander,,$10.500.000 (Rebajado 4%),10500000,2018,181'740,181740,Bencina
31673808,https://www.yapo.cl/autos-usados/ford-f-150-platinum-4x4-3-5-aut-2022/31673808,FORD F-150 PLATINUM 4X4 3.5 AUT 2022,,,Ford,F-150,,$36.900.000 (Rebajado 3%),36900000,2022,111'935,111935,Bencina
31687774,https://www.yapo.cl/autos-usados/suzuki-jimny-jlx-1-3-4x4-2012/31687774,SUZUKI JIMNY JLX 1.3 4X4 2012,,,Suzuki,Jimny,,$6.290.000,6290000,2012,150'864,150864,Bencina
31356289,https://www.yapo.cl/autos-usados/citroen-berlingo-2022/31356289,CITROEN BERLINGO 2022,,,Citroen,Berlingo,,$9.990.000 (Rebajado 9%),9990000,2022,160'167,160167,Diesel
31735299,https://www.yapo.cl/autos-usados/renault-express-2023/31735299,RENAULT EXPRESS 2023,,,Renault,Express,,$9.200.000,9200000,2023,55'000,55000,Diesel
31645062,https://www.yapo.cl/autos-usados/chevrolet-tracker-2024/31645062,CHEVROLET TRACKER 2024,,,Chevrolet,Tracker,,$11.990.000,11990000,2024,52'800,52800,Bencina
31581708,https://www.yapo.cl/autos-usados/camioneta-jmc-vigus-ano-2021-2-5-diesel-mt-4x2-full-equipo-ac/31581708,CAMIONETA JMC VIGUS AÑO 2021 2.5 DIESEL MT 4X2 FULL EQUIPO AC,,,JMC,Vigus,,$7.990.000 (Rebajado 9%),7990000,2021,89'226,89226,Diesel
31793040,https://www.yapo.cl/autos-usados/subaru-outback-2-5i-awd-aut-2008/31793040,Subaru Outback 2.5i AWD AUT 2008,,,Subaru,Outback,,$5.850.000 (Rebajado 14%),5850000,2008,130'000,130000,Bencina
31774480,https://www.yapo.cl/autos-usados/mg-zx-2023-zx-cvt-1-5-aut/31774480,MG Zx 2023 Zx Cvt 1.5 Aut,,,,ZX,,$9.990.000 (Rebajado 9%),9990000,2023,36'736,36736,Bencina
31664146,https://www.yapo.cl/autos-usados/volkswagen-virtus-2024/31664146,VOLKSWAGEN VIRTUS 2024,,,Volkswagen,Virtus,,$13.190.000 (Rebajado 7%),13190000,2024,23'800,23800,Bencina
31543573,https://www.yapo.cl/autos-usados/chevrolet-tracker-2024/31543573,CHEVROLET TRACKER 2024,,,Chevrolet,Tracker,,$11.990.000 (Rebajado 4%),11990000,2024,51'950,51950,Bencina
31481622,https://www.yapo.cl/autos-usados/chevrolet-tracker-2024/31481622,CHEVROLET TRACKER 2024,,,Chevrolet,Tracker,,$11.990.000 (Rebajado 4%),11990000,2024,40'739,40739,Bencina
31277207,https://www.yapo.cl/autos-usados/peugeot-landtrek-2023/31277207,PEUGEOT LANDTREK 2023,,,Peugeot,Landtrek,,$14.050.000 (Rebajado 10%),14050000,2023,127'067,127067,Diesel
31493664,https://www.yapo.cl/autos-usados/chevrolet/31493664,Chevrolet,,,Chevrolet,Equinox,,$10.250.000,10250000,2020,79'300,79300,Bencina
31686820,https://www.yapo.cl/autos-usados/hyundai-porter-2021/31686820,HYUNDAI PORTER 2021,,,Hyundai,Porter,,$13.400.000,13400000,2021,116'223,116223,Diesel
31538981,https://www.yapo.cl/autos-usados/volkswagen-virtus-2024/31538981,VOLKSWAGEN VIRTUS 2024,,,Volkswagen,Virtus,,$13.190.000 (Rebajado 9%),13190000,2024,20'043,20043,Bencina
31755943,https://www.yapo.cl/autos-usados/chevrolet-tracker-2024/31755943,CHEVROLET TRACKER 2024,,,Chevrolet,Tracker,,$11.990.000,11990000,2024,48'100,48100,Bencina
31758122,https://www.yapo.cl/autos-usados/suzuki-dzire-2023-dzire-gl-1-2/31758122,Suzuki Dzire 2023 Dzire Gl 1.2,,,Suzuki,Dzire,,$8.490.000 (Rebajado 6%),8490000,2023,62'348,62348,Bencina
31603886,https://www.yapo.cl/autos-usados/chevrolet-tracker-2024/31603886,CHEVROLET TRACKER 2024,,,Chevrolet,Tracker,,$11.990.000,11990000,2024,33'809,33809,Bencina
31682094,https://www.yapo.cl/autos-usados/volkswagen-virtus-2023/31682094,VOLKSWAGEN VIRTUS 2023,,,Volkswagen,Virtus,,$10.590.000,10590000,2023,60'742,60742,Bencina
31799984,https://www.yapo.cl/autos-usados/mg-zs/31799984,MG ZS,,,MG,ZS,,$8.990.000,8990000,2021,59'000,59000,Bencina
31732531,https://www.yapo.cl/autos-nuevos/great-wall-poer-azul-ano-2025/31732531,,,,Great Wall,POER,,$16.430.687,16430687,2025,23,23,Diesel
31643445,https://www.yapo.cl/autos-usados/suzuki-dzire-2022/31643445,SUZUKI DZIRE 2022,,,Suzuki,Dzire,,$7.990.000,7990000,2022,98'400,98400,Bencina
31758006,https://www.yapo.cl/autos-usados/chevrolet-spin-2023-spin-ltz-1-8-mt-3c/31758006,Chevrolet Spin 2023 Spin Ltz 1.8 Mt 3c,,,Chevrolet,Spin,,$10.990.000,10990000,2023,70'250,70250,Bencina
31478583,https://www.yapo.cl/autos-usados/chevrolet-tracker-2024/31478583,CHEVROLET TRACKER 2024,,,Chevrolet,Tracker,,$12.490.000,12490000,2024,42'000,42000,Bencina
31449145,https://www.yapo.cl/autos-usados/maxus-t60-2023/31449145,MAXUS T60 2023,,,Maxus,T60,,$11.500.000 (Rebajado 6%),11500000,2023,108'000,108000,Diesel
31534142,https://www.yapo.cl/autos-usados/mg-zx-2023/31534142,MG ZX 2023,,,,ZX,,$10.590.000,10590000,2023,62'183,62183,Bencina
31758014,https://www.yapo.cl/autos-usados/hyundai-elantra-2021-elantra-cn7-1-6-mt-plus/31758014,Hyundai Elantra 2021 Elantra Cn7 1.6 Mt Plus,,,Hyundai,Elantra,,$11.580.000 (Rebajado 3%),11580000,2021,93'200,93200,Bencina
31606080,https://www.yapo.cl/autos-usados/renault-express-2023/31606080,RENAULT EXPRESS 2023,,,Renault,Express,,$9.200.000,9200000,2023,64'730,64730,Diesel
31295682,https://www.yapo.cl/autos-usados/opel-corsa-2021/31295682,OPEL CORSA 2021,,,Opel,Corsa,,$8.990.000 (Rebajado 9%),8990000,2021,40'931,40931,Bencina
31321667,https://www.yapo.cl/autos-usados/mercedes-benz-c200/31321667,Mercedes Benz C200,Publicado 13/01/2026,2026-01-13,Mercedes Benz,C200,,$8.990.000 (Rebajado 5%),8990000,2009,118'000,118000,Bencina
31765954,https://www.yapo.cl/autos-usados/chevrolet-captiva-2023/31765954,CHEVROLET CAPTIVA 2023,Publicado 11/01/2026,2026-01-11,Chevrolet,Captiva,,$13.990.000,13990000,2023,28'326,28326,Bencina
31683017,https://www.yapo.cl/autos-usados/nissan-navara-2023/31683017,NISSAN NAVARA 2023,Publicado 11/01/2026,2026-01-11,Nissan,Navara,,$18.100.000,18100000,2023,84'573,84573,Diesel
29482062,https://www.yapo.cl/autos-usados/dfsk-d1-luxury-4x4/29482062,DFSK D1 LUXURY 4X4,Publicado 07/01/2026,2026-01-07,DFSK,D1 LUXURY 4X4,,$21.884.100,21884100,2025,30,30,Diesel
31762652,https://www.yapo.cl/autos-usados/mg-zx-2023-mg-zx-1-5-cvt-dlx/31762652,MG Zx 2023 Mg Zx 1.5 Cvt Dlx,Publicado 11/01/2026,2026-01-11,,ZX,,$11.690.000,11690000,2023,33'250,33250,Bencina
30953560,https://www.yapo.cl/autos-usados/chevrolet-tracker-2024/30953560,CHEVROLET TRACKER 2024,Publicado 11/01/2026,2026-01-11,Chevrolet,Tracker,,$11.490.000 (Rebajado 8%),11490000,2024,49'277,49277,Bencina
31543934,https://www.yapo.cl/autos-usados/chevrolet-tracker-2024/31543934,CHEVROLET TRACKER 2024,Publicado 11/01/2026,2026-01-11,Chevrolet,Tracker,,$11.990.000 (Rebajado 4%),11990000,2024,48'400,48400,Bencina
31561186,https://www.yapo.cl/autos-usados/chevrolet-tracker-2024/31561186,CHEVROLET TRACKER 2024,Publicado 11/01/2026,2026-01-11,Chevrolet,Tracker,,$11.990.000 (Rebajado 4%),11990000,2024,49'260,49260,Bencina
31594446,https://www.yapo.cl/autos-usados/hyundai-porter-2023/31594446,HYUNDAI PORTER 2023,Publicado 11/01/2026,2026-01-11,Hyundai,Porter,,$17.600.000 (Rebajado 5%),17600000,2023,61'000,61000,Diesel
31761150,https://www.yapo.cl/autos-usados/peugeot-expert-2-0-hdi-premuim-2018/31761150,PEUGEOT EXPERT 2.0 HDI PREMUIM 2018,Publicado 06/01/2026,2026-01-06,Peugeot,Expert,,$12.990.000,12990000,2018,170'000,170000,Diesel
31561188,https://www.yapo.cl/autos-usados/chevrolet-tracker-2024/31561188,CHEVROLET TRACKER 2024,Publicado 11/01/2026,2026-01-11,Chevrolet,Tracker,,$11.990.000 (Rebajado 4%),11990000,2024,55'448,55448,Bencina
31702779,https://www.yapo.cl/autos-usados/nissan-kicks-2023/31702779,NISSAN KICKS 2023,Publicado 11/01/2026,2026-01-11,Nissan,Kicks,,$15.990.000,15990000,2023,9'237,9237,Bencina
30935790,https://www.yapo.cl/autos-usados/peugeot-landtrek-2023/30935790,PEUGEOT LANDTREK 2023,Publicado 11/01/2026,2026-01-11,Peugeot,Landtrek,,$13.600.000 (Rebajado 12%),13600000,2023,103'356,103356,Diesel
31767795,https://www.yapo.cl/autos-usados/hyundai-porter-2021/31767795,HYUNDAI PORTER 2021,Publicado 11/01/2026,2026-01-11,Hyundai,Porter,,$13.400.000,13400000,2021,144'000,144000,Diesel
31731779,https://www.yapo.cl/autos-usados/citroen-c5-aircross-2020/31731779,CITROEN C5 AIRCROSS 2020,Publicado 09/01/2026,2026-01-09,Citroen,C5 Aircross,,$12.980.000,12980000,2020,80'700,80700,Bencina
31744200,https://www.yapo.cl/autos-usados/citroen-c3-2018-c3-aircross-bluehdi-1-6/31744200,Citroen C3 2018 C3 Aircross Bluehdi 1.6,Publicado 11/01/2026,2026-01-11,Citroen,C3,,$10.490.000,10490000,2018,80'125,80125,Diesel
31678938,https://www.yapo.cl/autos-usados/chery-tiggo-7-pro-2022/31678938,CHERY TIGGO 7 PRO 2022,Publicado 11/01/2026,2026-01-11,Chery,Tiggo 7 Pro,,$11.790.000 (Rebajado 5%),11790000,2022,43'500,43500,Bencina
31744215,https://www.yapo.cl/autos-usados/peugeot-allure-pack-puretech-100/31744215,Peugeot Allure Pack Puretech 100,Publicado 11/01/2026,2026-01-11,Peugeot,208,,$12.690.000,12690000,2023,28'993,28993,Bencina
31758028,https://www.yapo.cl/autos-usados/mazda-cx-3-2019-new-cx-3-r-2-0-aut/31758028,Mazda Cx-3 2019 New Cx 3 R 2.0 Aut,Publicado 11/01/2026,2026-01-11,Mazda,CX-3,,$13.990.000 (Rebajado 3%),13990000,2019,72'657,72657,Bencina
31614934,https://www.yapo.cl/autos-usados/chevrolet-tracker-2024/31614934,CHEVROLET TRACKER 2024,Publicado 11/01/2026,2026-01-11,Chevrolet,Tracker,,$11.990.000,11990000,2024,39'670,39670,Bencina
31783166,https://www.yapo.cl/autos-usados/ford-territory-2024/31783166,FORD TERRITORY 2024,Publicado 09/01/2026,2026-01-09,Ford,Territory,,$15.980.000,15980000,2024,37'900,37900,Bencina
31140088,https://www.yapo.cl/autos-usados/dfsk-cargo-box-2023-a-c/31140088,DFSK CARGO BOX 2023 A/C,Publicado 12/01/2026,2026-01-12,DFSK,CARGO BOX,,$6.790.000 (Rebajado 7%),6790000,2023,37'000,37000,Bencina
31250902,https://www.yapo.cl/autos-usados/hyundai-tucson-2023/31250902,HYUNDAI TUCSON 2023,Publicado 07/01/2026,2026-01-07,Hyundai,Tucson,,$16.490.000 (Rebajado 7%),16490000,2023,70'879,70879,Bencina
31659110,https://www.yapo.cl/autos-usados/maxus-t60-2023/31659110,MAXUS T60 2023,Publicado 11/01/2026,2026-01-11,Maxus,T60,,$11.000.000,11000000,2023,125'463,125463,Diesel
31611228,https://www.yapo.cl/autos-usados/chevrolet-onix-2023/31611228,CHEVROLET ONIX 2023,Publicado 11/01/2026,2026-01-11,Chevrolet,Onix,,$9.890.000,9890000,2023,22'350,22350,Bencina
31800015,https://www.yapo.cl/autos-usados/maxus-t60-glx/31800015,MAXUS T60 GLX,Publicado 09/01/2026,2026-01-09,Maxus,T60,,$15.900.000,15900000,2022,189'000,189000,Diesel
31643387,https://www.yapo.cl/autos-usados/chevrolet-tracker-2024/31643387,CHEVROLET TRACKER 2024,Publicado 07/01/2026,2026-01-07,Chevrolet,Tracker,,$11.990.000,11990000,2024,46'827,46827,Bencina
31505389,https://www.yapo.cl/autos-usados/omoda-c5-luxury/31505389,Omoda C5 Luxury,Publicado 08/01/2026,2026-01-08,Omoda,C5 Luxury,,$12.900.000,12900000,2024,41'000,41000,Bencina
31775182,https://www.yapo.cl/autos-usados/mitsubishi-montero-4x4-3-8-cc/31775182,MITSUBISHI MONTERO 4X4 3.8 CC,Publicado 10/01/2026,2026-01-10,Mitsubishi,Montero GLS,,$5.200.000,5200000,2003,150'000,150000,Bencina
30278308,https://www.yapo.cl/autos-usados/volkswagen-amarok-2022/30278308,VOLKSWAGEN AMAROK 2022,Publicado 04/01/2026,2026-01-04,Volkswagen,Amarok,,$17.990.000,17990000,2022,145'000,145000,Diesel
31740143,https://www.yapo.cl/autos-usados/honda-hr-v-lx-1-8-at/31740143,Honda HR V LX 1.8 AT,Publicado 04/01/2026,2026-01-04,Honda,HR-V,,$12.590.000,12590000,2018,95'032,95032,Bencina
31626294,https://www.yapo.cl/autos-usados/toyota-yaris-2015/31626294,TOYOTA YARIS 2015,Publicado 07/01/2026,2026-01-07,Toyota,Yaris,,$6.490.000,6490000,2015,40'094,40094,Bencina
31471322,https://www.yapo.cl/autos-usados/chevrolet-tracker-2025/31471322,CHEVROLET TRACKER 2025,Publicado 07/01/2026,2026-01-07,Chevrolet,Tracker,,$16.890.000 (Rebajado 2%),16890000,2025,5'037,5037,Bencina
31856069,https://www.yapo.cl/autos-nuevos/chevrolet-sail-sedan/31856069,,Publicado 13/01/2026,2026-01-13,Chevrolet,Sail,,$9.990.000,9990000,2026,,,Bencina
31776858,https://www.yapo.cl/autos-usados/chevrolet-colorado-2023/31776858,CHEVROLET COLORADO 2023,Publicado 07/01/2026,2026-01-07,Chevrolet,Colorado,,$22.100.000,22100000,2023,63'000,63000,Diesel
31596354,https://www.yapo.cl/autos-usados/kia-seltos-2024/31596354,KIA SELTOS 2024,Publicado 06/01/2026,2026-01-06,Kia,Seltos,,$15.990.000,15990000,2024,39'000,39000,Bencina
30317375,https://www.yapo.cl/autos-usados/chevrolet-onix-2024/30317375,CHEVROLET ONIX 2024,Publicado 07/01/2026,2026-01-07,Chevrolet,Onix,,$10.990.000 (Rebajado 1%),10990000,2024,3'840,3840,Bencina
31825991,https://www.yapo.cl/autos-usados/chevrolet-tracker-2024/31825991,CHEVROLET TRACKER 2024,Publicado 07/01/2026,2026-01-07,Chevrolet,Tracker,,$11.990.000,11990000,2024,33'590,33590,Bencina
31588080,https://www.yapo.cl/autos-usados/mg-3-2022/31588080,MG 3 2022,Publicado 05/01/2026,2026-01-05,,MG3,,$7.690.000,7690000,2022,38'764,38764,Bencina
31078446,https://www.yapo.cl/autos-usados/peugeot-2008-2023/31078446,PEUGEOT 2008 2023,Publicado 05/01/2026,2026-01-05,Peugeot,2008,,$12.990.000 (Rebajado 2%),12990000,2023,52'173,52173,Bencina
31829306,https://www.yapo.cl/autos-usados/maxus-c35-l/31829306,MAXUS C35 L,Publicado 07/01/2026,2026-01-07,Maxus,C35,,$15.900.000,15900000,2023,71'000,71000,Diesel
31746092,https://www.yapo.cl/autos-usados/furgon-marca-renault-modelo-dokker-iii-1-6-ano-2017/31746092,FURGON MARCA RENAULT MODELO DOKKER III 1.6 AÑO 2017,Publicado 05/01/2026,2026-01-05,Renault,Dokker,,$4.500.000,4500000,2018,166'677,166677,Bencina
31585324,https://www.yapo.cl/autos-usados/volkswagen-saveiro-2024/31585324,VOLKSWAGEN SAVEIRO 2024,Publicado 06/01/2026,2026-01-06,Volkswagen,Saveiro,,$13.990.000,13990000,2024,8'588,8588,Bencina
31730086,https://www.yapo.cl/autos-usados/toyota-rush-2023/31730086,TOYOTA RUSH 2023,Publicado 07/01/2026,2026-01-07,Toyota,Rush,,$11.790.000,11790000,2023,35'425,35425,Bencina
31483343,https://www.yapo.cl/autos-usados/fiat-pulse-2023/31483343,FIAT PULSE 2023,Publicado 07/01/2026,2026-01-07,Fiat,Pulse,,$13.290.000,13290000,2023,44'600,44600,Bencina
31772868,https://www.yapo.cl/autos-usados/toyota-raize-2025/31772868,TOYOTA RAIZE 2025,Publicado 06/01/2026,2026-01-06,Toyota,Raize,,$12.500.000,12500000,2025,22'168,22168,Bencina
31747890,https://www.yapo.cl/autos-usados/furgon-marca-fiat-modelo-fiorino-fire-elx-1-4-ano-2017/31747890,FURGON MARCA FIAT MODELO FIORINO FIRE ELX 1.4 AÑO 2017,Publicado 05/01/2026,2026-01-05,Fiat,Fiorino,,$3.200.000,3200000,2017,131'898,131898,Bencina
31672129,https://www.yapo.cl/autos-usados/peugeot-3008/31672129,Peugeot 3008,Publicado 07/01/2026,2026-01-07,Peugeot,3008,,$19.990.000,19990000,2025,46,46,Bencina
31696556,https://www.yapo.cl/autos-usados/hyundai-i30-2013-full-1-6-gls-crdi-diesel/31696556,Hyundai i30 2013 Full 1.6 GLS CRDI Diesel,Publicado 05/01/2026,2026-01-05,Hyundai,i30,,$10.500.000,10500000,2013,87'544,87544,Diesel
31760864,https://www.yapo.cl/autos-usados/suzuki-jimny-2022/31760864,SUZUKI JIMNY 2022,Publicado 06/01/2026,2026-01-06,Suzuki,Jimny,,$12.500.000,12500000,2022,91'940,91940,Bencina
31678202,https://www.yapo.cl/autos-usados/toyota-hilux-2023/31678202,TOYOTA HILUX 2023,Publicado 07/01/2026,2026-01-07,Toyota,Hilux,,$17.000.000,17000000,2023,65'680,65680,Diesel
31788188,https://www.yapo.cl/autos-usados/kia-morning-2023/31788188,KIA MORNING 2023,Publicado 05/01/2026,2026-01-05,Kia,Morning,,$9.290.000,9290000,2023,13'963,13963,Bencina
31856224,https://www.yapo.cl/autos-nuevos/chevrolet-silverado/31856224,,Publicado 13/01/2026,2026-01-13,Chevrolet,Silverado,,$41.990.000,41990000,2026,,,Bencina
31803647,https://www.yapo.cl/autos-usados/citroen-c3-2023/31803647,CITROEN C3 2023,Publicado 07/01/2026,2026-01-07,Citroen,C3,,$10.190.000,10190000,2023,75'000,75000,Diesel
31426218,https://www.yapo.cl/autos-usados/nissan-versa-sence-2015-automatico/31426218,Nissan Versa sence 2015 automático,Publicado 05/01/2026,2026-01-05,Nissan,Versa,,$8.500.000,8500000,2015,92'000,92000,Bencina
31801578,https://www.yapo.cl/autos-usados/suzuki-grand-nomade-glx-sport-2-4-2013/31801578,Suzuki Grand Nomade Glx Sport 2.4 2013,Publicado 06/01/2026,2026-01-06,Suzuki,Grand Nomade,,$10.990.000,10990000,2013,27'000,27000,Bencina
31844911,https://www.yapo.cl/autos-usados/honda-city-lx-2014/31844911,Honda City LX 2014,Publicado 10/01/2026,2026-01-10,Honda,City,,$6.490.000,6490000,2014,142'000,142000,Bencina
31359151,https://www.yapo.cl/autos-usados/opel-corsa-2020/31359151,OPEL CORSA 2020,Publicado 07/01/2026,2026-01-07,Opel,Corsa,,$10.990.000,10990000,2020,41'775,41775,Bencina
31791643,https://www.yapo.cl/autos-usados/mitsubishi-outlander-2019/31791643,MITSUBISHI OUTLANDER 2019,Publicado 06/01/2026,2026-01-06,Mitsubishi,Outlander,,$11.490.000,11490000,2019,76'000,76000,Bencina
31732580,https://www.yapo.cl/autos-usados/kia-sonet-2024/31732580,KIA SONET 2024,Publicado 05/01/2026,2026-01-05,Kia,Sonet,,$14.490.000 (Rebajado 9%),14490000,2024,47'268,47268,Bencina
31740170,https://www.yapo.cl/autos-usados/chevrolet-onix-2024/31740170,CHEVROLET ONIX 2024,Publicado 07/01/2026,2026-01-07,Chevrolet,Onix,,$12.790.000,12790000,2024,38'880,38880,Bencina
31713813,https://www.yapo.cl/autos-usados/peugeot-2008-2022/31713813,PEUGEOT 2008 2022,Publicado 12/01/2026,2026-01-12,Peugeot,2008,,$15.990.000,15990000,2022,52'118,52118,Diesel
31764459,https://www.yapo.cl/autos-usados/toyota-raize-2025/31764459,TOYOTA RAIZE 2025,Publicado 06/01/2026,2026-01-06,Toyota,Raize,,$12.500.000,12500000,2025,20'316,20316,Bencina
31796751,https://www.yapo.cl/autos-usados/subaru-forester-cvt-4x4-au/31796751,SUBARU Forester CVT 4x4 Au,Publicado 13/01/2026,2026-01-13,Subaru,Forester,,$17.990.000,17990000,2020,87'931,87931,Bencina
31518267,https://www.yapo.cl/autos-usados/fiat/31518267,Fiat,Publicado 07/01/2026,2026-01-07,Fiat,500,,$5.390.000 (Rebajado 2%),5390000,2015,181'000,181000,Bencina
31795924,https://www.yapo.cl/autos-usados/peugeot-208-2022/31795924,PEUGEOT 208 2022,Publicado 07/01/2026,2026-01-07,Peugeot,208,,$11.990.000,11990000,2022,22'000,22000,Bencina
31740172,https://www.yapo.cl/autos-usados/chevrolet-onix-2024/31740172,CHEVROLET ONIX 2024,Publicado 07/01/2026,2026-01-07,Chevrolet,Onix,,$12.790.000,12790000,2024,32'343,32343,Bencina
31797994,https://www.yapo.cl/autos-usados/ford-new-ranger-ltd-2-5/31797994,Ford New Ranger LTD 2.5,Publicado 13/01/2026,2026-01-13,Ford,Ranger,,$19.990.000,19990000,2021,50'298,50298,Bencina
31578025,https://www.yapo.cl/autos-usados/jmc-vigus-work-2-5-2023/31578025,Jmc Vigus Work 2.5 2023,Publicado 07/01/2026,2026-01-07,JMC,Vigus,,$9.990.000,9990000,2023,142'000,142000,Diesel
31400696,https://www.yapo.cl/autos-usados/chevrolet-tracker-2024/31400696,CHEVROLET TRACKER 2024,Publicado 07/01/2026,2026-01-07,Chevrolet,Tracker,,$11.000.000 (Rebajado 8%),11000000,2024,35'284,35284,Bencina
31768053,https://www.yapo.cl/autos-usados/chevrolet-onix-2024/31768053,CHEVROLET ONIX 2024,Publicado 07/01/2026,2026-01-07,Chevrolet,Onix,,$13.490.000,13490000,2024,40'410,40410,Bencina
31784889,https://www.yapo.cl/autos-usados/great-wall-poer-4x2-mt-2-0/31784889,Great Wall Poer 4x2 MT 2.0,Publicado 06/01/2026,2026-01-06,Great Wall,POER,,$18.490.000,18490000,2025,38'179,38179,Diesel
31633227,https://www.yapo.cl/autos-usados/hyundai-accent-2016/31633227,Hyundai Accent 2016,Publicado 04/01/2026,2026-01-04,Hyundai,Accent,,$7.990.000,7990000,2016,193'554,193554,Bencina
31757152,https://www.yapo.cl/autos-usados/vendo-subaru-station-wagon-xv-cvt-2-0-aut-poco-uso-32600-km/31757152,Vendo Subaru Station Wagon XV CVT 2.0 AUT. POCO USO. 32600 km,Publicado 05/01/2026,2026-01-05,Subaru,XV,,$17.800.000,17800000,2021,32'600,32600,Bencina
31746112,https://www.yapo.cl/autos-usados/furgon-marca-renault-modelo-dokker-iii-1-5-ano-2016/31746112,FURGON MARCA RENAULT MODELO DOKKER III 1.5 AÑO 2016,Publicado 05/01/2026,2026-01-05,Renault,Dokker,,$3.900.000,3900000,2016,253'798,253798,Diesel
31544357,https://www.yapo.cl/autos-usados/auto-bmw-2019-modelo-118/31544357,Auto BMW 2019 modelo 118,Publicado 07/01/2026,2026-01-07,BMW,118i,,$13.900.000 (Rebajado 5%),13900000,2019,94'000,94000,Bencina
30892997,https://www.yapo.cl/autos-usados/ds-ds-3-2023/30892997,DS DS 3 2023,Publicado 06/01/2026,2026-01-06,DS,3,,$22.990.000 (Rebajado 22%),22990000,2023,18'469,18469,Eléctrico
31651032,https://www.yapo.cl/autos-usados/mg-hs-2023/31651032,MG HS 2023,Publicado 05/01/2026,2026-01-05,,HS,,$11.890.000,11890000,2023,16'000,16000,Bencina
31682083,https://www.yapo.cl/autos-usados/chevrolet-traverse-2016/31682083,CHEVROLET TRAVERSE 2016,Publicado 07/01/2026,2026-01-07,Chevrolet,Traverse,,$11.990.000,11990000,2016,86'272,86272,Bencina
31788067,https://www.yapo.cl/autos-usados/kia-rio-4-2021/31788067,KIA RIO 4 2021,Publicado 05/01/2026,2026-01-05,Kia,other,,$10.590.000,10590000,2021,75'384,75384,Bencina
31594455,https://www.yapo.cl/autos-usados/kia-seltos-2024/31594455,KIA SELTOS 2024,Publicado 05/01/2026,2026-01-05,Kia,Seltos,,$19.290.000 (Rebajado 4%),19290000,2024,40'158,40158,Bencina
31686778,https://www.yapo.cl/autos-usados/volvo-xc60-t6-awd-r-desing-2020/31686778,VOLVO XC60 T6 AWD R-DESING 2020,Publicado 04/01/2026,2026-01-04,Volvo,XC60,,$27.990.000 (Rebajado 6%),27990000,2020,155'000,155000,Bencina
31709134,https://www.yapo.cl/autos-usados/jeep-grand-cherokee-2022/31709134,JEEP GRAND CHEROKEE 2022,Publicado 07/01/2026,2026-01-07,Jeep,Grand Cherokee,,$28.990.000,28990000,2022,71'557,71557,Bencina
31792486,https://www.yapo.cl/autos-usados/crevrolet-cruze-1-8-2010-full-automatico/31792486,Crevrolet Cruze 1.8 2010 full automático,Publicado 06/01/2026,2026-01-06,Chevrolet,Cruze,,$2.500.000 (Rebajado 11%),2500000,2010,106'000,106000,Bencina
31750811,https://www.yapo.cl/autos-usados/chevrolet-sail-2020/31750811,CHEVROLET SAIL 2020,Publicado 07/01/2026,2026-01-07,Chevrolet,Sail,,$6.990.000,6990000,2020,68'981,68981,Bencina
31837476,https://www.yapo.cl/autos-usados/kia-cerato-5-2020/31837476,KIA CERATO 5 2020,Publicado 12/01/2026,2026-01-12,Kia,Cerato,,$14.490.000,14490000,2020,57'773,57773,Bencina
31488061,https://www.yapo.cl/autos-usados/ram-1000-2021/31488061,RAM 1000 2021,Publicado 06/01/2026,2026-01-06,Ram,1000,,$12.490.000 (Rebajado 7%),12490000,2021,109'567,109567,Bencina
31521595,https://www.yapo.cl/autos-usados/chevrolet-groove-2023/31521595,CHEVROLET GROOVE 2023,Publicado 07/01/2026,2026-01-07,Chevrolet,Groove,,$9.690.000,9690000,2023,8'000,8000,Bencina
31785314,https://www.yapo.cl/autos-usados/opel-corsa-2022/31785314,OPEL CORSA 2022,Publicado 07/01/2026,2026-01-07,Opel,Corsa,,$10.730.000,10730000,2022,29'503,29503,Bencina
31188327,https://www.yapo.cl/autos-usados/opel-crossland-edition-1-2t-mt/31188327,OPEL CROSSLAND EDITION 1.2T MT,Publicado 04/01/2026,2026-01-04,Opel,Crossland,,$11.990.000 (Rebajado 4%),11990000,2023,32'660,32660,Bencina
31678641,https://www.yapo.cl/autos-usados/suzuki-swift-2023/31678641,SUZUKI SWIFT 2023,Publicado 07/01/2026,2026-01-07,Suzuki,Swift,,$9.990.000,9990000,2023,56'000,56000,Bencina
31497311,https://www.yapo.cl/autos-usados/chevrolet-tracker-2024/31497311,CHEVROLET TRACKER 2024,Publicado 07/01/2026,2026-01-07,Chevrolet,Tracker,,$12.190.000 (Rebajado 2%),12190000,2024,52'487,52487,Bencina
31584390,https://www.yapo.cl/autos-usados/chevrolet-onix-2024/31584390,CHEVROLET ONIX 2024,Publicado 07/01/2026,2026-01-07,Chevrolet,Onix,,$13.490.000,13490000,2024,44'497,44497,Bencina
31819129,https://www.yapo.cl/autos-usados/chevrolet-onix-2024/31819129,CHEVROLET ONIX 2024,Publicado 07/01/2026,2026-01-07,Chevrolet,Onix,,$13.490.000,13490000,2024,29'818,29818,Bencina
31566452,https://www.yapo.cl/autos-usados/chevrolet-montana-2023/31566452,CHEVROLET MONTANA 2023,Publicado 07/01/2026,2026-01-07,Chevrolet,Montana,,$15.490.000,15490000,2023,60'520,60520,Bencina
31579148,https://www.yapo.cl/autos-usados/hyundai-porter-2022/31579148,HYUNDAI PORTER 2022,Publicado 07/01/2026,2026-01-07,Hyundai,Porter,,$15.990.000,15990000,2022,149'245,149245,Diesel
31796912,https://www.yapo.cl/autos-usados/chevrolet-tracker-2025/31796912,CHEVROLET TRACKER 2025,Publicado 07/01/2026,2026-01-07,Chevrolet,Tracker,,$16.090.000,16090000,2025,21'229,21229,Bencina
31756340,https://www.yapo.cl/autos-usados/toyota-raize-2022/31756340,TOYOTA RAIZE 2022,Publicado 07/01/2026,2026-01-07,Toyota,Raize,,$10.790.000,10790000,2022,94'293,94293,Bencina
31664432,https://www.yapo.cl/autos-usados/great-wall-poer-plus-4x4-2-0-at/31664432,GREAT WALL POER PLUS 4x4 2.0 AT,Publicado 06/01/2026,2026-01-06,Great Wall,POER,,$21.690.000 (Rebajado 1%),21690000,2024,24'090,24090,Diesel
31730259,https://www.yapo.cl/autos-usados/toyota-yaris-2017/31730259,TOYOTA YARIS 2017,Publicado 06/01/2026,2026-01-06,Toyota,Yaris,,$8.990.000,8990000,2017,68'321,68321,Bencina
31819131,https://www.yapo.cl/autos-usados/chevrolet-onix-2024/31819131,CHEVROLET ONIX 2024,Publicado 07/01/2026,2026-01-07,Chevrolet,Onix,,$13.690.000,13690000,2024,36'901,36901,Bencina
31266718,https://www.yapo.cl/autos-usados/toyota-hilux-2023/31266718,TOYOTA HILUX 2023,Publicado 07/01/2026,2026-01-07,Toyota,Hilux,,$15.900.000,15900000,2023,61'853,61853,Diesel
31477585,https://www.yapo.cl/autos-usados/kia-sportage-2021-81-751-kms/31477585,"Kia Sportage 2021, 81.751 Kms",Publicado 04/01/2026,2026-01-04,Kia,Sportage,,$15.990.000,15990000,2021,81'751,81751,Bencina
31669682,https://www.yapo.cl/autos-usados/mg-5-2022/31669682,MG 5 2022,Publicado 05/01/2026,2026-01-05,,other,,$7.890.000,7890000,2022,63'870,63870,Bencina
31796091,https://www.yapo.cl/autos-usados/peugeot-partner-2023/31796091,PEUGEOT PARTNER 2023,Publicado 07/01/2026,2026-01-07,Peugeot,Partner,,$12.990.000 (Rebajado 4%),12990000,2023,87'000,87000,Diesel
31537893,https://www.yapo.cl/autos-usados/citroen-c3-2023/31537893,CITROEN C3 2023,Publicado 07/01/2026,2026-01-07,Citroen,C3,,$9.590.000 (Rebajado 7%),9590000,2023,77'119,77119,Diesel
31572809,https://www.yapo.cl/autos-usados/chevrolet-captiva-2022/31572809,CHEVROLET CAPTIVA 2022,Publicado 06/01/2026,2026-01-06,Chevrolet,Captiva,,$11.990.000 (Rebajado 4%),11990000,2022,41'000,41000,Bencina
31790435,https://www.yapo.cl/autos-usados/mg-zx-2023/31790435,MG ZX 2023,Publicado 05/01/2026,2026-01-05,,ZX,,$9.240.000,9240000,2023,60'868,60868,Bencina
31469863,https://www.yapo.cl/autos-usados/peugeot-landtrek-2023/31469863,PEUGEOT LANDTREK 2023,Publicado 06/01/2026,2026-01-06,Peugeot,Landtrek,,$12.900.000,12900000,2023,76'370,76370,Diesel
31436743,https://www.yapo.cl/autos-usados/oportunidad-ford-explores-2022/31436743,"OPORTUNIDAD, FORD EXPLORES 2022",Publicado 13/01/2026,2026-01-13,Ford,Explorer,,$28.000.000 (Rebajado 7%),28000000,2022,33'000,33000,Bencina
31693425,https://www.yapo.cl/autos-usados/renault-symbol-2022/31693425,RENAULT SYMBOL 2022,Publicado 07/01/2026,2026-01-07,Renault,Symbol,,$6.990.000 (Rebajado 7%),6990000,2022,40'231,40231,Bencina
31701291,https://www.yapo.cl/autos-usados/chevrolet-groove-2021/31701291,CHEVROLET GROOVE 2021,Publicado 05/01/2026,2026-01-05,Chevrolet,Groove,,$10.290.000,10290000,2021,43'066,43066,Bencina
31770431,https://www.yapo.cl/autos-usados/hyundai-porter-2021/31770431,HYUNDAI PORTER 2021,Publicado 07/01/2026,2026-01-07,Hyundai,Porter,,$13.890.000,13890000,2021,103'065,103065,Diesel
31756081,https://www.yapo.cl/autos-usados/great-wall-poer-4x4-2-0-mt/31756081,Great Wall Poer 4x4 2.0 MT,Publicado 06/01/2026,2026-01-06,Great Wall,POER,,$19.990.000,19990000,2025,34'207,34207,Diesel
31824806,https://www.yapo.cl/autos-usados/citroen-c3-2023/31824806,CITROEN C3 2023,Publicado 07/01/2026,2026-01-07,Citroen,C3,,$8.990.000,8990000,2023,70'768,70768,Bencina
31205048,https://www.yapo.cl/autos-usados/mercedes-benz-c-300-2-0-coupe-2019/31205048,Mercedes Benz C 300 2.0 Coupe 2019,Publicado 07/01/2026,2026-01-07,Mercedes Benz,C 300,,$32.990.000 (Rebajado 6%),32990000,2019,42'000,42000,Bencina
31740213,https://www.yapo.cl/autos-usados/citroen-c3-2024/31740213,CITROEN C3 2024,Publicado 06/01/2026,2026-01-06,Citroen,C3,,$12.790.000,12790000,2024,38'331,38331,Diesel
31436889,https://www.yapo.cl/autos-usados/volkswagen-saveiro-2021/31436889,VOLKSWAGEN SAVEIRO 2021,Publicado 07/01/2026,2026-01-07,Volkswagen,Saveiro,,$6.490.000 (Rebajado 20%),6490000,2021,88'047,88047,Bencina
31471390,https://www.yapo.cl/autos-usados/chevrolet-tracker-2025/31471390,CHEVROLET TRACKER 2025,Publicado 23/12/2025,2025-12-23,Chevrolet,Tracker,,$16.490.000 (Rebajado 2%),16490000,2025,8'230,8230,Bencina
31156060,https://www.yapo.cl/autos-usados/kia-morning-2023/31156060,KIA MORNING 2023,Publicado 05/01/2026,2026-01-05,Kia,Morning,,$9.990.000 (Rebajado 6%),9990000,2023,29'995,29995,Bencina
31784651,https://www.yapo.cl/autos-usados/hyundai-kona-2023/31784651,HYUNDAI KONA 2023,Publicado 06/01/2026,2026-01-06,Hyundai,Kona,,$18.900.000,18900000,2023,37'587,37587,Eléctrico
31740216,https://www.yapo.cl/autos-usados/exeed-lx-2024/31740216,EXEED LX 2024,Publicado 06/01/2026,2026-01-06,Exeed,LX,,$14.790.000,14790000,2024,33'318,33318,Bencina
30597300,https://www.yapo.cl/autos-usados/peugeot-5008-2022/30597300,PEUGEOT 5008 2022,Publicado 07/01/2026,2026-01-07,Peugeot,5008,,$23.290.000 (Rebajado 3%),23290000,2022,62'300,62300,Bencina
31740217,https://www.yapo.cl/autos-usados/hyundai-creta-2024/31740217,HYUNDAI CRETA 2024,Publicado 06/01/2026,2026-01-06,Hyundai,Creta,,$18.690.000,18690000,2024,5'445,5445,Bencina
31370929,https://www.yapo.cl/autos-usados/chery-tiggo-8-pro-2023/31370929,CHERY TIGGO 8 PRO 2023,Publicado 06/01/2026,2026-01-06,Chery,Tiggo 8 Pro,,$15.990.000 (Rebajado 6%),15990000,2023,16'000,16000,Bencina
31616984,https://www.yapo.cl/autos-usados/nissan-kicks-2023/31616984,NISSAN KICKS 2023,Publicado 07/01/2026,2026-01-07,Nissan,Kicks,,$12.890.000,12890000,2023,63'698,63698,Bencina
31543016,https://www.yapo.cl/autos-usados/chevrolet-captiva-2022/31543016,CHEVROLET CAPTIVA 2022,Publicado 07/01/2026,2026-01-07,Chevrolet,Captiva,,$13.290.000,13290000,2022,14'392,14392,Bencina
31790451,https://www.yapo.cl/autos-usados/kia-morning-2025/31790451,KIA MORNING 2025,Publicado 07/01/2026,2026-01-07,Kia,Morning,,$13.290.000,13290000,2025,14'018,14018,Bencina
31061537,https://www.yapo.cl/autos-usados/peugeot-landtrek-2023/31061537,PEUGEOT LANDTREK 2023,Publicado 06/01/2026,2026-01-06,Peugeot,Landtrek,,$12.900.000 (Rebajado 7%),12900000,2023,63'971,63971,Diesel
31518041,https://www.yapo.cl/autos-usados/kia-morning-2023/31518041,KIA MORNING 2023,Publicado 05/01/2026,2026-01-05,Kia,Morning,,$8.590.000,8590000,2023,89'598,89598,Bencina
31736495,https://www.yapo.cl/autos-usados/nissan-versa-2025/31736495,NISSAN VERSA 2025,Publicado 06/01/2026,2026-01-06,Nissan,Versa,,$14.290.000,14290000,2025,1'700,1700,Bencina
31834890,https://www.yapo.cl/autos-usados/mercedes-benz-gla/31834890,Mercedes Benz Gla,Publicado 08/01/2026,2026-01-08,Mercedes Benz,GLA 200,,$19.990.000,19990000,2021,107'000,107000,Bencina
31410266,https://www.yapo.cl/autos-usados/chevrolet-onix-2024/31410266,CHEVROLET ONIX 2024,Publicado 07/01/2026,2026-01-07,Chevrolet,Onix,,$13.290.000 (Rebajado 1%),13290000,2024,27'118,27118,Bencina
31609676,https://www.yapo.cl/autos-usados/mitsubishi-l200-2022/31609676,MITSUBISHI L200 2022,Publicado 07/01/2026,2026-01-07,Mitsubishi,L 200,,$14.790.000,14790000,2022,106'810,106810,Diesel
31663497,https://www.yapo.cl/autos-usados/bmw-218-2024/31663497,BMW 218 2024,Publicado 05/01/2026,2026-01-05,BMW,other,,$28.790.000,28790000,2024,38'985,38985,Bencina
31637829,https://www.yapo.cl/autos-usados/suzuki-s-cross-2021/31637829,SUZUKI S-CROSS 2021,Publicado 05/01/2026,2026-01-05,Suzuki,S-Cross,,$10.890.000,10890000,2021,31'866,31866,Bencina
31354792,https://www.yapo.cl/autos-usados/chevrolet-tracker-2024/31354792,CHEVROLET TRACKER 2024,Publicado 07/01/2026,2026-01-07,Chevrolet,Tracker,,$11.490.000 (Rebajado 4%),11490000,2024,46'200,46200,Bencina
31747817,https://www.yapo.cl/autos-usados/fiat-fiorino-2014-motor-1-4-furgon-comercial-con-asiento-trasero-250-000-km-4-200-000-clp/31747817,Fiat Fiorino 2014 – Motor 1.4 – Furgón Comercial con Asiento Trasero – 250.000 km – $4.200.000 CLP,Publicado 03/01/2026,2026-01-03,Fiat,Fiorino,,$4.200.000,4200000,2014,250'000,250000,Bencina
31562621,https://www.yapo.cl/autos-usados/chevrolet-onix-2024/31562621,CHEVROLET ONIX 2024,Publicado 07/01/2026,2026-01-07,Chevrolet,Onix,,$13.490.000,13490000,2024,36'156,36156,Bencina
31533228,https://www.yapo.cl/autos-usados/chevrolet-tracker-2024/31533228,CHEVROLET TRACKER 2024,Publicado 07/01/2026,2026-01-07,Chevrolet,Tracker,,$12.490.000,12490000,2024,49'000,49000,Bencina
31678680,https://www.yapo.cl/autos-usados/chevrolet-tracker-2024/31678680,CHEVROLET TRACKER 2024,Publicado 07/01/2026,2026-01-07,Chevrolet,Tracker,,$11.990.000,11990000,2024,47'104,47104,Bencina
31543165,https://www.yapo.cl/autos-usados/hyundai-accent-hci-1-4/31543165,HYUNDAI ACCENT HCI 1.4,Publicado 04/01/2026,2026-01-04,Hyundai,Accent,,$9.990.000 (Rebajado 9%),9990000,2022,154'402,154402,Bencina
31748924,https://www.yapo.cl/autos-usados/chevrolet-sail-2014/31748924,CHEVROLET SAIL 2014,Publicado 07/01/2026,2026-01-07,Chevrolet,Sail,,$3.590.000,3590000,2014,62'245,62245,Bencina
31275309,https://www.yapo.cl/autos-usados/toyota-prius-2018/31275309,TOYOTA PRIUS 2018,Publicado 07/01/2026,2026-01-07,Toyota,Prius,,$12.990.000,12990000,2018,148'081,148081,Bencina
31742991,https://www.yapo.cl/autos-usados/mitsubishi-outlander-2018/31742991,MITSUBISHI OUTLANDER 2018,Publicado 12/01/2026,2026-01-12,Mitsubishi,Outlander,,$12.990.000,12990000,2018,79'000,79000,Bencina
31277242,https://www.yapo.cl/autos-usados/renault-express-2022/31277242,RENAULT EXPRESS 2022,Publicado 07/01/2026,2026-01-07,Renault,Express,,$7.400.000 (Rebajado 18%),7400000,2022,117'359,117359,Diesel
30801832,https://www.yapo.cl/autos-usados/jac-s5-2015/30801832,JAC S5 2015,Publicado 06/01/2026,2026-01-06,Jac,S5,,$4.990.000,4990000,2015,123'000,123000,Bencina
31788119,https://www.yapo.cl/autos-usados/chevrolet-sail-2024/31788119,CHEVROLET SAIL 2024,Publicado 07/01/2026,2026-01-07,Chevrolet,Sail,,$10.590.000,10590000,2024,11'143,11143,Bencina
31740233,https://www.yapo.cl/autos-usados/hyundai-santa-fe-2025/31740233,HYUNDAI SANTA FE 2025,Publicado 06/01/2026,2026-01-06,Hyundai,Santa Fe,,$36.590.000 (Rebajado 3%),36590000,2025,1'653,1653,Bencina
31507428,https://www.yapo.cl/autos-usados/citroen-c4-2023/31507428,CITROEN C4 2023,Publicado 07/01/2026,2026-01-07,Citroen,C4,,$15.990.000,15990000,2023,46'662,46662,Diesel
31736922,https://www.yapo.cl/autos-usados/kia-rio-5-2021/31736922,KIA RIO 5 2021,Publicado 12/01/2026,2026-01-12,Kia,other,,$10.590.000,10590000,2021,65'746,65746,Bencina
31447675,https://www.yapo.cl/autos-usados/chevrolet-tracker-2025/31447675,CHEVROLET TRACKER 2025,Publicado 07/01/2026,2026-01-07,Chevrolet,Tracker,,$16.890.000 (Rebajado 2%),16890000,2025,5'872,5872,Bencina
31798195,https://www.yapo.cl/autos-usados/ssangyong-korando-2013/31798195,SSANGYONG KORANDO 2013,Publicado 07/01/2026,2026-01-07,SsangYong,Korando,,$6.990.000,6990000,2013,99'753,99753,Bencina
31611345,https://www.yapo.cl/autos-usados/kia-morning-2023/31611345,KIA MORNING 2023,Publicado 05/01/2026,2026-01-05,Kia,Morning,,$9.540.000,9540000,2023,21'871,21871,Bencina
31564702,https://www.yapo.cl/autos-usados/volvo-v40-t4-comfort-2-0-mec-2016/31564702,VOLVO V40 T4 COMFORT 2.0 MEC 2016,Publicado 06/01/2026,2026-01-06,Volvo,V40,,$10.380.000 (Rebajado 5%),10380000,2016,89'106,89106,Bencina
31853398,https://www.yapo.cl/autos-usados/unico-dueno-camioneta-1-9-hdi-action4-wd-diesel/31853398,Unico dueño Camioneta 1.9 HDI Action4 $WD Diesel,Publicado 12/01/2026,2026-01-12,Peugeot,Landtrek,,$16.450.000,16450000,2022,45'000,45000,Diesel
31129175,https://www.yapo.cl/autos-usados/chevrolet-onix-2021/31129175,CHEVROLET ONIX 2021,Publicado 05/01/2026,2026-01-05,Chevrolet,Onix,,$9.990.000,9990000,2021,61'883,61883,Bencina
31693734,https://www.yapo.cl/autos-usados/hyundai-creta-2022/31693734,HYUNDAI CRETA 2022,Publicado 07/01/2026,2026-01-07,Hyundai,Creta,,$13.570.300,13570300,2022,101'176,101176,Bencina
31482457,https://www.yapo.cl/autos-usados/chevrolet-onix-2024/31482457,CHEVROLET ONIX 2024,Publicado 07/01/2026,2026-01-07,Chevrolet,Onix,,$12.790.000,12790000,2024,38'196,38196,Bencina
31837531,https://www.yapo.cl/autos-usados/kia-soluto-2025/31837531,KIA SOLUTO 2025,Publicado 12/01/2026,2026-01-12,Kia,Soluto,,$9.890.000,9890000,2025,6'211,6211,Bencina
31740241,https://www.yapo.cl/autos-usados/mg-zs-2022/31740241,MG ZS 2022,Publicado 06/01/2026,2026-01-06,,ZS,,$7.990.000,7990000,2022,53'143,53143,Bencina
31436642,https://www.yapo.cl/autos-usados/chevrolet-tracker-2025/31436642,CHEVROLET TRACKER 2025,Publicado 07/01/2026,2026-01-07,Chevrolet,Tracker,,$16.690.000 (Rebajado 2%),16690000,2025,41'000,41000,Bencina
31702154,https://www.yapo.cl/autos-usados/toyota-raize-2025/31702154,TOYOTA RAIZE 2025,Publicado 06/01/2026,2026-01-06,Toyota,Raize,,$13.500.000,13500000,2025,35'441,35441,Gas
31736931,https://www.yapo.cl/autos-usados/hyundai-venue-2023/31736931,HYUNDAI VENUE 2023,Publicado 12/01/2026,2026-01-12,Hyundai,Venue,,$13.490.000,13490000,2023,29'911,29911,Bencina
31739693,https://www.yapo.cl/autos-usados/mercedes-benz-a-250-sport-2018/31739693,Mercedes Benz A 250 Sport 2018,Publicado 07/01/2026,2026-01-07,Mercedes Benz,A 250,,$19.990.000,19990000,2018,72'000,72000,Bencina
31785096,https://www.yapo.cl/autos-usados/volkswagen-virtus-2024/31785096,VOLKSWAGEN VIRTUS 2024,Publicado 07/01/2026,2026-01-07,Volkswagen,Virtus,,$13.190.000,13190000,2024,27'049,27049,Bencina
31725618,https://www.yapo.cl/autos-usados/suzuki-vitara-otto-1-6-mt/31725618,Suzuki Vitara Otto 1.6 MT,Publicado 04/01/2026,2026-01-04,Suzuki,Vitara,,$12.990.000,12990000,2023,92'330,92330,Bencina
31610527,https://www.yapo.cl/autos-usados/ford-ecosport-2019/31610527,FORD ECOSPORT 2019,Publicado 06/01/2026,2026-01-06,Ford,Ecosport,,$8.890.000,8890000,2019,93'470,93470,Bencina
31801382,https://www.yapo.cl/autos-usados/kia-rio-5-ex-1-4-2016/31801382,Kia Rio 5 Ex 1.4 2016,Publicado 06/01/2026,2026-01-06,Kia,RIO 5,,$6.990.000,6990000,2016,162'000,162000,Bencina
31692363,https://www.yapo.cl/autos-usados/chevrolet-onix-2024/31692363,CHEVROLET ONIX 2024,Publicado 07/01/2026,2026-01-07,Chevrolet,Onix,,$12.590.000,12590000,2024,40'176,40176,Bencina
31464664,https://www.yapo.cl/autos-usados/toyota-prius-1-5-hybrido-aut-ano-2020/31464664,TOYOTA PRIUS 1.5 HYBRIDO AUT. AÑO 2020,Publicado 07/01/2026,2026-01-07,Toyota,Prius,,$9.990.000 (Rebajado 29%),9990000,2020,205'235,205235,Bencina
31678702,https://www.yapo.cl/autos-usados/chevrolet-onix-2024/31678702,CHEVROLET ONIX 2024,Publicado 07/01/2026,2026-01-07,Chevrolet,Onix,,$12.790.000,12790000,2024,33'708,33708,Bencina
31473083,https://www.yapo.cl/autos-usados/toyota-raize-2025/31473083,TOYOTA RAIZE 2025,Publicado 06/01/2026,2026-01-06,Toyota,Raize,,$12.500.000 (Rebajado 7%),12500000,2025,25'024,25024,Bencina
31781380,https://www.yapo.cl/autos-usados/volkswagen-golf-2018/31781380,VOLKSWAGEN GOLF 2018,Publicado 06/01/2026,2026-01-06,Volkswagen,Golf,,$10.690.000,10690000,2018,105'000,105000,Bencina
31610826,https://www.yapo.cl/autos-usados/great-wall-poer-2022/31610826,GREAT WALL POER 2022,Publicado 07/01/2026,2026-01-07,Great Wall,POER,,$13.490.000,13490000,2022,150'016,150016,Diesel
31464400,https://www.yapo.cl/autos-usados/new-mazda-6-gt-2-2-at/31464400,NEW MAZDA 6 GT 2.2 AT,Publicado 04/01/2026,2026-01-04,Mazda,6,,$13.990.000 (Rebajado 7%),13990000,2016,130'780,130780,Diesel
31856195,https://www.yapo.cl/autos-nuevos/chevrolet-sail-hatchback/31856195,,Publicado 13/01/2026,2026-01-13,Chevrolet,Sail,,$10.190.000,10190000,2026,,,Bencina
31674713,https://www.yapo.cl/autos-usados/geely-azkarra-2022/31674713,GEELY AZKARRA 2022,Publicado 05/01/2026,2026-01-05,Geely,Azkarra,,$13.340.000,13340000,2022,22'693,22693,Bencina
31725640,https://www.yapo.cl/autos-usados/great-wall-poer-4x4-2-0-mt/31725640,Great Wall Poer 4x4 2.0 MT,Publicado 04/01/2026,2026-01-04,Great Wall,POER,,$14.390.000 (Rebajado 2%),14390000,2022,64'841,64841,Diesel
31410173,https://www.yapo.cl/autos-usados/kia-sonet-2021/31410173,KIA SONET 2021,Publicado 05/01/2026,2026-01-05,Kia,Sonet,,$12.290.000,12290000,2021,59'970,59970,Bencina
31660365,https://www.yapo.cl/autos-usados/chevrolet-onix-2024/31660365,CHEVROLET ONIX 2024,Publicado 07/01/2026,2026-01-07,Chevrolet,Onix,,$13.490.000,13490000,2024,38'544,38544,Bencina
31051911,https://www.yapo.cl/autos-usados/chevrolet-tracker-2024/31051911,CHEVROLET TRACKER 2024,Publicado 07/01/2026,2026-01-07,Chevrolet,Tracker,,$10.990.000 (Rebajado 8%),10990000,2024,42'550,42550,Bencina
31768828,https://www.yapo.cl/autos-usados/peugeot-partner-2022/31768828,PEUGEOT PARTNER 2022,Publicado 06/01/2026,2026-01-06,Peugeot,Partner,,$9.900.000,9900000,2022,115'476,115476,Diesel
31788007,https://www.yapo.cl/autos-usados/citroen-c3-2021/31788007,CITROEN C3 2021,Publicado 05/01/2026,2026-01-05,Citroen,C3,,$8.990.000 (Rebajado 10%),8990000,2021,38'185,38185,Bencina
31512290,https://www.yapo.cl/autos-usados/toyota-raize-2025/31512290,TOYOTA RAIZE 2025,Publicado 06/01/2026,2026-01-06,Toyota,Raize,,$12.500.000,12500000,2025,25'128,25128,Gas
31518772,https://www.yapo.cl/autos-usados/hyundai-accent-2024/31518772,HYUNDAI ACCENT 2024,Publicado 06/01/2026,2026-01-06,Hyundai,Accent,,$11.900.000,11900000,2024,42'180,42180,Bencina
31810498,https://www.yapo.cl/autos-usados/kia-morning-1-2-2022/31810498,Kia Morning 1.2 2022,Publicado 06/01/2026,2026-01-06,Kia,Morning,,$8.990.000,8990000,2022,48'000,48000,Bencina
31778499,https://www.yapo.cl/autos-usados/chevrolet-tracker-2024/31778499,CHEVROLET TRACKER 2024,Publicado 07/01/2026,2026-01-07,Chevrolet,Tracker,,$11.990.000,11990000,2024,53'097,53097,Bencina
31671825,https://www.yapo.cl/autos-usados/hyundai-tucson-2017/31671825,HYUNDAI TUCSON 2017,Publicado 07/01/2026,2026-01-07,Hyundai,Tucson,,$10.990.000,10990000,2017,84'526,84526,Bencina
31759711,https://www.yapo.cl/autos-usados/subaru-crosstrek-2024/31759711,SUBARU CROSSTREK 2024,Publicado 05/01/2026,2026-01-05,Subaru,Crosstrek,,$19.590.000 (Rebajado 4%),19590000,2024,43'357,43357,Bencina
31670436,https://www.yapo.cl/autos-usados/maxus-t60/31670436,MAXUS T60,Publicado 07/01/2026,2026-01-07,Maxus,T60,,$1,,2026,,,Bencina
30892944,https://www.yapo.cl/autos-usados/citroen-berlingo-2023/30892944,CITROEN BERLINGO 2023,Publicado 06/01/2026,2026-01-06,Citroen,Berlingo,,$19.990.000 (Rebajado 9%),19990000,2023,3'669,3669,Eléctrico
30892945,https://www.yapo.cl/autos-usados/citroen-c5-aircross-2022/30892945,CITROEN C5 AIRCROSS 2022,Publicado 06/01/2026,2026-01-06,Citroen,C5 Aircross,,$17.590.000,17590000,2022,29'009,29009,Diesel
31672091,https://www.yapo.cl/autos-usados/kia-grand-carnival-ex-3-3-2015/31672091,Kia Grand Carnival Ex 3.3 2015,Publicado 07/01/2026,2026-01-07,Kia,Grand Carnival,,$14.490.000,14490000,2015,108'000,108000,Bencina
31739022,https://www.yapo.cl/autos-usados/suzuki-jimny-2022/31739022,SUZUKI JIMNY 2022,Publicado 06/01/2026,2026-01-06,Suzuki,Jimny,,$12.500.000,12500000,2022,103'340,103340,Bencina
31334534,https://www.yapo.cl/autos-usados/dfsk-truck-dc-1-3-mt/31334534,DFSK TRUCK DC 1.3 MT,Publicado 04/01/2026,2026-01-04,DFSK,Truck CS C21,,$7.990.000 (Rebajado 7%),7990000,2025,30'315,30315,Bencina
31476141,https://www.yapo.cl/autos-usados/mg-hs-2021/31476141,MG HS 2021,Publicado 05/01/2026,2026-01-05,,HS,,$9.290.000 (Rebajado 4%),9290000,2021,74'259,74259,Bencina
31637180,https://www.yapo.cl/autos-usados/peugeot-landtrek-2023/31637180,PEUGEOT LANDTREK 2023,Publicado 06/01/2026,2026-01-06,Peugeot,Landtrek,,$12.900.000,12900000,2023,87'172,87172,Diesel
31519324,https://www.yapo.cl/autos-usados/toyota-raize-2025/31519324,TOYOTA RAIZE 2025,Publicado 06/01/2026,2026-01-06,Toyota,Raize,,$12.500.000 (Rebajado 7%),12500000,2025,27'655,27655,Bencina
31712239,https://www.yapo.cl/autos-usados/maxus-t60-2023/31712239,MAXUS T60 2023,Publicado 07/01/2026,2026-01-07,Maxus,T60,,$11.790.000,11790000,2023,97'000,97000,Diesel
31603789,https://www.yapo.cl/autos-usados/peugeot-208-2023/31603789,PEUGEOT 208 2023,Publicado 06/01/2026,2026-01-06,Peugeot,208,,$9.900.000,9900000,2023,22'384,22384,Bencina
31658027,https://www.yapo.cl/autos-usados/toyota-corolla-2018/31658027,TOYOTA COROLLA 2018,Publicado 05/01/2026,2026-01-05,Toyota,Corolla,,$10.490.000,10490000,2018,143'751,143751,Bencina
31086276,https://www.yapo.cl/autos-usados/maxus-t60-2023/31086276,MAXUS T60 2023,Publicado 07/01/2026,2026-01-07,Maxus,T60,,$11.000.000 (Rebajado 17%),11000000,2023,76'396,76396,Diesel
30834566,https://www.yapo.cl/autos-usados/chevrolet-tracker-2024/30834566,CHEVROLET TRACKER 2024,Publicado 07/01/2026,2026-01-07,Chevrolet,Tracker,,$14.990.000 (Rebajado 2%),14990000,2024,33'635,33635,Bencina
31678993,https://www.yapo.cl/autos-usados/volkswagen-virtus-2024/31678993,VOLKSWAGEN VIRTUS 2024,Publicado 07/01/2026,2026-01-07,Volkswagen,Virtus,,$12.990.000 (Rebajado 5%),12990000,2024,31'000,31000,Bencina
31275897,https://www.yapo.cl/autos-usados/chevrolet-tracker-2024/31275897,CHEVROLET TRACKER 2024,Publicado 07/01/2026,2026-01-07,Chevrolet,Tracker,,$11.000.000 (Rebajado 8%),11000000,2024,38'420,38420,Bencina
31790633,https://www.yapo.cl/autos-usados/audi-q3-tfsi-1-4-aut/31790633,Audi Q3 TFSI 1.4 AUT,Publicado 05/01/2026,2026-01-05,Audi,Q3,,$30.990.000,30990000,2024,26'328,26328,Bencina
31691960,https://www.yapo.cl/autos-usados/ds-ds-3-2024/31691960,DS DS 3 2024,Publicado 06/01/2026,2026-01-06,DS,3,,$18.990.000,18990000,2024,14'215,14215,Bencina
31840939,https://www.yapo.cl/autos-usados/bmw-118d-2021/31840939,BMW 118d - 2021,Publicado 10/01/2026,2026-01-10,BMW,118d,,$23.200.000,23200000,2021,46'000,46000,Diesel
31637245,https://www.yapo.cl/autos-usados/toyota-raize-2025/31637245,TOYOTA RAIZE 2025,Publicado 06/01/2026,2026-01-06,Toyota,Raize,,$13.500.000,13500000,2025,32'020,32020,Bencina
31044036,https://www.yapo.cl/autos-usados/ford-f-150-raptor-2024/31044036,FORD F-150 RAPTOR 2024,Publicado 06/01/2026,2026-01-06,Ford,other,,$64.990.000 (Rebajado 3%),64990000,2024,21'000,21000,Bencina
30558659,https://www.yapo.cl/autos-usados/peugeot-landtrek-2023/30558659,PEUGEOT LANDTREK 2023,Publicado 06/01/2026,2026-01-06,Peugeot,Landtrek,,$12.900.000 (Rebajado 13%),12900000,2023,73'500,73500,Diesel
31669801,https://www.yapo.cl/autos-usados/maxus-deliver-escolar/31669801,MAXUS DELIVER ESCOLAR,Publicado 07/01/2026,2026-01-07,Maxus,DELIVER 9 ESCOLAR,,$42.471.100,42471100,2026,,,Diesel
31042963,https://www.yapo.cl/autos-usados/ford-edge-2023/31042963,FORD EDGE 2023,Publicado 06/01/2026,2026-01-06,Ford,EDGE,,$29.990.000 (Rebajado 9%),29990000,2023,9'750,9750,Bencina
31827849,https://www.yapo.cl/autos-usados/vede-cherokee-ltd-4x4/31827849,vede Cherokee LTD 4X4,Publicado 07/01/2026,2026-01-07,Jeep,Cherokee,,$11.500.000,11500000,2015,117'000,117000,Bencina
31797632,https://www.yapo.cl/autos-usados/chevrolet-spark-lt-2013/31797632,Chevrolet Spark Lt 2013,Publicado 13/01/2026,2026-01-13,Chevrolet,Spark,,$3.600.000,3600000,2013,96'576,96576,Bencina
31788515,https://www.yapo.cl/autos-usados/dodge-ram-1500-laramie-hemi-4x4-con-glp-recibo-vehiculos/31788515,"DODGE RAM 1500 LARAMIE HEMI 4X4 CON GLP, RECIBO VEHICULOS",Publicado 13/01/2026,2026-01-13,Dodge,Ram,,$21.490.000 (Rebajado 2%),21490000,2017,142'000,142000,Bencina
31691937,https://www.yapo.cl/autos-usados/ram-rampage-laramie-4x4-2024-unico-dueno-facturable/31691937,"RAM RAMPAGE LARAMIE 4X4 2024 unico dueño, facturable",Publicado 13/01/2026,2026-01-13,Ram,RAMPAGE LARAMIE 4X4,,$28.990.000 (Rebajado 3%),28990000,2024,30'000,30000,Diesel
31844621,https://www.yapo.cl/autos-usados/peugeot-208-diesel-allure-unico-dueno-recibo-vehiculo/31844621,"PEUGEOT 208 DIESEL ALLURE UNICO DUEÑO, RECIBO VEHICULO",Publicado 13/01/2026,2026-01-13,Peugeot,208,,$8.490.000,8490000,2019,66'000,66000,Diesel
31738888,https://www.yapo.cl/autos-usados/mazda-3-sedan-2-0-full-equipo-recibo-vehiculos/31738888,"Mazda 3 sedan 2.0 full equipo, recibo vehiculos",Publicado 13/01/2026,2026-01-13,Mazda,3,,$11.990.000,11990000,2019,126'000,126000,Bencina
31581028,https://www.yapo.cl/autos-usados/kia-sportage-ex-1-6-7dct-awd-automatico-recibo-vehiculo/31581028,"KIA SPORTAGE EX 1.6 7dct AWD AUTOMATICO, recibo vehiculo",Publicado 13/01/2026,2026-01-13,Kia,Sportage,,$22.990.000,22990000,2024,50'000,50000,Bencina
31576114,https://www.yapo.cl/autos-usados/volkswagen-saveiro-1-6-bencinera-ano-2021-recibo-vehiculo/31576114,"Volkswagen Saveiro 1.6 bencinera AÑO 2021, recibo vehiculo",Publicado 13/01/2026,2026-01-13,Volkswagen,Saveiro,,$9.490.000 (Rebajado 3%),9490000,2021,72'000,72000,Bencina
31717082,https://www.yapo.cl/autos-usados/dargo-turbo-deluxe-4x4-aut-2-0/31717082,Dargo Turbo Deluxe 4x4 Aut 2.0,Publicado 11/01/2026,2026-01-11,Haval,Dargo,,$19.990.000 (Rebajado 5%),19990000,2025,7'160,7160,Bencina
31498656,https://www.yapo.cl/autos-usados/haval-h6-elite-2-0t-4x2-at/31498656,HAVAL H6 ELITE 2.0T 4X2 AT,Publicado 11/01/2026,2026-01-11,Great Wall,Haval H6,,$13.790.000 (Rebajado 1%),13790000,2021,49'200,49200,Bencina
31641929,https://www.yapo.cl/autos-usados/peugeot-308-gt-puretech-1-2-aut-2025/31641929,PEUGEOT 308 GT PURETECH 1.2 AUT 2025,Publicado 07/01/2026,2026-01-07,Peugeot,308,,$23.900.000 (Rebajado 4%),23900000,2025,7'764,7764,Bencina
31673807,https://www.yapo.cl/autos-usados/honda-cr-v-exl-t-1-5-aut-2020/31673807,HONDA CR-V EXL T 1.5 AUT 2020,Publicado 07/01/2026,2026-01-07,Honda,CR-V,,$19.480.000 (Rebajado 2%),19480000,2020,81'307,81307,Bencina
31798903,https://www.yapo.cl/autos-usados/mercedes-benz-cla-200-2013-oportunidad/31798903,Mercedes benz Cla 200 2013 OPORTUNIDAD,Publicado 29/12/2025,2025-12-29,Mercedes Benz,CLA200,,$12.700.000,12700000,2013,130'000,130000,Bencina
31579088,https://www.yapo.cl/autos-usados/bmw-118-i-1-5-2018/31579088,Bmw 118 I 1.5 2018,Publicado 07/01/2026,2026-01-07,BMW,118,,$14.190.000 (Rebajado 3%),14190000,2018,110'000,110000,Bencina
31702283,https://www.yapo.cl/autos-usados/ford-ecosport-se-aut-1-6-2021/31702283,FORD ECOSPORT SE AUT 1.6 2021,Publicado 19/12/2025,2025-12-19,Ford,Ecosport,,$10.990.000,10990000,2021,74'280,74280,Bencina
31434317,https://www.yapo.cl/autos-usados/ssangyong-rexton-lx-2-0-2023/31434317,Ssangyong Rexton Lx 2.0 2023,Publicado 07/01/2026,2026-01-07,,Rexton,,$21.990.000 (Rebajado 4%),21990000,2023,45'000,45000,Bencina
31778497,https://www.yapo.cl/autos-usados/mitsubishi-asx-2019-at-4x4-fwd-13mm/31778497,Mitsubishi ASX 2019 AT 4X4 FWD 13MM,Publicado 06/01/2026,2026-01-06,Mitsubishi,ASX,,$13.000.000,13000000,2019,89'000,89000,Bencina
31772027,https://www.yapo.cl/autos-usados/kia-rio-5-1-4-auto-ex-full-2024/31772027,Kia Rio 5 1.4 Auto EX Full 2024,Publicado 04/01/2026,2026-01-04,Kia,Rio,,$16.250.000,16250000,2024,16'900,16900,Bencina
31769872,https://www.yapo.cl/autos-usados/nissan-versa-advance/31769872,NISSAN VERSA ADVANCE,Publicado 03/01/2026,2026-01-03,Nissan,Versa,,$9.900.000,9900000,2021,103'500,103500,Bencina
31379476,https://www.yapo.cl/autos-usados/chevrolet-silverado-high-country-ltz-4wd-5-3-aut-2018/31379476,CHEVROLET SILVERADO HIGH COUNTRY LTZ 4WD 5.3 AUT 2018,Publicado 07/01/2026,2026-01-07,Chevrolet,Silverado,,$23.900.000 (Rebajado 8%),23900000,2018,107'601,107601,Bencina
31753624,https://www.yapo.cl/autos-usados/audi-a3-1-4-mec-2019/31753624,AUDI A3 1.4 MEC 2019,Publicado 07/01/2026,2026-01-07,Audi,A3,,$14.900.000,14900000,2019,104'796,104796,Bencina
31750451,https://www.yapo.cl/autos-usados/ram-1500-bighorn-etorque-3-6-2023-impecable-factura-iva-descontable/31750451,RAM 1500 BIGHORN eTORQUE 3.6 2023 – IMPECABLE – FACTURA – IVA DESCONTABLE,Publicado 30/12/2025,2025-12-30,Ram,1500 Big Horn,,$42.840.000,42840000,2023,55'400,55400,Bencina
31731278,https://www.yapo.cl/autos-usados/mitsubishi-montero-hp-4x4/31731278,MITSUBISHI MONTERO HP 4X4,Publicado 30/12/2025,2025-12-30,Mitsubishi,Montero,,$27.990.000 (Rebajado 2%),27990000,2019,118'000,118000,Diesel
31584849,https://www.yapo.cl/autos-usados/ford-f-150-lariat-sport-4x4-5-0-aut-2016/31584849,FORD F-150 LARIAT SPORT 4X4 5.0 AUT 2016,Publicado 07/01/2026,2026-01-07,Ford,F-150,,$26.900.000 (Rebajado 7%),26900000,2016,87'551,87551,Bencina
31716041,https://www.yapo.cl/autos-usados/ford-f-150-lariat-sport-4x4-5-0-aut-2016/31716041,FORD F-150 LARIAT SPORT 4X4 5.0 AUT 2016,Publicado 07/01/2026,2026-01-07,Ford,F-150,,$26.900.000,26900000,2016,87'551,87551,Bencina
31626893,https://www.yapo.cl/autos-usados/kia-rio-5-ex-full-ano-2017/31626893,Kia Rio 5 EX Full año 2017,Publicado 05/01/2026,2026-01-05,Kia,RIO,,$7.500.000 (Rebajado 4%),7500000,2017,118'900,118900,Bencina
31824263,https://www.yapo.cl/autos-usados/hyundai-tucson-2-0-automatico-2015-gl-aa-2ab/31824263,Hyundai Tucson 2.0 Automático 2015 / GL AA 2AB,Publicado 06/01/2026,2026-01-06,Hyundai,Tucson,,$9.650.000,9650000,2015,131'000,131000,Bencina
31782865,https://www.yapo.cl/autos-usados/jeep-grand-cherokee-limited-2017/31782865,Jeep Grand Cherokee Limited 2017,Publicado 07/01/2026,2026-01-07,Jeep,Grand Cherokee,,$21.990.000,21990000,2017,72'000,72000,Bencina
31205017,https://www.yapo.cl/autos-usados/skoda-kamiq-ambition-2022/31205017,Skoda Kamiq Ambition 2022,Publicado 07/01/2026,2026-01-07,Skoda,Kamiq,,$13.990.000 (Rebajado 2%),13990000,2022,49'000,49000,Bencina
31777789,https://www.yapo.cl/autos-usados/peugeot-2008-ano-2008-1-6/31777789,Peugeot 2008 Año 2008 1.6,Publicado 30/12/2025,2025-12-30,Peugeot,2008,,$8.500.000 (Rebajado 3%),8500000,2018,173'000,173000,Diesel
31767376,https://www.yapo.cl/autos-usados/vendo-jeep-patriot-4x2-ano-2012-automatico/31767376,VENDO JEEP PATRIOT 4x2 AÑO 2012 (AUTOMATICO),Publicado 03/01/2026,2026-01-03,Jeep,Patriot,,$6.490.000 (Rebajado 3%),6490000,2012,97'000,97000,Bencina
31688786,https://www.yapo.cl/autos-usados/mitsubishi-l200-work-2018/31688786,Mitsubishi L200 Work 2018,Publicado 11/01/2026,2026-01-11,Mitsubishi,L 200,,$10.990.000 (Rebajado 4%),10990000,2018,159'000,159000,Diesel
31112843,https://www.yapo.cl/autos-usados/ssangyong-tivoli-lx-1-6-mt/31112843,SSANGYONG TIVOLI LX 1.6 MT,Publicado 11/01/2026,2026-01-11,SsangYong,Tivoli,,$9.990.000 (Rebajado 5%),9990000,2021,70'040,70040,Bencina
31768045,https://www.yapo.cl/autos-usados/peugeot-2008-2024/31768045,PEUGEOT 2008 2024,Publicado 09/01/2026,2026-01-09,Peugeot,2008,,$18.680.000,18680000,2024,38'800,38800,Diesel
31645246,https://www.yapo.cl/autos-usados/vendo-korando/31645246,vendo korando,Publicado 07/01/2026,2026-01-07,SsangYong,Korando,,$5.000.000 (Rebajado 9%),5000000,2015,103'000,103000,Diesel
31781275,https://www.yapo.cl/autos-usados/maxus-t60-4x2-cabina-simple-ano-2021/31781275,MAXUS T60 4X2 CABINA SIMPLE AÑO 2021,Publicado 09/01/2026,2026-01-09,Maxus,T60,,$10.400.000,10400000,2021,92'587,92587,Diesel
31782803,https://www.yapo.cl/autos-usados/toyota-runner-limited-4x2-2013/31782803,TOYOTA RUNNER LIMITED 4X2 2013,Publicado 07/01/2026,2026-01-07,Toyota,4Runner,,$13.500.000,13500000,2013,198'000,198000,Bencina
31769985,https://www.yapo.cl/autos-usados/ram-van-1000-cargo-xl-1-6-2019/31769985,RAM VAN 1000 CARGO XL 1.6 2019,Publicado 10/01/2026,2026-01-10,Ram,VAN 1000,,$7.280.000,7280000,2019,176'820,176820,Diesel
31336693,https://www.yapo.cl/autos-usados/jmc-vigus-pro-2-0-at/31336693,JMC VIGUS PRO 2.0 AT,Publicado 11/01/2026,2026-01-11,JMC,Vigus,,$16.990.000 (Rebajado 6%),16990000,2024,29'350,29350,Diesel
31785767,https://www.yapo.cl/autos-usados/vendo-camioneta-jac-t8-advance-unico-dueno/31785767,Vendo camioneta JAC t8 Advance único dueño,Publicado 08/01/2026,2026-01-08,Jac,T8,,$12.750.000,12750000,2023,52'000,52000,Diesel
29926117,https://www.yapo.cl/autos-usados/vendo-nissan-murano-2017-con-52-000-kilometros/29926117,VENDO NISSAN MURANO 2017 CON 52.000 KILOMETROS,Publicado 09/01/2026,2026-01-09,Nissan,Murano,,$16.500.000 (Rebajado 6%),16500000,2017,52'000,52000,Bencina
31671236,https://www.yapo.cl/autos-usados/se-vende-camioneta-great-wall-poer-2024-4x4-diesel-2-0/31671236,Se vende Camioneta Great wall Poer 2024 4x4 diesel 2.0,Publicado 11/01/2026,2026-01-11,Great Wall,POER,,$17.500.000 (Rebajado 1%),17500000,2024,37'300,37300,Diesel
31782872,https://www.yapo.cl/autos-usados/bmw-116i-2015/31782872,BMW 116i 2015,Publicado 07/01/2026,2026-01-07,BMW,116i,,$11.000.000,11000000,2015,157'000,157000,Bencina
31711246,https://www.yapo.cl/autos-usados/jeep-renegade-1-8-manual-sport/31711246,JEEP RENEGADE 1.8 MANUAL SPORT,Publicado 09/01/2026,2026-01-09,Jeep,Renegade,,$10.900.000 (Rebajado 7%),10900000,2022,72'000,72000,Bencina
31794433,https://www.yapo.cl/autos-usados/toyota-hilux-11-450-kms/31794433,Toyota Hilux 11.450 kms,Publicado 12/01/2026,2026-01-12,Toyota,Hilux,,$22.900.000,22900000,2022,11'450,11450,Bencina
31580693,https://www.yapo.cl/autos-usados/volkswagen-amarok-trendline-2-0-4x4-diesel/31580693,VOLKSWAGEN AMAROK TRENDLINE 2.0 4X4 DIESEL,Publicado 08/01/2026,2026-01-08,Volkswagen,Amarok,,$17.900.000,17900000,2022,130'000,130000,Diesel
31781235,https://www.yapo.cl/autos-usados/peugeot-partner-l1-hdi-ano-2022/31781235,PEUGEOT PARTNER L1 HDI AÑO 2022,Publicado 09/01/2026,2026-01-09,Peugeot,Partner,,$10.200.000,10200000,2022,69'557,69557,Diesel
31817056,https://www.yapo.cl/autos-usados/peugeot-301-full-allure-2019-diesel/31817056,Peugeot 301 FULL Allure 2019 DIESEL,Publicado 04/01/2026,2026-01-04,Peugeot,301,,$8.500.000,8500000,2019,180'000,180000,Diesel
31760288,https://www.yapo.cl/autos-usados/partner-2019-aun-nueva/31760288,Partner 2019 aún nueva,Publicado 01/01/2026,2026-01-01,Peugeot,Partner,,$8.990.000,8990000,2019,67'000,67000,Diesel
31759911,https://www.yapo.cl/autos-usados/changan-cs15-luxury-1-5-mt-ano-2025/31759911,CHANGAN CS15 LUXURY 1.5 MT AÑO 2025,Publicado 01/01/2026,2026-01-01,Changan,CS15,,$8.990.000,8990000,2025,10'000,10000,Bencina
31791661,https://www.yapo.cl/autos-usados/suzuki-spresso-1-0/31791661,Suzuki Spresso 1.0,Publicado 13/01/2026,2026-01-13,Suzuki,S-Presso,,$7.990.000,7990000,2024,10'126,10126,Bencina
31188539,https://www.yapo.cl/autos-usados/508-allure-hdi-2-0-aut/31188539,508 ALLURE HDI 2.0 AUT,Publicado 09/01/2026,2026-01-09,Peugeot,508,,$14.700.000 (Rebajado 2%),14700000,2017,114,114,Diesel
31732369,https://www.yapo.cl/autos-usados/peugeot-partner-l2-hdi-1-6/31732369,PEUGEOT PARTNER L2 HDI 1.6,Publicado 09/01/2026,2026-01-09,Peugeot,Partner,,$15.000.000 (Rebajado 4%),15000000,2023,45'500,45500,Diesel
31172808,https://www.yapo.cl/autos-usados/station-wagon-mg/31172808,STATION WAGON MG,Publicado 09/01/2026,2026-01-09,MG,RX5,,$9.250.000,9250000,2021,90,90,Bencina
31713447,https://www.yapo.cl/autos-usados/town-country-2013/31713447,Town Country 2013,Publicado 06/01/2026,2026-01-06,Chrysler,TOWN & COUNTRY,,$8.200.000 (Rebajado 9%),8200000,2013,168'000,168000,Bencina
31814542,https://www.yapo.cl/autos-usados/se-vende/31814542,Se vende,Publicado 03/01/2026,2026-01-03,Jeep,Renegade,,$10.750.000,10750000,2021,43'000,43000,Bencina
30456786,https://www.yapo.cl/autos-usados/mitsubishi-montero-sport-diesel/30456786,Mitsubishi Montero Sport Diesel,Publicado 03/01/2026,2026-01-03,Mitsubishi,Montero Sport,,$23.890.000,23890000,2021,72'000,72000,Diesel
31630015,https://www.yapo.cl/autos-usados/furgon-citroen-ano2021/31630015,furgon citroen año2021,Publicado 02/01/2026,2026-01-02,Citroen,Berlingo,,$10.950.000,10950000,2021,100'500,100500,Diesel
31777081,https://www.yapo.cl/autos-usados/impecable-chevrolet-optra-2012/31777081,Impecable Chevrolet Optra 2012,Publicado 06/01/2026,2026-01-06,Chevrolet,Optra,,$3.200.000,3200000,2012,220'000,220000,Bencina
31829533,https://www.yapo.cl/autos-usados/ssangyong-grand-musso-2-2-mt-4x4-ano-2022/31829533,SSANGYONG GRAND MUSSO 2.2 MT 4X4 AÑO 2022,Publicado 07/01/2026,2026-01-07,SsangYong,Musso Grand,,$15.890.000,15890000,2022,139'180,139180,Diesel
31739875,https://www.yapo.cl/autos-usados/opel-mokka-x-enjoy-1-4t-at/31739875,OPEL MOKKA X ENJOY 1.4T AT,Publicado 12/01/2026,2026-01-12,Opel,Mokka X,,$8.990.000,8990000,2019,80'500,80500,Bencina
31756006,https://www.yapo.cl/autos-usados/haval-h6-active-1-5/31756006,HAVAL H6 ACTIVE 1.5,Publicado 13/01/2026,2026-01-13,Haval,H6,,$9.990.000,9990000,2019,86'909,86909,Bencina
31759822,https://www.yapo.cl/autos-usados/aviso/31759822,aviso,Publicado 01/01/2026,2026-01-01,Mazda,MX-5 Miata,,$13.500.000,13500000,2007,15'000,15000,Bencina
31824974,https://www.yapo.cl/autos-usados/toyota-4-runner-4-0-aut-2005/31824974,TOYOTA 4 RUNNER 4.0 AUT. 2005,Publicado 06/01/2026,2026-01-06,Toyota,4Runner,,$10.500.000,10500000,2005,214'000,214000,Bencina
31704833,https://www.yapo.cl/autos-usados/mitsubishi-l200-crt-4x4-2-4-diesel-2023/31704833,MITSUBISHI L200 CRT 4X4 2.4 DIESEL 2023,Publicado 07/01/2026,2026-01-07,Mitsubishi,L 200,,$18.500.000,18500000,2023,68'000,68000,Diesel
31512176,https://www.yapo.cl/autos-usados/mazda-cx-5-ao-2017/31512176,Mazda CX-5 ao 2017,Publicado 13/01/2026,2026-01-13,Mazda,CX-5,,$13.000.000,13000000,2017,99'000,99000,Bencina
31570978,https://www.yapo.cl/autos-usados/vendo-hyundai-santa-fe-2-4/31570978,vendo Hyundai Santa Fe 2.4,Publicado 03/01/2026,2026-01-03,Hyundai,Santa Fe,,$5.900.000 (Rebajado 5%),5900000,2011,210'000,210000,Bencina
31765542,https://www.yapo.cl/autos-usados/volkswagen-touareg-tdi-3-0/31765542,Volkswagen Touareg TDI 3.0,Publicado 12/01/2026,2026-01-12,Volkswagen,Touareg,,$13.990.000 (Rebajado 3%),13990000,2013,251'000,251000,Diesel
31599428,https://www.yapo.cl/autos-usados/great-wall-poer-elite-4x4-2023/31599428,GREAT WALL POER ELITE 4X4 2023,Publicado 09/01/2026,2026-01-09,Great Wall,POER,,$13.990.000 (Rebajado 7%),13990000,2023,60'000,60000,Diesel
31382004,https://www.yapo.cl/autos-usados/citroen-c-3-1-2-2022/31382004,Citroen C-3 1.2 2022,Publicado 07/01/2026,2026-01-07,Citroen,C-3,,$9.390.000 (Rebajado 3%),9390000,2022,20'000,20000,Bencina
31784851,https://www.yapo.cl/autos-usados/jac-js4-hb-1-6/31784851,JAC JS4 HB 1.6,Publicado 13/01/2026,2026-01-13,Jac,JS4,,$9.990.000,9990000,2022,48'615,48615,Bencina
31742182,https://www.yapo.cl/autos-usados/suzuki-spresso-1-o-amt-glx/31742182,SUZUKI SPRESSO 1.O AMT GLX,Publicado 12/01/2026,2026-01-12,Suzuki,S-Presso,,$7.990.000,7990000,2024,41'000,41000,Bencina
31371978,https://www.yapo.cl/autos-usados/se-vende-mitsubishi-katana-cr-4x2/31371978,se vende Mitsubishi Katana CR 4X2,Publicado 03/01/2026,2026-01-03,Mitsubishi,L 200,,$15.900.000,15900000,2019,100,100,Diesel
31764154,https://www.yapo.cl/autos-usados/mitsubishi-l200-dakar-4x4-2-4-automatica-km/31764154,MITSUBISHI L200 DAKAR 4x4 2.4 AUTOMÁTICA – Km,Publicado 02/01/2026,2026-01-02,Mitsubishi,L 200,,$18.800.000,18800000,2018,126,126,Diesel
31304668,https://www.yapo.cl/autos-usados/chevrolet-new-dmax-2-5-4x4-diesel/31304668,CHEVROLET NEW DMAX 2.5 4X4 DIESEL,Publicado 07/01/2026,2026-01-07,Chevrolet,D-Max,,$13.900.000,13900000,2021,110'000,110000,Diesel
31800223,https://www.yapo.cl/autos-usados/peugeot-2008/31800223,Peugeot 2008,Publicado 30/12/2025,2025-12-30,Peugeot,2008,,$10.900.000,10900000,2020,74'000,74000,Diesel
31826133,https://www.yapo.cl/autos-usados/ford-explorer-limited-2014-kilometraje-101551/31826133,Ford Explorer limited 2014 kilometraje 101551,Publicado 06/01/2026,2026-01-06,Ford,Explorer,,$13.000.000,13000000,2014,101'551,101551,Bencina
31827282,https://www.yapo.cl/autos-usados/vendo-renault-clio-1-6/31827282,Vendo Renault Clio 1.6,Publicado 06/01/2026,2026-01-06,Renault,Clio,,$3.100.000,3100000,2006,200'000,200000,Bencina
31814456,https://www.yapo.cl/autos-usados/ford-escape-2016/31814456,FORD ESCAPE 2016,Publicado 03/01/2026,2026-01-03,Ford,Escape,,$8.250.000,8250000,2016,143'000,143000,Bencina
31799347,https://www.yapo.cl/autos-usados/bmw-320i-sport-2-0-aut-2013/31799347,BMW 320I SPORT 2.0 AUT 2013,Publicado 07/01/2026,2026-01-07,BMW,320i,,$12.900.000,12900000,2013,102'510,102510,Bencina
31784869,https://www.yapo.cl/autos-usados/renault-kwid-hb-mt-1-0/31784869,Renault Kwid Hb MT 1.0,Publicado 13/01/2026,2026-01-13,Renault,KWID,,$8.490.000,8490000,2023,5'000,5000,Bencina
31177557,https://www.yapo.cl/autos-usados/camioneta-great-wall-2018/31177557,Camioneta Great Wall 2018,Publicado 30/12/2025,2025-12-30,Great Wall,Wingle 6,,$6.100.000 (Rebajado 2%),6100000,2018,115'000,115000,Diesel
31729753,https://www.yapo.cl/autos-usados/sannyong-2014-2-0-diesel/31729753,"Sannyong 2014, 2.0. Diesel",Publicado 03/01/2026,2026-01-03,SsangYong,Actyon Sports,,$7.500.000,7500000,2014,240'000,240000,Diesel
31498617,https://www.yapo.cl/autos-usados/changan-new-cs15-luxury-1-5-mt/31498617,CHANGAN NEW CS15 LUXURY 1.5 MT,Publicado 13/01/2026,2026-01-13,Changan,CS15,,$8.590.000 (Rebajado 11%),8590000,2023,27'500,27500,Bencina
31775097,https://www.yapo.cl/autos-usados/jeep-renegade-2018/31775097,JEEP RENEGADE 2018,Publicado 05/01/2026,2026-01-05,Jeep,Renegade,,$8.800.000,8800000,2018,124'000,124000,Bencina
31336439,https://www.yapo.cl/autos-usados/jac-js4-comfort-1-6-mt/31336439,JAC JS4 COMFORT 1.6 MT,Publicado 13/01/2026,2026-01-13,Jac,JS4,,$9.490.000 (Rebajado 5%),9490000,2022,57'703,57703,Bencina
31840122,https://www.yapo.cl/autos-usados/changan-new-cs15-luxury-1-5-mt-ano-2024/31840122,CHANGAN NEW CS15 LUXURY 1.5 MT AÑO 2024,Publicado 09/01/2026,2026-01-09,Changan,CS15,,$8.790.000,8790000,2024,34'000,34000,Bencina
31728362,https://www.yapo.cl/autos-usados/ford-explorer-xlt-3-5-2014/31728362,FORD EXPLORER XLT 3.5 2014,Publicado 13/01/2026,2026-01-13,Ford,Explorer,,$8.300.000 (Rebajado 2%),8300000,2014,109'000,109000,Bencina
31576090,https://www.yapo.cl/autos-usados/chevrolet-onix-1-0-turbo/31576090,CHEVROLET ONIX 1.0 TURBO,Publicado 04/01/2026,2026-01-04,Chevrolet,Onix,,$8.790.000,8790000,2021,53'000,53000,Bencina
31275355,https://www.yapo.cl/autos-usados/motorhome-mitsibishi-l300/31275355,Motorhome Mitsibishi L300,Publicado 12/01/2026,2026-01-12,Mitsubishi,L300,,$8.000.000,8000000,2011,270'000,270000,Bencina
31784879,https://www.yapo.cl/autos-usados/mg-zx-1-5/31784879,MG ZX 1.5,Publicado 13/01/2026,2026-01-13,MG,ZX,,$9.490.000,9490000,2021,110'000,110000,Bencina
31810410,https://www.yapo.cl/autos-usados/casa-rodante/31810410,CASA RODANTE,Publicado 02/01/2026,2026-01-02,otros +,LMC,,$14.000.000,14000000,2005,,,Otros
31708429,https://www.yapo.cl/autos-usados/audi-a6-tdi-2-0-aut-2015/31708429,AUDI A6 TDI 2.0 AUT 2015,Publicado 07/01/2026,2026-01-07,Audi,A6,,$13.900.000 (Rebajado 7%),13900000,2015,146'562,146562,Diesel
31784884,https://www.yapo.cl/autos-usados/peugeot-3008-active-1-6-aut/31784884,Peugeot 3008 Active 1.6 Aut,Publicado 13/01/2026,2026-01-13,Peugeot,3008,,$10.990.000,10990000,2017,112'601,112601,Bencina
31841273,https://www.yapo.cl/autos-usados/camioneta-4x4-tdiesel-2017-a-a-impecable/31841273,"Camioneta 4x4, TDiesel, 2017, A/A, impecable",Publicado 09/01/2026,2026-01-09,SsangYong,Actyon Sports,,$12.590.000,12590000,2017,215'000,215000,Diesel
31780440,https://www.yapo.cl/autos-usados/ford-fusion-2-5-aut-2018/31780440,FORD FUSION 2.5 AUT 2018,Publicado 07/01/2026,2026-01-07,Ford,Fusion,,$14.480.000,14480000,2018,85'130,85130,Bencina
30596929,https://www.yapo.cl/autos-usados/maxus-g10-cargo-e5-ano-2022/30596929,MAXUS G10 CARGO E5 AÑO 2022,Publicado 31/12/2025,2025-12-31,Maxus,G10,,$11.990.000,11990000,2022,88'000,88000,Diesel
31468784,https://www.yapo.cl/autos-usados/se-vende-camioneta-2025/31468784,Se vende camioneta 2025,Publicado 30/12/2025,2025-12-30,Foton,G9 Ultimate 4x4 AT,,$20.000.000 (Rebajado 9%),20000000,2025,23,23,Diesel
31549178,https://www.yapo.cl/autos-usados/peugeot-508/31549178,PEUGEOT 508,Publicado 09/01/2026,2026-01-09,Peugeot,508,,$18.900.000,18900000,2021,33,33,Diesel
31754792,https://www.yapo.cl/autos-usados/mercedes-benz-a-200-d-diesel/31754792,MERCEDES BENZ A 200 D DIESEL,Publicado 31/12/2025,2025-12-31,Mercedes Benz,A200,,$16.500.000,16500000,2007,100'000,100000,Diesel
31845090,https://www.yapo.cl/autos-usados/peugeot-2008-automatico-2016/31845090,Peugeot 2008 Automático 2016,Publicado 10/01/2026,2026-01-10,Peugeot,2008,,$8.490.000,8490000,2016,84'000,84000,Bencina
31760129,https://www.yapo.cl/autos-usados/jeep-renegade-1-8-sport-lx-at-ano-2017/31760129,JEEP RENEGADE 1.8 SPORT LX AT AÑO 2017,Publicado 01/01/2026,2026-01-01,Jeep,Renegade,,$8.590.000,8590000,2017,112'800,112800,Bencina
31797977,https://www.yapo.cl/autos-usados/renault-duster-dinamique-1-6/31797977,Renault Duster Dinamique 1.6,Publicado 13/01/2026,2026-01-13,Renault,Duster,,$6.190.000,6190000,2016,96'845,96845,Bencina
31814869,https://www.yapo.cl/autos-usados/toyota-fortuner-srx-2-7/31814869,TOYOTA FORTUNER SRX 2.7,Publicado 06/01/2026,2026-01-06,Toyota,Fortuner,,$19.000.000,19000000,2018,208'000,208000,Bencina
31756322,https://www.yapo.cl/autos-usados/audi-a1-tfsi-2013/31756322,Audi A1 Tfsi 2013,Publicado 07/01/2026,2026-01-07,Audi,A1,,$6.490.000,6490000,2013,241'000,241000,Bencina
31391579,https://www.yapo.cl/autos-usados/ford-fiesta-1-6-hatch-titanium-mt/31391579,FORD FIESTA 1.6 HATCH TITANIUM MT,Publicado 13/01/2026,2026-01-13,Ford,Fiesta,,$8.990.000,8990000,2019,64'500,64500,Bencina
31661836,https://www.yapo.cl/autos-usados/vendo-mi-tucson-2017/31661836,Vendo mi tucson 2017,Publicado 31/12/2025,2025-12-31,Hyundai,Tucson,,$13.200.000,13200000,2017,100'950,100950,Bencina
31827446,https://www.yapo.cl/autos-usados/toyota-yaris/31827446,Toyota Yaris,Publicado 06/01/2026,2026-01-06,Toyota,Yaris,,$8.350.000,8350000,2017,132'300,132300,Bencina
31725592,https://www.yapo.cl/autos-usados/peugeot-3008-bluehdi-1-5/31725592,PEUGEOT 3008 BlueHdi 1.5,Publicado 13/01/2026,2026-01-13,Peugeot,3008,,$13.690.000 (Rebajado 2%),13690000,2020,67'048,67048,Diesel
31713405,https://www.yapo.cl/autos-usados/mazda-cx-7-gt/31713405,Mazda CX-7 GT,Publicado 06/01/2026,2026-01-06,Mazda,CX-7,,$6.790.000,6790000,2008,184'000,184000,Bencina
31602915,https://www.yapo.cl/autos-usados/hyundai-porter-2-5-ac-mt-2024-6-velocidades/31602915,HYUNDAI PORTER 2.5 AC MT 2024 6 VELOCIDADES,Publicado 07/01/2026,2026-01-07,Hyundai,Porter II,,$16.500.000,16500000,2024,104'000,104000,Diesel
31656256,https://www.yapo.cl/autos-usados/peugeot-3008-perfecto-estado/31656256,Peugeot 3008 perfecto estado,Publicado 07/01/2026,2026-01-07,Peugeot,3008,,$22.750.000,22750000,2022,35'096,35096,Bencina
31802565,https://www.yapo.cl/autos-usados/jac-s5/31802565,Jac S5,Publicado 30/12/2025,2025-12-30,Jac,S5,,$6.300.000,6300000,2016,107'000,107000,Bencina
31638227,https://www.yapo.cl/autos-usados/automovil-mg-6-impecable/31638227,Automóvil MG 6 impecable,Publicado 13/01/2026,2026-01-13,MG,MG6,,$8.100.000 (Rebajado 4%),8100000,2022,33'900,33900,Bencina
31512372,https://www.yapo.cl/autos-usados/ford-edge/31512372,FORD EDGE,Publicado 09/01/2026,2026-01-09,Ford,EDGE,,$13.950.000,13950000,2017,137,137,Bencina
31207321,https://www.yapo.cl/autos-usados/208-active-pack-bluhdi-1-5-peugeot/31207321,208 ACTIVE PACK BLUHDI 1.5 PEUGEOT,Publicado 09/01/2026,2026-01-09,Peugeot,208,,$11.490.000,11490000,2021,52,52,Diesel
31790890,https://www.yapo.cl/autos-usados/mitsubishi-montero-sport-motor-3-0-bencina-ano-2008/31790890,"Mitsubishi Montero Sport, motor 3.0 bencina año 2008",Publicado 08/01/2026,2026-01-08,Mitsubishi,Montero Sport,,$8.500.000 (Rebajado 6%),8500000,2008,148'000,148000,Bencina
31837117,https://www.yapo.cl/autos-usados/se-vende-chevrolet-sail-2023-impecable/31837117,SE VENDE CHEVROLET SAIL 2023 – IMPECABLE,Publicado 08/01/2026,2026-01-08,Chevrolet,Sail,,$7.800.000,7800000,2023,59'434,59434,Bencina
31798386,https://www.yapo.cl/autos-usados/chevrolet-tahoe-lt-2016-full-4x4/31798386,CHEVROLET TAHOE LT 2016 FULL 4X4,Publicado 29/12/2025,2025-12-29,Chevrolet,Tahoe,,$21.900.000,21900000,2016,158'594,158594,Bencina
31613089,https://www.yapo.cl/autos-usados/chevrolet-captiva-2025/31613089,Chevrolet Captiva 2025,Publicado 06/01/2026,2026-01-06,Chevrolet,Captiva,,$11.890.000 (Rebajado 3%),11890000,2025,1'600,1600,Bencina
31755967,https://www.yapo.cl/autos-usados/volkswagen-polo-hatchback-1-6-at/31755967,VOLKSWAGEN POLO HATCHBACK 1.6 AT,Publicado 13/01/2026,2026-01-13,Great Wall,Haval H6,,$9.990.000,9990000,2019,86'909,86909,Bencina
31164272,https://www.yapo.cl/autos-usados/haval/31164272,HAVAL,Publicado 09/01/2026,2026-01-09,Haval,H6,,$16.200.000,16200000,2024,10'300,10300,Bencina
31787038,https://www.yapo.cl/autos-usados/kia-soul-1-6-special-pack-2019/31787038,"Kia soul 1,6 special pack 2019",Publicado 09/01/2026,2026-01-09,Kia,SOUL,,$9.000.000,9000000,2019,162'200,162200,Bencina
31795091,https://www.yapo.cl/autos-usados/opel-corsa-enjoy-2015/31795091,Opel corsa enjoy 2015,Publicado 12/01/2026,2026-01-12,Opel,Corsa,,$5.000.000,5000000,2015,115'000,115000,Bencina
31782834,https://www.yapo.cl/autos-usados/mercedes-benz-glc-220-d-4-matic-ano-2020-67-000-kms/31782834,"Mercedes Benz GLC 220 D, 4 Matic , año 2020 , 67.000 kms",Publicado 07/01/2026,2026-01-07,Mercedes Benz,GLC220,,$28.000.000,28000000,2020,67'000,67000,Diesel
31492870,https://www.yapo.cl/autos-usados/se-vende-jeep-grand-cherokee-2017/31492870,Se vende Jeep Grand Cherokee 2017,Publicado 07/01/2026,2026-01-07,Jeep,Grand Cherokee,,$12.500.000 (Rebajado 11%),12500000,2017,119'000,119000,Bencina
31840742,https://www.yapo.cl/autos-usados/ford-f-150-xlt-4x4-5-0-2019/31840742,FORD F-150 XLT 4x4 5.0 2019,Publicado 09/01/2026,2026-01-09,Ford,F-150,,$21.990.000,21990000,2019,170'000,170000,Bencina
31770985,https://www.yapo.cl/autos-usados/vende-peugeot-expert-41-000-kms-diesel-un-solo-dueno/31770985,Vende Peugeot Expert 41.000 kms Diesel un solo dueño,Publicado 03/01/2026,2026-01-03,Peugeot,Expert,,$16.800.000,16800000,2020,41'000,41000,Diesel
31800625,https://www.yapo.cl/autos-usados/peugeot-diesel-3008/31800625,Peugeot Diesel 3008,Publicado 30/12/2025,2025-12-30,Peugeot,3008,,$16.200.000,16200000,2021,55'877,55877,Diesel
31840764,https://www.yapo.cl/autos-usados/toyota-hilux-dx-4x4-2023/31840764,TOYOTA HILUX DX 4x4 2023,Publicado 09/01/2026,2026-01-09,Toyota,Hilux,,$18.990.000,18990000,2023,87'000,87000,Diesel
31823859,https://www.yapo.cl/autos-usados/rampla-randon-sr-pt-cs-0330-ano-2022/31823859,RAMPLA RANDON SR PT CS 0330 AÑO 2022,Publicado 06/01/2026,2026-01-06,otros +,RANDON,,$17.500.000,17500000,2022,111'111'111,111111111,Otros
31778297,https://www.yapo.cl/autos-usados/se-vende/31778297,Se Vende,Publicado 06/01/2026,2026-01-06,Hyundai,Accent,,$4.800.000,4800000,2010,524'000,524000,Bencina
31208971,https://www.yapo.cl/autos-usados/vendo-jeep-mazda-4x4/31208971,VENDO JEEP MAZDA 4X4,Publicado 31/12/2025,2025-12-31,Mazda,CX-05,,$8.500.000 (Rebajado 6%),8500000,2014,127'200,127200,Bencina
31772760,https://www.yapo.cl/autos-usados/nissan-navara-2014/31772760,Nissan Navara 2014,Publicado 04/01/2026,2026-01-04,Nissan,Navara,,$9.000.000,9000000,2014,98'000,98000,Diesel
31774264,https://www.yapo.cl/autos-usados/suzuki-swift/31774264,Suzuki swift,Publicado 04/01/2026,2026-01-04,Suzuki,Swift,,$12.100.000,12100000,2024,24'000,24000,Bencina
31850353,https://www.yapo.cl/autos-usados/vendo-camioneta-hiunday-porter-2018/31850353,Vendo camioneta hiunday porter 2018,Publicado 12/01/2026,2026-01-12,Hyundai,Porter,,$11.000.000,11000000,2018,80'000,80000,Diesel
30950806,https://www.yapo.cl/autos-usados/pathfinder-exclusive-cvt-4x4-full/30950806,Pathfinder Exclusive CVT 4X4 full,Publicado 06/01/2026,2026-01-06,Nissan,Pathfinder,,$9.000.000 (Rebajado 18%),9000000,2016,98'000,98000,Bencina
31834414,https://www.yapo.cl/autos-usados/colorado-high-contry-4-x-4-at/31834414,COLORADO HIGH CONTRY 4 X 4 AT,Publicado 08/01/2026,2026-01-08,Chevrolet,Colorado,,$22.000.000,22000000,2019,70'000,70000,Diesel
31566707,https://www.yapo.cl/autos-usados/porsche-cayenne-gts/31566707,Porsche Cayenne GTS,Publicado 08/01/2026,2026-01-08,Porsche,Cayenne,,$26.890.000 (Rebajado 7%),26890000,2013,120'000,120000,Bencina
31799971,https://www.yapo.cl/autos-usados/subaru-outback-touring/31799971,Subaru Outback Touring,Publicado 30/12/2025,2025-12-30,Subaru,Outback,,$36.900.000,36900000,2025,19'000,19000,Bencina
31526048,https://www.yapo.cl/autos-usados/toyota-rav4-4x2-ano-2016-full-equipo-recibo-vehiculos/31526048,"TOYOTA RAV4 4x2 año 2016 full equipo, recibo vehiculos",Publicado 13/01/2026,2026-01-13,Toyota,RAV4,,$12.990.000 (Rebajado 4%),12990000,2016,104'000,104000,Bencina
31809219,https://www.yapo.cl/autos-usados/mitsubishi-montero-sport-2017-diesel/31809219,MITSUBISHI MONTERO SPORT 2017 DIESEL,Publicado 13/01/2026,2026-01-13,Mitsubishi,Montero Sport,,$13.999.000 (Rebajado 7%),13999000,2017,170'000,170000,Diesel
31795259,https://www.yapo.cl/autos-usados/se-vende-chevrolet-tracker-americano-2016-automatico-excelente-estado/31795259,Se Vende: Chevrolet Tracker Americano 2016 Automático – Excelente Estado,Publicado 12/01/2026,2026-01-12,Chevrolet,Tracker,,$7.500.000 (Rebajado 4%),7500000,2016,89'079,89079,Bencina
31580840,https://www.yapo.cl/autos-usados/citroen-berlingo-multispace-diesel-1-6-mec-2017/31580840,CITROEN BERLINGO MULTISPACE DIESEL 1.6 MEC 2017,Publicado 09/01/2026,2026-01-09,Citroen,Berlingo,,$8.970.000 (Rebajado 5%),8970000,2017,185'000,185000,Diesel
31829187,https://www.yapo.cl/autos-usados/3/31829187,3,Publicado 07/01/2026,2026-01-07,,1.5 COM MT,,$8.780.000,8780000,2023,21'167,21167,Bencina
31595715,https://www.yapo.cl/autos-usados/chery-tiggo-7-pro-1-5-turbo-aut-full-cuero-camara-ver-en-las-condes/31595715,CHERY TIGGO 7 PRO 1.5 TURBO AUT FULL CUERO CAMARA VER EN LAS CONDES,Publicado 09/01/2026,2026-01-09,Chery,Tiggo 7 Pro,,$12.570.000 (Rebajado 2%),12570000,2024,42'000,42000,Bencina
31501556,https://www.yapo.cl/autos-usados/renault-koleos-intens-2-5-aut-full-cuero-techo-camara-2023/31501556,RENAULT KOLEOS INTENS 2.5 AUT FULL CUERO TECHO CAMARA 2023,Publicado 09/01/2026,2026-01-09,Renault,Koleos,,$18.270.000 (Rebajado 1%),18270000,2023,48'000,48000,Bencina
31677785,https://www.yapo.cl/autos-usados/citroen-ds3-2014-full-equipo-1-6/31677785,citroen ds3 2014 full equipo 1.6,Publicado 19/12/2025,2025-12-19,Citroen,DS3,,$5.980.000 (Rebajado 5%),5980000,2014,149'000,149000,Bencina
31829191,https://www.yapo.cl/autos-usados/outlander/31829191,OUTLANDER,Publicado 07/01/2026,2026-01-07,Mitsubishi,OUTLANDER SPORT 1.5 GLS AT,,$21.780.000,21780000,2025,9'483,9483,Bencina
31306177,https://www.yapo.cl/autos-usados/peugeot-208-allure-pack/31306177,PEUGEOT 208 ALLURE PACK,Publicado 02/01/2026,2026-01-02,Peugeot,208,,$12.890.000 (Rebajado 3%),12890000,2024,11'316,11316,Bencina
31829199,https://www.yapo.cl/autos-usados/corsa/31829199,CORSA,Publicado 07/01/2026,2026-01-07,Opel,Corsa MCA Edition Gasolina 75HP MT,,$13.380.000,13380000,2025,19'683,19683,Bencina
31376058,https://www.yapo.cl/autos-usados/citroen-berlingo-diesel-1-5-mec-6-vel-full-aire-airbag-abs-2024/31376058,CITROEN BERLINGO DIESEL 1.5 MEC 6 VEL FULL AIRE AIRBAG ABS 2024,Publicado 09/01/2026,2026-01-09,Citroen,Berlingo,,$12.970.000 (Rebajado 2%),12970000,2024,36'000,36000,Diesel
31744139,https://www.yapo.cl/autos-usados/furgon-marca-mercedes-benz-modelo-sprinter-313-cdi-ano-2011/31744139,FURGON Marca MERCEDES BENZ Modelo SPRINTER 313 CDI Año 2011,Publicado 16/12/2025,2025-12-16,Mercedes Benz,Sprinter,,$9.200.000,9200000,2011,258'655,258655,Diesel
31829205,https://www.yapo.cl/autos-usados/new-mokka/31829205,NEW MOKKA,Publicado 07/01/2026,2026-01-07,Opel,1.2 ELEGANCE MT,,$14.480.000,14480000,2023,34'648,34648,Bencina
31770466,https://www.yapo.cl/autos-usados/peugeot-208-diesel-1-4-mec-solo-86-000-km-full-aire-airbag-abs-ver-en-las-condes-2022/31770466,PEUGEOT 208 DIESEL 1.4 MEC SOLO 86.000 KM FULL AIRE AIRBAG ABS VER EN LAS CONDES 2022,Publicado 09/01/2026,2026-01-09,Peugeot,208,,$6.970.000,6970000,2015,86'000,86000,Diesel
31801609,https://www.yapo.cl/autos-usados/jeep-commander-overland-diesel-2-0-automatico-4x4-3-corridas-2023/31801609,JEEP COMMANDER OVERLAND DIESEL 2.0 AUTOMATICO 4X4 3 CORRIDAS 2023,Publicado 09/01/2026,2026-01-09,Jeep,Commander,,$28.970.000,28970000,2023,44'000,44000,Diesel
31829215,https://www.yapo.cl/autos-usados/3008/31829215,3008,Publicado 07/01/2026,2026-01-07,Peugeot,1.2 ACTIVE PACK PURETECH 130 MT,,$13.680.000,13680000,2021,42'140,42140,Bencina
31844303,https://www.yapo.cl/autos-usados/mazda-2-sport-1-5-mec-version-v-full-aire-airbag-2011/31844303,MAZDA 2 SPORT 1.5 MEC VERSION V FULL AIRE AIRBAG 2011,Publicado 10/01/2026,2026-01-10,Mazda,2,,$4.970.000,4970000,2011,139'000,139000,Bencina
31767374,https://www.yapo.cl/autos-usados/peugeot-2008-active-1-2-ac-2025/31767374,Peugeot 2008 Active 1.2 Ac 2025,Publicado 06/01/2026,2026-01-06,Peugeot,2008,,$14.990.000,14990000,2025,3'000,3000,Bencina
31765557,https://www.yapo.cl/autos-usados/hyundai-grand-i10-value-1-2-aut-ac-2023/31765557,Hyundai Grand I10 Value 1.2 Aut Ac 2023,Publicado 06/01/2026,2026-01-06,Hyundai,Grand i10,,$10.990.000,10990000,2023,13'320,13320,Bencina
31446376,https://www.yapo.cl/autos-usados/great-wall-poer-plus-2-0-diesel-aut-ac-4wd-2025/31446376,Great Wall Poer Plus 2.0 Diesel Aut Ac 4WD 2025,Publicado 06/01/2026,2026-01-06,Great Wall,POER,,$25.000.000,25000000,2025,8'600,8600,Diesel
31789849,https://www.yapo.cl/autos-usados/volkswagen-bora-trendline-sky-2-0-mec-full-techo-aire-airbag-2012-ver-en-las-condes/31789849,VOLKSWAGEN BORA TRENDLINE SKY 2.0 MEC FULL TECHO AIRE AIRBAG 2012 VER EN LAS CONDES,Publicado 09/01/2026,2026-01-09,Volkswagen,Bora,,$5.670.000,5670000,2012,142'000,142000,Bencina
31199533,https://www.yapo.cl/autos-usados/subaru-impreza-sport-2-0-aut-ac-awd-2023/31199533,Subaru Impreza Sport 2.0 Aut Ac AWD 2023,Publicado 06/01/2026,2026-01-06,Subaru,Impreza,,$17.990.000 (Rebajado 8%),17990000,2023,40'320,40320,Bencina
31826447,https://www.yapo.cl/autos-usados/kia-grand-carnival-ex-2-2-aut-2017-ver-en-las-condes/31826447,KIA GRAND CARNIVAL EX 2.2 AUT 2017 VER EN LAS CONDES,Publicado 06/01/2026,2026-01-06,Kia,Grand Carnival,,$16.470.000,16470000,2017,173'000,173000,Diesel
31713354,https://www.yapo.cl/autos-usados/renault-koleos-dynamique-2-5-aut-full-cuero-techo-cuero-sonido-bose-2012/31713354,RENAULT KOLEOS DYNAMIQUE 2.5 AUT FULL CUERO TECHO CUERO SONIDO BOSE 2012,Publicado 09/01/2026,2026-01-09,Renault,Koleos,,$7.270.000 (Rebajado 3%),7270000,2012,142'000,142000,Bencina
31789437,https://www.yapo.cl/autos-usados/suv-500/31789437,SUV 500,Publicado 07/01/2026,2026-01-07,DFSK,1.5 LUXURY MT,,$8.980.000,8980000,2023,46'600,46600,Bencina
31606792,https://www.yapo.cl/autos-usados/hyundai-grand-i10-gls-1-2-mec-full-carplay-camara-aire-2023/31606792,HYUNDAI GRAND I10 GLS 1.2 MEC FULL CARPLAY CAMARA AIRE 2023,Publicado 09/01/2026,2026-01-09,Hyundai,Grand i10,,$8.270.000 (Rebajado 1%),8270000,2023,42'000,42000,Bencina
31761300,https://www.yapo.cl/autos-usados/mazda-3-version-v-1-6-automatico-full-techo-aire-airbag-japones-2014/31761300,MAZDA 3 VERSION V 1.6 AUTOMATICO FULL TECHO AIRE AIRBAG JAPONES 2014,Publicado 09/01/2026,2026-01-09,Mazda,3,,$7.970.000,7970000,2014,142'000,142000,Bencina
31696996,https://www.yapo.cl/autos-usados/bmw-x2-seminuevo/31696996,BMW X2 SEMINUEVO,Publicado 15/12/2025,2025-12-15,BMW,X2,,$25.590.000,25590000,2020,17'000,17000,Bencina
31356097,https://www.yapo.cl/autos-usados/nissan-versa/31356097,NISSAN VERSA,Publicado 02/01/2026,2026-01-02,Nissan,Versa,,$9.490.000 (Rebajado 4%),9490000,2021,69'150,69150,Híbrido
31703422,https://www.yapo.cl/autos-usados/jac-s5-2-0-t-mec-6-vel-full-cuero-techo-camara-solo-42-000-km-2018/31703422,JAC S5 2.0 T MEC 6 VEL FULL CUERO TECHO CAMARA SOLO 42.000 KM 2018,Publicado 09/01/2026,2026-01-09,Jac,S5,,$6.970.000 (Rebajado 4%),6970000,2018,42'000,42000,Bencina
31778108,https://www.yapo.cl/autos-usados/sportage/31778108,SPORTAGE,Publicado 07/01/2026,2026-01-07,Kia,2.0 EX BENC 2WD 6AT 5P,,$24.580.000,24580000,2024,15'425,15425,Bencina
31792341,https://www.yapo.cl/autos-usados/azkarra/31792341,AZKARRA,Publicado 07/01/2026,2026-01-07,Geely,1.5 TURBO EXCLUSIVE AT,,$13.080.000,13080000,2022,40'638,40638,Bencina
31404146,https://www.yapo.cl/autos-usados/citroen-new-c4-bluehdi-1-5-shine-at-2022/31404146,Citroën New C4 Bluehdi 1.5 Shine AT 2022,Publicado 06/01/2026,2026-01-06,Citroen,C4,,$17.490.000 (Rebajado 3%),17490000,2022,54'200,54200,Diesel
31778111,https://www.yapo.cl/autos-usados/zs/31778111,ZS,Publicado 07/01/2026,2026-01-07,,1.5 STD MT,,$9.980.000,9980000,2024,15'768,15768,Bencina
31678822,https://www.yapo.cl/autos-usados/peugeot-5008-gt-black-pack-diesel/31678822,PEUGEOT 5008 GT BLACK PACK DIESEL,Publicado 02/01/2026,2026-01-02,Peugeot,5008,,$24.690.000,24690000,2023,58'600,58600,Diesel
31812465,https://www.yapo.cl/autos-usados/peugeot-boxer-hdi-2-0-l4h2-ano-2022/31812465,PEUGEOT BOXER HDI 2.0 L4H2 AÑO 2022,Publicado 06/01/2026,2026-01-06,Peugeot,Boxer,,$19.900.000 (Rebajado 5%),19900000,2022,115'400,115400,Diesel
31829163,https://www.yapo.cl/autos-usados/onix/31829163,ONIX,Publicado 07/01/2026,2026-01-07,Chevrolet,1.0 HB RS MT,,$10.080.000,10080000,2022,51'428,51428,Bencina
31829165,https://www.yapo.cl/autos-usados/c5-aircross/31829165,C5 AIRCROSS,Publicado 07/01/2026,2026-01-07,,1.5 AIRCROSS BLUEHDI 130 S&S LIVE MT DIESEL,,$14.880.000,14880000,2021,62'569,62569,Bencina
31841900,https://www.yapo.cl/autos-usados/kia-sorento-ex-2-4-aut-4wd-full-ceuro-techo-camara-3-corridas-2013/31841900,KIA SORENTO EX 2.4 AUT 4WD FULL CEURO TECHO CAMARA 3 CORRIDAS 2013,Publicado 09/01/2026,2026-01-09,Kia,Sorento,,$9.970.000,9970000,2013,154'000,154000,Bencina
31565734,https://www.yapo.cl/autos-usados/mg-zs-1-5-aut-ac-2024/31565734,MG ZS 1.5 Aut Ac 2024,Publicado 06/01/2026,2026-01-06,MG,ZS,,$10.490.000,10490000,2024,64'560,64560,Bencina
31533100,https://www.yapo.cl/autos-usados/chevrolet-tracker-ltz-1-2t-at/31533100,CHEVROLET TRACKER LTZ 1.2T AT,Publicado 02/01/2026,2026-01-02,Chevrolet,Tracker,,$12.980.000 (Rebajado 4%),12980000,2023,19'000,19000,Bencina
31702804,https://www.yapo.cl/autos-usados/maxus-t60-diesel-dx-2-8-aut-53-000-km-full-carplay-aire-airbag-2022/31702804,MAXUS T60 DIESEL DX 2.8 AUT 53.000 KM FULL CARPLAY AIRE AIRBAG 2022,Publicado 09/01/2026,2026-01-09,Maxus,T60,,$12.570.000 (Rebajado 2%),12570000,2022,5'300,5300,Diesel
31778991,https://www.yapo.cl/autos-usados/hyundai-sonata-gls-2-4-mec-solo-114-000-km-full-aire-airbag-abs-2008/31778991,HYUNDAI SONATA GLS 2.4 MEC SOLO 114.000 KM FULL AIRE AIRBAG ABS 2008,Publicado 09/01/2026,2026-01-09,Hyundai,Sonata,,$5.270.000 (Rebajado 4%),5270000,2014,114'000,114000,Bencina
31829178,https://www.yapo.cl/autos-usados/coolray/31829178,COOLRAY,Publicado 07/01/2026,2026-01-07,Geely,COOLRAY 1.5 EXCLUSIVE 7DCT AT,,$13.580.000,13580000,2023,13'041,13041,Bencina
31836991,https://www.yapo.cl/autos-usados/subaru-xv-2-0-aut-4wd-full-aire-airbag-abs-ver-en-las-condes-2012/31836991,SUBARU XV 2.0 AUT 4WD FULL AIRE AIRBAG ABS VER EN LAS CONDES 2012,Publicado 08/01/2026,2026-01-08,Subaru,XV,,$7.470.000,7470000,2012,142'000,142000,Bencina
31836044,https://www.yapo.cl/autos-usados/changan-cx70-2021/31836044,CHANGAN CX70 2021,Publicado 09/01/2026,2026-01-09,Changan,CX70,,$9.180.000,9180000,2021,58'700,58700,Bencina
31542883,https://www.yapo.cl/autos-usados/chery-tiggo-7-pro-2022/31542883,CHERY TIGGO 7 PRO 2022,Publicado 09/01/2026,2026-01-09,Chery,Tiggo 7 Pro,,$11.980.000 (Rebajado 6%),11980000,2022,71'000,71000,Bencina
31644248,https://www.yapo.cl/autos-usados/fiat-500-2020/31644248,FIAT 500 2020,Publicado 09/01/2026,2026-01-09,Fiat,500,,$8.680.000,8680000,2020,52'100,52100,Bencina
31836341,https://www.yapo.cl/autos-usados/jac-js6-2024/31836341,JAC JS6 2024,Publicado 09/01/2026,2026-01-09,Jac,other,,$11.980.000,11980000,2024,28'300,28300,Bencina
30754796,https://www.yapo.cl/autos-usados/chery-tiggo-2-pro-glx-2022/30754796,Chery Tiggo 2 pro Glx 2022,Publicado 04/01/2026,2026-01-04,Chery,Tiggo 2 Pro,,$7.790.000 (Rebajado 3%),7790000,2022,42'000,42000,Bencina
31784993,https://www.yapo.cl/autos-usados/ford-explorer-limited-2-3-aut-ano-2016/31784993,FORD EXPLORER LIMITED 2.3 AUT AÑO 2016,Publicado 07/01/2026,2026-01-07,Ford,Explorer,,$16.990.000,16990000,2016,134'500,134500,Bencina
31850264,https://www.yapo.cl/autos-usados/mitsubishi-eclipse-croos-rx-ano-2019/31850264,MITSUBISHI ECLIPSE CROOS RX AÑO 2019,Publicado 12/01/2026,2026-01-12,Mitsubishi,Eclipse Cross,,$10.990.000,10990000,2019,13'582,13582,Bencina
31469773,https://www.yapo.cl/autos-usados/peugeot-308-automatico-diesel-2020/31469773,PEUGEOT 308 AUTOMÁTICO DIESEL 2020,Publicado 03/01/2026,2026-01-03,Peugeot,308,,$11.990.000,11990000,2020,101'000,101000,Diesel
31847697,https://www.yapo.cl/autos-usados/vendo-vehiculo/31847697,Vendo vehiculo,Publicado 11/01/2026,2026-01-11,Citroen,C-Elysee,,$6.900.000,6900000,2018,175'000,175000,Diesel
31813994,https://www.yapo.cl/autos-usados/suzuki-swift-2015-japones/31813994,Suzuki Swift 2015 japonés,Publicado 04/01/2026,2026-01-04,Suzuki,Swift,,$6.190.000,6190000,2015,150'000,150000,Bencina
31767666,https://www.yapo.cl/autos-usados/volkswagen-saveiro-cd-4x2-1-6-full-ano-2024/31767666,VOLKSWAGEN SAVEIRO CD 4X2 1.6 FULL AÑO 2024,Publicado 19/12/2025,2025-12-19,Volkswagen,Saveiro,,$12.490.000,12490000,2024,44'626,44626,Bencina
31849950,https://www.yapo.cl/autos-usados/geely-azcarra-1-5-full-aut-ano-2023/31849950,GEELY AZCARRA 1.5 FULL AUT. AÑO 2023,Publicado 12/01/2026,2026-01-12,Geely,Azkarra,,$11.990.000,11990000,2023,53'061,53061,Bencina
31683994,https://www.yapo.cl/autos-usados/citroen-c3-purecht-full-equipo-2023/31683994,Citroën c3 purecht full equipo 2023,Publicado 17/12/2025,2025-12-17,Citroen,C3,,$7.600.000 (Rebajado 5%),7600000,2023,94'500,94500,Bencina
31855947,https://www.yapo.cl/autos-usados/vehiculo-usado/31855947,Vehiculo usado,Publicado 13/01/2026,2026-01-13,Jeep,Compass,,$7.800.000,7800000,2019,181'000,181000,Bencina
31713103,https://www.yapo.cl/autos-usados/great-wall-poer-deluxe-4x4-at-ano-2023/31713103,GREAT WALL POER DELUXE 4X4 AT AÑO 2023,Publicado 07/01/2026,2026-01-07,Great Wall,POER,,$20.990.000,20990000,2023,73'000,73000,Diesel
31814326,https://www.yapo.cl/autos-usados/mitsubishi-outlander-2-2-ano-2004/31814326,Mitsubishi outlander 2.2 año 2004,Publicado 03/01/2026,2026-01-03,Mitsubishi,Outlander,,$2.800.000,2800000,2004,290'000,290000,Bencina
31834445,https://www.yapo.cl/autos-usados/toyota-corolla-1996/31834445,Toyota Corolla 1996,Publicado 08/01/2026,2026-01-08,Toyota,Corolla,,$3.000.000,3000000,1996,262'000,262000,Bencina
31851566,https://www.yapo.cl/autos-usados/mg-3-1-5-full-aut-ano-2024/31851566,MG-3 1.5 FULL AUT.AÑO 2024,Publicado 12/01/2026,2026-01-12,,MG3,,$8.890.000,8890000,2024,17'172,17172,Bencina
31697380,https://www.yapo.cl/autos-usados/chevrolet-suburban-lt/31697380,CHEVROLET SUBURBAN LT,Publicado 05/01/2026,2026-01-05,Chevrolet,Suburban,,$25.980.000,25980000,2017,142'600,142600,Bencina
31329836,https://www.yapo.cl/autos-usados/2022-ssangyong-grand-musso-2-2d-auto-glx/31329836,2022 SsangYong Grand Musso 2.2D Auto GLX,Publicado 05/01/2026,2026-01-05,SsangYong,Musso Grand,,$16.280.000 (Rebajado 3%),16280000,2022,108'235,108235,Diesel
31814011,https://www.yapo.cl/autos-usados/haval-h6-automatico-2019/31814011,Haval h6 automático 2019,Publicado 03/01/2026,2026-01-03,Haval,H6,,$9.890.000,9890000,2019,120'000,120000,Bencina
31558923,https://www.yapo.cl/autos-usados/mitsubishi-l200-work-2022-nueva/31558923,Mitsubishi L200 work 2022 nueva,Publicado 18/12/2025,2025-12-18,Mitsubishi,L 200,,$16.000.000 (Rebajado 6%),16000000,2022,80'000,80000,Diesel
31677589,https://www.yapo.cl/autos-usados/dongfenf-joyear-sx6-2020-3-corridas-de-asientos-1-6/31677589,dongfenf joyear sx6 2020 3 corridas de asientos 1.6,Publicado 02/01/2026,2026-01-02,Dongfeng,Joyear SX6,,$6.980.000,6980000,2020,160'000,160000,Bencina
31616706,https://www.yapo.cl/autos-usados/2010-mercedes-benz-c-200-1-8-c-200-blue-efficiency-elegance/31616706,2010 Mercedes-Benz C 200 1.8 C 200 Blue Efficiency Elegance,Publicado 05/01/2026,2026-01-05,Mercedes Benz,C220,,$7.880.000 (Rebajado 12%),7880000,2010,209'314,209314,Bencina
30518459,https://www.yapo.cl/autos-usados/2019-maxus-g10-1-9t-cargo/30518459,2019 Maxus G10 1.9T Cargo,Publicado 05/01/2026,2026-01-05,Maxus,G10,,$9.580.000 (Rebajado 3%),9580000,2019,91'601,91601,Diesel
31678553,https://www.yapo.cl/autos-usados/maxus-d60-nuevo/31678553,MAXUS D60 NUEVO!,Publicado 07/01/2026,2026-01-07,Maxus,D60,,$9.300.000,9300000,2024,2'000,2000,Bencina
31730344,https://www.yapo.cl/autos-usados/furgon-changan-m201/31730344,FURGON CHANGAN M201,Publicado 05/01/2026,2026-01-05,Changan,M201,,$5.980.000,5980000,2022,29'000,29000,Bencina
31727135,https://www.yapo.cl/autos-usados/2017-chevrolet-traverse-3-6-1lt-auto/31727135,2017 Chevrolet Traverse 3.6 1LT Auto,Publicado 05/01/2026,2026-01-05,Chevrolet,Traverse,,$14.180.000 (Rebajado 5%),14180000,2017,93'000,93000,Bencina
31787805,https://www.yapo.cl/autos-usados/navara/31787805,NAVARA,Publicado 07/01/2026,2026-01-07,Nissan,D CAB MT 4X4 2.3,,$24.780.000,24780000,2024,74'168,74168,Bencina
31512174,https://www.yapo.cl/autos-usados/maxus-t60-glx-4x4-2-0-aut-ano-2021-con-iva-incluido/31512174,MAXUS T60 GLX 4X4 2.0 AUT. AÑO 2021 CON IVA INCLUIDO,Publicado 17/12/2025,2025-12-17,Maxus,T60,,$13.990.000 (Rebajado 4%),13990000,2021,215,215,Diesel
31816377,https://www.yapo.cl/autos-usados/nissan-navara/31816377,Nissan Navara,Publicado 04/01/2026,2026-01-04,Nissan,Navara,,$20.000.000,20000000,2021,41'500,41500,Diesel
31410955,https://www.yapo.cl/autos-usados/honda-hrv-lxs-1-8-aut-ano-2021/31410955,HONDA HRV LXS 1.8 AUT AÑO 2021,Publicado 07/01/2026,2026-01-07,Honda,HR-V,,$14.000.000,14000000,2021,63,63,Bencina
31667970,https://www.yapo.cl/autos-usados/estanque-acero-inoxidable/31667970,Estanque Acero Inoxidable,Publicado 27/12/2025,2025-12-27,otros +,Tersaiunox,,$39.000.000 (Rebajado 3%),39000000,2016,100'000,100000,Diesel
31772940,https://www.yapo.cl/autos-usados/maxus-t60-2-8-diesel-4x4-ano-2022/31772940,MAXUS T60 2.8 DIESEL 4X4 AÑO 2022,Publicado 06/01/2026,2026-01-06,Maxus,T60,,$11.300.000 (Rebajado 5%),11300000,2022,61'300,61300,Diesel
25969905,https://www.yapo.cl/autos-usados/camioneta-nissan-np300-ano-2019-excelente-precio/25969905,Camioneta Nissan NP300 Año 2019 - Excelente precio.,Publicado 17/12/2025,2025-12-17,Nissan,NP300,,$11.250.000,11250000,2019,89'000,89000,Diesel
31821843,https://www.yapo.cl/autos-usados/se-vende-por-renovacion-suv-honda/31821843,Se vende por renovacion suv honda,Publicado 08/01/2026,2026-01-08,Honda,CR-V,,$4.000.000,4000000,2004,180'600,180600,Bencina
31229921,https://www.yapo.cl/autos-usados/chevrolet-captiva/31229921,Chevrolet Captiva,Publicado 27/12/2025,2025-12-27,Chevrolet,Captiva,,$13.900.000 (Rebajado 1%),13900000,2023,40'000,40000,Bencina
31701258,https://www.yapo.cl/autos-usados/2016-mazda-cx-5-2-0-skyactiv-r-auto/31701258,2016 Mazda Cx-5 2.0 Skyactiv R Auto,Publicado 05/01/2026,2026-01-05,Mazda,CX-5,,$11.180.000 (Rebajado 3%),11180000,2016,142'000,142000,Bencina
