{"ad_id": "31686412", "url": "https://www.yapo.cl/autos-usados/maxus-g10-2-0/31686412", "titulo": "Maxus G10 2.0", "fecha_publicado_texto": null, "fecha_publicado_iso": null, "marca": "Maxus", "modelo": "G10", "transmision": null, "precio_texto": "$18.000.000", "precio": 18000000, "anio": null, "kilometros_texto": "90'000", "kilometros": null, "combustible": "Diesel", "raw": {"Marca": "Maxus", "Modelo": "G10", "Precio": "$18.000.000", "Año": "2024", "Kilómetros": "90'000", "Combustible": "Diesel"}}
{"ad_id": "31732616", "url": "https://www.yapo.cl/autos-usados/peugeot-208-2024/31732616", "titulo": "PEUGEOT 208 2024", "fecha_publicado_texto": null, "fecha_publicado_iso": null, "marca": null, "modelo": null, "transmision": null, "precio_texto": null, "precio": null, "anio": null, "kilometros_texto": null, "kilometros": null, "combustible": null, "raw": {"marca": "Peugeot", "modelo": "208", "precio": "$11.890.000", "ano": "2024", "kilometros": "10'896", "combustible": "Bencina"}}
{"ad_id": "31813771", "url": "https://www.yapo.cl/autos-usados/toyota-land-cruiser-prado-2023-vx/31813771", "titulo": "Toyota Land Cruiser Prado 2023 VX", "fecha_publicado_texto": null, "fecha_publicado_iso": null, "marca": null, "modelo": null, "transmision": null, "precio_texto": null, "precio": null, "anio": null, "kilometros_texto": null, "kilometros": null, "combustible": null, "raw": {"marca": "Toyota", "modelo": "Prado", "precio": "$29.500.000", "ano": "2023", "kilometros": "29'000", "combustible": "Bencina"}}
{"ad_id": "31533219", "url": "https://www.yapo.cl/autos-usados/kia-sorento-2019/31533219", "titulo": "KIA SORENTO 2019", "fecha_publicado_texto": null, "fecha_publicado_iso": null, "marca": "Kia", "modelo": "Sorento", "transmision": null, "precio_texto": "$16.990.000", "precio": 16990000, "anio": 2019, "kilometros_texto": "108'737", "kilometros": 108737, "combustible": "Bencina", "raw": {"marca": "Kia", "modelo": "Sorento", "precio": "$16.990.000", "ano": "2019", "kilometros": "108'737", "combustible": "Bencina"}}
{"ad_id": "31029850", "url": "https://www.yapo.cl/autos-usados/kia-seltos-2025/31029850", "titulo": "KIA SELTOS 2025", "fecha_publicado_texto": null, "fecha_publicado_iso": null, "marca": "Kia", "modelo": "Seltos", "transmision": null, "precio_texto": "$19.990.000", "precio": 19990000, "anio": 2025, "kilometros_texto": "30", "kilometros": 30, "combustible": "Bencina", "raw": {"marca": "Kia", "modelo": "Seltos", "precio": "$19.990.000", "ano": "2025", "kilometros": "30", "combustible": "Bencina"}}
{"ad_id": "31781695", "url": "https://www.yapo.cl/autos-usados/peugeot-301-1-6-hdi-2022/31781695", "titulo": "PEUGEOT 301 1.6 HDI 2022", "fecha_publicado_texto": null, "fecha_publicado_iso": null, "marca": "Peugeot", "modelo": "301", "transmision": null, "precio_texto": "$10.990.000", "precio": 10990000, "anio": 2022, "kilometros_texto": "64'000", "kilometros": 64000, "combustible": "Diesel", "raw": {"marca": "Peugeot", "modelo": "301", "precio": "$10.990.000", "ano": "2022", "kilometros": "64'000", "combustible": "Diesel"}}
{"ad_id": "31781361", "url": "https://www.yapo.cl/autos-usados/kia-morning-2017/31781361", "titulo": "KIA MORNING 2017", "fecha_publicado_texto": null, "fecha_publicado_iso": null, "marca": "Kia", "modelo": "Morning", "transmision": null, "precio_texto": "$6.490.000", "precio": 6490000, "anio": 2017, "kilometros_texto": "111'000", "kilometros": 111000, "combustible": "Bencina", "raw": {"marca": "Kia", "modelo": "Morning", "precio": "$6.490.000", "ano": "2017", "kilometros": "111'000", "combustible": "Bencina"}}
{"ad_id": "31701553", "url": "https://www.yapo.cl/autos-usados/chevrolet-sail-2022/31701553", "titulo": "CHEVROLET SAIL 2022", "fecha_publicado_texto": null, "fecha_publicado_iso": null, "marca": "Chevrolet", "modelo": "Sail", "transmision": null, "precio_texto": "$6.990.000", "precio": 6990000, "anio": 2022, "kilometros_texto": "115'000", "kilometros": 115000, "combustible": "Bencina", "raw": {"marca": "Chevrolet", "modelo": "Sail", "precio": "$6.990.000", "ano": "2022", "kilometros": "115'000", "combustible": "Bencina"}}
{"ad_id": "31370699", "url": "https://www.yapo.cl/autos-usados/nissan-navara-2023/31370699", "titulo": "NISSAN NAVARA 2023", "fecha_publicado_texto": null, "fecha_publicado_iso": null, "marca": "Nissan", "modelo": "Navara", "transmision": null, "precio_texto": "$24.490.000", "precio": 24490000, "anio": 2023, "kilometros_texto": "41'088", "kilometros": 41088, "combustible": "Diesel", "raw": {"marca": "Nissan", "modelo": "Navara", "precio": "$24.490.000", "ano": "2023", "kilometros": "41'088", "combustible": "Diesel"}}
{"ad_id": "31370712", "url": "https://www.yapo.cl/autos-usados/nissan-navara-2023/31370712", "titulo": "NISSAN NAVARA 2023", "fecha_publicado_texto": null, "fecha_publicado_iso": null, "marca": "Nissan", "modelo": "Navara", "transmision": null, "precio_texto": "$24.490.000", "precio": 24490000, "anio": 2023, "kilometros_texto": "30'055", "kilometros": 30055, "combustible": "Diesel", "raw": {"marca": "Nissan", "modelo": "Navara", "precio": "$24.490.000", "ano": "2023", "kilometros": "30'055", "combustible": "Diesel"}}
{"ad_id": "31034638", "url": "https://www.yapo.cl/autos-usados/mini-bus-ford-transit-2025-full-17-1-unico-dueno-turismo-al-dia/31034638", "titulo": "MINI BUS FORD TRANSIT 2025 FULL 17+1 UNICO DUEÑO TURISMO AL DIA", "fecha_publicado_texto": null, "fecha_publicado_iso": null, "marca": "Ford", "modelo": "Transit Van", "transmision": null, "precio_texto": "$46.490.000 (Rebajado 1%)", "precio": 46490000, "anio": 2025, "kilometros_texto": "7'000", "kilometros": 7000, "combustible": "Diesel", "raw": {"marca": "Ford", "modelo": "Transit Van", "precio": "$46.490.000 (Rebajado 1%)", "ano": "2025", "kilometros": "7'000", "combustible": "Diesel"}}
{"ad_id": "31770647", "url": "https://www.yapo.cl/autos-usados/mazda-3/31770647", "titulo": "MAZDA 3", "fecha_publicado_texto": null, "fecha_publicado_iso": null, "marca": "Mazda", "modelo": "3", "transmision": null, "precio_texto": "$16.790.000", "precio": 16790000, "anio": 2023, "kilometros_texto": "35'500", "kilometros": 35500, "combustible": "Bencina", "raw": {"marca": "Mazda", "modelo": "3", "precio": "$16.790.000", "ano": "2023", "kilometros": "35'500", "combustible": "Bencina"}}
{"ad_id": "31533106", "url": "https://www.yapo.cl/autos-usados/peugeot-3008-2020-color-exclusivo/31533106", "titulo": "Peugeot 3008 2020 COLOR EXCLUSIVO", "fecha_publicado_texto": null, "fecha_publicado_iso": null, "marca": "Peugeot", "modelo": "3008", "transmision": null, "precio_texto": "$13.990.000 (Rebajado 5%)", "precio": 13990000, "anio": 2020, "kilometros_texto": "94'000", "kilometros": 94000, "combustible": "Diesel", "raw": {"marca": "Peugeot", "modelo": "3008", "precio": "$13.990.000 (Rebajado 5%)", "ano": "2020", "kilometros": "94'000", "combustible": "Diesel"}}
{"ad_id": "31770580", "url": "https://www.yapo.cl/autos-usados/hyundai-grand-i10-2023/31770580", "titulo": "HYUNDAI GRAND I10 2023", "fecha_publicado_texto": null, "fecha_publicado_iso": null, "marca": "Hyundai", "modelo": "Grand i10", "transmision": null, "precio_texto": "$9.290.000", "precio": 9290000, "anio": 2023, "kilometros_texto": "57'487", "kilometros": 57487, "combustible": "Bencina", "raw": {"marca": "Hyundai", "modelo": "Grand i10", "precio": "$9.290.000", "ano": "2023", "kilometros": "57'487", "combustible": "Bencina"}}
{"ad_id": "31768155", "url": "https://www.yapo.cl/autos-usados/toyota-hilux-2021-4x2/31768155", "titulo": "TOYOTA HILUX 2021 4X2", "fecha_publicado_texto": null, "fecha_publicado_iso": null, "marca": "Toyota", "modelo": "Hilux", "transmision": null, "precio_texto": "$17.990.000", "precio": 17990000, "anio": 2021, "kilometros_texto": "79'000", "kilometros": 79000, "combustible": "Diesel", "raw": {"marca": "Toyota", "modelo": "Hilux", "precio": "$17.990.000", "ano": "2021", "kilometros": "79'000", "combustible": "Diesel"}}
{"ad_id": "31459036", "url": "https://www.yapo.cl/autos-usados/ssangyong-rexton-aut-4x4-full-2018/31459036", "titulo": "SSANGYONG REXTON AUT 4x4 FULL 2018", "fecha_publicado_texto": null, "fecha_publicado_iso": null, "marca": "SsangYong", "modelo": "Rexton", "transmision": null, "precio_texto": "$12.490.000 (Rebajado 11%)", "precio": 12490000, "anio": 2018, "kilometros_texto": "173'000", "kilometros": 173000, "combustible": "Diesel", "raw": {"marca": "SsangYong", "modelo": "Rexton", "precio": "$12.490.000 (Rebajado 11%)", "ano": "2018", "kilometros": "173'000", "combustible": "Diesel"}}
{"ad_id": "31293950", "url": "https://www.yapo.cl/autos-usados/chevrolet-tahoe-z71-4x4-suv-ano-2021-full-ac-automatico-oferta/31293950", "titulo": "CHEVROLET TAHOE Z71 4X4 SUV AÑO 2021 FULL AC AUTOMATICO OFERTA", "fecha_publicado_texto": null, "fecha_publicado_iso": null, "marca": "Chevrolet", "modelo": "Tahoe", "transmision": null, "precio_texto": "$44.990.000 (Rebajado 4%)", "precio": 44990000, "anio": 2021, "kilometros_texto": "62'300", "kilometros": 62300, "combustible": "Bencina", "raw": {"marca": "Chevrolet", "modelo": "Tahoe", "precio": "$44.990.000 (Rebajado 4%)", "ano": "2021", "kilometros": "62'300", "combustible": "Bencina"}}
{"ad_id": "31256323", "url": "https://www.yapo.cl/autos-usados/toyota-yaris-sport-hb-1-5-mt-5-2021/31256323", "titulo": "TOYOTA YARIS SPORT HB 1.5 MT 5 2021", "fecha_publicado_texto": null, "fecha_publicado_iso": null, "marca": "Toyota", "modelo": "Yaris", "transmision": null, "precio_texto": "$10.990.000 (Rebajado 4%)", "precio": 10990000, "anio": 2021, "kilometros_texto": "41'667", "kilometros": 41667, "combustible": "Bencina", "raw": {"marca": "Toyota", "modelo": "Yaris", "precio": "$10.990.000 (Rebajado 4%)", "ano": "2021", "kilometros": "41'667", "combustible": "Bencina"}}
{"ad_id": "31706888", "url": "https://www.yapo.cl/autos-usados/chevrolet-colorado-z71-4x4/31706888", "titulo": "CHEVROLET COLORADO Z71 4x4", "fecha_publicado_texto": null, "fecha_publicado_iso": null, "marca": "Chevrolet", "modelo": "Colorado", "transmision": null, "precio_texto": "$8.990.000", "precio": 8990000, "anio": 2011, "kilometros_texto": "132'000", "kilometros": 132000, "combustible": "Bencina", "raw": {"marca": "Chevrolet", "modelo": "Colorado", "precio": "$8.990.000", "ano": "2011", "kilometros": "132'000", "combustible": "Bencina"}}
{"ad_id": "31747345", "url": "https://www.yapo.cl/autos-usados/changan-cs55-luxury-unico-dueno/31747345", "titulo": "Changan CS55 Luxury unico dueño", "fecha_publicado_texto": null, "fecha_publicado_iso": null, "marca": "Changan", "modelo": "CS55", "transmision": null, "precio_texto": "$9.800.000", "precio": 9800000, "anio": 2021, "kilometros_texto": "76'500", "kilometros": 76500, "combustible": "Bencina", "raw": {"marca": "Changan", "modelo": "CS55", "precio": "$9.800.000", "ano": "2021", "kilometros": "76'500", "combustible": "Bencina"}}
{"ad_id": "31684887", "url": "https://www.yapo.cl/autos-usados/nissan-murano-4x4-3-5-aut-2016/31684887", "titulo": "NISSAN MURANO 4X4 3.5 AUT 2016", "fecha_publicado_texto": null, "fecha_publicado_iso": null, "marca": "Nissan", "modelo": "Murano", "transmision": null, "precio_texto": "$10.900.000", "precio": 10900000, "anio": 2016, "kilometros_texto": "128'130", "kilometros": 128130, "combustible": "Bencina", "raw": {"marca": "Nissan", "modelo": "Murano", "precio": "$10.900.000", "ano": "2016", "kilometros": "128'130", "combustible": "Bencina"}}
{"ad_id": "31656219", "url": "https://www.yapo.cl/autos-usados/oportunidad-unica-vendo-ford-explorer-2018/31656219", "titulo": "OPORTUNIDAD ÚNICA VENDO FORD EXPLORER 2018", "fecha_publicado_texto": null, "fecha_publicado_iso": null, "marca": "Ford", "modelo": "Explorer", "transmision": null, "precio_texto": "$15.000.000", "precio": 15000000, "anio": 2018, "kilometros_texto": "88'000", "kilometros": 88000, "combustible": "Bencina", "raw": {"marca": "Ford", "modelo": "Explorer", "precio": "$15.000.000", "ano": "2018", "kilometros": "88'000", "combustible": "Bencina"}}
{"ad_id": "31744690", "url": "https://www.yapo.cl/autos-usados/camioneta-marca-chevrolet-modelo-d-max-e5-dcab-2-5-ano-2018/31744690", "titulo": "CAMIONETA MARCA CHEVROLET MODELO D MAX E5 DCAB 2.5 AÑO 2018", "fecha_publicado_texto": null, "fecha_publicado_iso": null, "marca": "Chevrolet", "modelo": "D-Max", "transmision": null, "precio_texto": "$8.600.000", "precio": 8600000, "anio": 2018, "kilometros_texto": "322'308", "kilometros": 322308, "combustible": "Diesel", "raw": {"marca": "Chevrolet", "modelo": "D-Max", "precio": "$8.600.000", "ano": "2018", "kilometros": "322'308", "combustible": "Diesel"}}
{"ad_id": "31746739", "url": "https://www.yapo.cl/autos-usados/volkswagen-golf-1-6-at-2019/31746739", "titulo": "VOLKSWAGEN GOLF 1.6 AT 2019", "fecha_publicado_texto": null, "fecha_publicado_iso": null, "marca": "Volkswagen", "modelo": "Golf", "transmision": null, "precio_texto": "$12.890.000", "precio": 12890000, "anio": 2019, "kilometros_texto": "129'013", "kilometros": 129013, "combustible": "Bencina", "raw": {"marca": "Volkswagen", "modelo": "Golf", "precio": "$12.890.000", "ano": "2019", "kilometros": "129'013", "combustible": "Bencina"}}
{"ad_id": "31799349", "url": "https://www.yapo.cl/autos-usados/mercedes-benz-e250-coupe-1-8-aut-2012/31799349", "titulo": "MERCEDES-BENZ E250 COUPE 1.8 AUT 2012", "fecha_publicado_texto": null, "fecha_publicado_iso": null, "marca": "Mercedes Benz", "modelo": "E250", "transmision": null, "precio_texto": "$14.900.000", "precio": 14900000, "anio": 2012, "kilometros_texto": "122'222", "kilometros": 122222, "combustible": "Bencina", "raw": {"marca": "Mercedes Benz", "modelo": "E250", "precio": "$14.900.000", "ano": "2012", "kilometros": "122'222", "combustible": "Bencina"}}
{"ad_id": "31757625", "url": "https://www.yapo.cl/autos-usados/mitsubishi-l200-diesel-4x4-ano-2022/31757625", "titulo": "Mitsubishi L200 Diesel 4x4 año 2022", "fecha_publicado_texto": null, "fecha_publicado_iso": null, "marca": "Mitsubishi", "modelo": "L 200", "transmision": null, "precio_texto": "$18.790.000", "precio": 18790000, "anio": 2022, "kilometros_texto": "48'000", "kilometros": 48000, "combustible": "Diesel", "raw": {"marca": "Mitsubishi", "modelo": "L 200", "precio": "$18.790.000", "ano": "2022", "kilometros": "48'000", "combustible": "Diesel"}}
{"ad_id": "31744580", "url": "https://www.yapo.cl/autos-usados/tation-wagon-marca-mazda-modelo-cx5-otto-2-0-aut-ano-2020/31744580", "titulo": "TATION WAGON Marca MAZDA Modelo CX5 OTTO 2.0 AUT Año 2020", "fecha_publicado_texto": null, "fecha_publicado_iso": null, "marca": "Mazda", "modelo": "CX-05", "transmision": null, "precio_texto": "$15.000.000", "precio": 15000000, "anio": 2020, "kilometros_texto": "78'416", "kilometros": 78416, "combustible": "Bencina", "raw": {"marca": "Mazda", "modelo": "CX-05", "precio": "$15.000.000", "ano": "2020", "kilometros": "78'416", "combustible": "Bencina"}}
{"ad_id": "31746117", "url": "https://www.yapo.cl/autos-usados/furgon-renault-dokker-ano-2016/31746117", "titulo": "FURGON RENAULT DOKKER AÑO 2016", "fecha_publicado_texto": null, "fecha_publicado_iso": null, "marca": "Renault", "modelo": "Dokker", "transmision": null, "precio_texto": "$3.900.000", "precio": 3900000, "anio": 2016, "kilometros_texto": "227'748", "kilometros": 227748, "combustible": "Diesel", "raw": {"marca": "Renault", "modelo": "Dokker", "precio": "$3.900.000", "ano": "2016", "kilometros": "227'748", "combustible": "Diesel"}}
{"ad_id": "31815626", "url": "https://www.yapo.cl/autos-usados/great-wall-poer-plus-deluxe-4x4-at-2-0-2024/31815626", "titulo": "GREAT WALL POER PLUS DELUXE 4X4 AT 2.0 2024", "fecha_publicado_texto": null, "fecha_publicado_iso": null, "marca": "Great Wall", "modelo": "POER", "transmision": null, "precio_texto": "$21.500.000", "precio": 21500000, "anio": 2024, "kilometros_texto": "62'557", "kilometros": 62557, "combustible": "Diesel", "raw": {"marca": "Great Wall", "modelo": "POER", "precio": "$21.500.000", "ano": "2024", "kilometros": "62'557", "combustible": "Diesel"}}
{"ad_id": "31547466", "url": "https://www.yapo.cl/autos-usados/mazda-cx-5-gt-4x4-2-2-2016/31547466", "titulo": "Mazda Cx-5 Gt 4X4 2.2 2016", "fecha_publicado_texto": null, "fecha_publicado_iso": null, "marca": "Mazda", "modelo": "CX-5", "transmision": null, "precio_texto": "$14.490.000 (Rebajado 3%)", "precio": 14490000, "anio": 2016, "kilometros_texto": "106'000", "kilometros": 106000, "combustible": "Diesel", "raw": {"marca": "Mazda", "modelo": "CX-5", "precio": "$14.490.000 (Rebajado 3%)", "ano": "2016", "kilometros": "106'000", "combustible": "Diesel"}}
{"ad_id": "31613899", "url": "https://www.yapo.cl/autos-usados/mitsubishi-outlander-2-0-at-4x2-2018/31613899", "titulo": "MITSUBISHI OUTLANDER 2.0 AT 4X2 2018", "fecha_publicado_texto": null, "fecha_publicado_iso": null, "marca": "Mitsubishi", "modelo": "Outlander", "transmision": null, "precio_texto": "$10.500.000 (Rebajado 4%)", "precio": 10500000, "anio": 2018, "kilometros_texto": "181'740", "kilometros": 181740, "combustible": "Bencina", "raw": {"marca": "Mitsubishi", "modelo": "Outlander", "precio": "$10.500.000 (Rebajado 4%)", "ano": "2018", "kilometros": "181'740", "combustible": "Bencina"}}
{"ad_id": "31673808", "url": "https://www.yapo.cl/autos-usados/ford-f-150-platinum-4x4-3-5-aut-2022/31673808", "titulo": "FORD F-150 PLATINUM 4X4 3.5 AUT 2022", "fecha_publicado_texto": null, "fecha_publicado_iso": null, "marca": "Ford", "modelo": "F-150", "transmision": null, "precio_texto": "$36.900.000 (Rebajado 3%)", "precio": 36900000, "anio": 2022, "kilometros_texto": "111'935", "kilometros": 111935, "combustible": "Bencina", "raw": {"marca": "Ford", "modelo": "F-150", "precio": "$36.900.000 (Rebajado 3%)", "ano": "2022", "kilometros": "111'935", "combustible": "Bencina"}}
{"ad_id": "31687774", "url": "https://www.yapo.cl/autos-usados/suzuki-jimny-jlx-1-3-4x4-2012/31687774", "titulo": "SUZUKI JIMNY JLX 1.3 4X4 2012", "fecha_publicado_texto": null, "fecha_publicado_iso": null, "marca": "Suzuki", "modelo": "Jimny", "transmision": null, "precio_texto": "$6.290.000", "precio": 6290000, "anio": 2012, "kilometros_texto": "150'864", "kilometros": 150864, "combustible": "Bencina", "raw": {"marca": "Suzuki", "modelo": "Jimny", "precio": "$6.290.000", "ano": "2012", "kilometros": "150'864", "combustible": "Bencina"}}
{"ad_id": "31356289", "url": "https://www.yapo.cl/autos-usados/citroen-berlingo-2022/31356289", "titulo": "CITROEN BERLINGO 2022", "fecha_publicado_texto": null, "fecha_publicado_iso": null, "marca": "Citroen", "modelo": "Berlingo", "transmision": null, "precio_texto": "$9.990.000 (Rebajado 9%)", "precio": 9990000, "anio": 2022, "kilometros_texto": "160'167", "kilometros": 160167, "combustible": "Diesel", "raw": {"marca": "Citroen", "modelo": "Berlingo", "precio": "$9.990.000 (Rebajado 9%)", "ano": "2022", "kilometros": "160'167", "combustible": "Diesel"}}
{"ad_id": "31735299", "url": "https://www.yapo.cl/autos-usados/renault-express-2023/31735299", "titulo": "RENAULT EXPRESS 2023", "fecha_publicado_texto": null, "fecha_publicado_iso": null, "marca": "Renault", "modelo": "Express", "transmision": null, "precio_texto": "$9.200.000", "precio": 9200000, "anio": 2023, "kilometros_texto": "55'000", "kilometros": 55000, "combustible": "Diesel", "raw": {"marca": "Renault", "modelo": "Express", "precio": "$9.200.000", "ano": "2023", "kilometros": "55'000", "combustible": "Diesel"}}
{"ad_id": "31645062", "url": "https://www.yapo.cl/autos-usados/chevrolet-tracker-2024/31645062", "titulo": "CHEVROLET TRACKER 2024", "fecha_publicado_texto": null, "fecha_publicado_iso": null, "marca": "Chevrolet", "modelo": "Tracker", "transmision": null, "precio_texto": "$11.990.000", "precio": 11990000, "anio": 2024, "kilometros_texto": "52'800", "kilometros": 52800, "combustible": "Bencina", "raw": {"marca": "Chevrolet", "modelo": "Tracker", "precio": "$11.990.000", "ano": "2024", "kilometros": "52'800", "combustible": "Bencina"}}
{"ad_id": "31581708", "url": "https://www.yapo.cl/autos-usados/camioneta-jmc-vigus-ano-2021-2-5-diesel-mt-4x2-full-equipo-ac/31581708", "titulo": "CAMIONETA JMC VIGUS AÑO 2021 2.5 DIESEL MT 4X2 FULL EQUIPO AC", "fecha_publicado_texto": null, "fecha_publicado_iso": null, "marca": "JMC", "modelo": "Vigus", "transmision": null, "precio_texto": "$7.990.000 (Rebajado 9%)", "precio": 7990000, "anio": 2021, "kilometros_texto": "89'226", "kilometros": 89226, "combustible": "Diesel", "raw": {"marca": "JMC", "modelo": "Vigus", "precio": "$7.990.000 (Rebajado 9%)", "ano": "2021", "kilometros": "89'226", "combustible": "Diesel"}}
{"ad_id": "31793040", "url": "https://www.yapo.cl/autos-usados/subaru-outback-2-5i-awd-aut-2008/31793040", "titulo": "Subaru Outback 2.5i AWD AUT 2008", "fecha_publicado_texto": null, "fecha_publicado_iso": null, "marca": "Subaru", "modelo": "Outback", "transmision": null, "precio_texto": "$5.850.000 (Rebajado 14%)", "precio": 5850000, "anio": 2008, "kilometros_texto": "130'000", "kilometros": 130000, "combustible": "Bencina", "raw": {"marca": "Subaru", "modelo": "Outback", "precio": "$5.850.000 (Rebajado 14%)", "ano": "2008", "kilometros": "130'000", "combustible": "Bencina"}}
{"ad_id": "31774480", "url": "https://www.yapo.cl/autos-usados/mg-zx-2023-zx-cvt-1-5-aut/31774480", "titulo": "MG Zx 2023 Zx Cvt 1.5 Aut", "fecha_publicado_texto": null, "fecha_publicado_iso": null, "marca": null, "modelo": "ZX", "transmision": null, "precio_texto": "$9.990.000 (Rebajado 9%)", "precio": 9990000, "anio": 2023, "kilometros_texto": "36'736", "kilometros": 36736, "combustible": "Bencina", "raw": {"modelo": "ZX", "precio": "$9.990.000 (Rebajado 9%)", "ano": "2023", "kilometros": "36'736", "combustible": "Bencina"}}
{"ad_id": "31664146", "url": "https://www.yapo.cl/autos-usados/volkswagen-virtus-2024/31664146", "titulo": "VOLKSWAGEN VIRTUS 2024", "fecha_publicado_texto": null, "fecha_publicado_iso": null, "marca": "Volkswagen", "modelo": "Virtus", "transmision": null, "precio_texto": "$13.190.000 (Rebajado 7%)", "precio": 13190000, "anio": 2024, "kilometros_texto": "23'800", "kilometros": 23800, "combustible": "Bencina", "raw": {"marca": "Volkswagen", "modelo": "Virtus", "precio": "$13.190.000 (Rebajado 7%)", "ano": "2024", "kilometros": "23'800", "combustible": "Bencina"}}
{"ad_id": "31543573", "url": "https://www.yapo.cl/autos-usados/chevrolet-tracker-2024/31543573", "titulo": "CHEVROLET TRACKER 2024", "fecha_publicado_texto": null, "fecha_publicado_iso": null, "marca": "Chevrolet", "modelo": "Tracker", "transmision": null, "precio_texto": "$11.990.000 (Rebajado 4%)", "precio": 11990000, "anio": 2024, "kilometros_texto": "51'950", "kilometros": 51950, "combustible": "Bencina", "raw": {"marca": "Chevrolet", "modelo": "Tracker", "precio": "$11.990.000 (Rebajado 4%)", "ano": "2024", "kilometros": "51'950", "combustible": "Bencina"}}
{"ad_id": "31481622", "url": "https://www.yapo.cl/autos-usados/chevrolet-tracker-2024/31481622", "titulo": "CHEVROLET TRACKER 2024", "fecha_publicado_texto": null, "fecha_publicado_iso": null, "marca": "Chevrolet", "modelo": "Tracker", "transmision": null, "precio_texto": "$11.990.000 (Rebajado 4%)", "precio": 11990000, "anio": 2024, "kilometros_texto": "40'739", "kilometros": 40739, "combustible": "Bencina", "raw": {"marca": "Chevrolet", "modelo": "Tracker", "precio": "$11.990.000 (Rebajado 4%)", "ano": "2024", "kilometros": "40'739", "combustible": "Bencina"}}
{"ad_id": "31277207", "url": "https://www.yapo.cl/autos-usados/peugeot-landtrek-2023/31277207", "titulo": "PEUGEOT LANDTREK 2023", "fecha_publicado_texto": null, "fecha_publicado_iso": null, "marca": "Peugeot", "modelo": "Landtrek", "transmision": null, "precio_texto": "$14.050.000 (Rebajado 10%)", "precio": 14050000, "anio": 2023, "kilometros_texto": "127'067", "kilometros": 127067, "combustible": "Diesel", "raw": {"marca": "Peugeot", "modelo": "Landtrek", "precio": "$14.050.000 (Rebajado 10%)", "ano": "2023", "kilometros": "127'067", "combustible": "Diesel"}}
{"ad_id": "31493664", "url": "https://www.yapo.cl/autos-usados/chevrolet/31493664", "titulo": "Chevrolet", "fecha_publicado_texto": null, "fecha_publicado_iso": null, "marca": "Chevrolet", "modelo": "Equinox", "transmision": null, "precio_texto": "$10.250.000", "precio": 10250000, "anio": 2020, "kilometros_texto": "79'300", "kilometros": 79300, "combustible": "Bencina", "raw": {"marca": "Chevrolet", "modelo": "Equinox", "precio": "$10.250.000", "ano": "2020", "kilometros": "79'300", "combustible": "Bencina"}}
{"ad_id": "31686820", "url": "https://www.yapo.cl/autos-usados/hyundai-porter-2021/31686820", "titulo": "HYUNDAI PORTER 2021", "fecha_publicado_texto": null, "fecha_publicado_iso": null, "marca": "Hyundai", "modelo": "Porter", "transmision": null, "precio_texto": "$13.400.000", "precio": 13400000, "anio": 2021, "kilometros_texto": "116'223", "kilometros": 116223, "combustible": "Diesel", "raw": {"marca": "Hyundai", "modelo": "Porter", "precio": "$13.400.000", "ano": "2021", "kilometros": "116'223", "combustible": "Diesel"}}
{"ad_id": "31538981", "url": "https://www.yapo.cl/autos-usados/volkswagen-virtus-2024/31538981", "titulo": "VOLKSWAGEN VIRTUS 2024", "fecha_publicado_texto": null, "fecha_publicado_iso": null, "marca": "Volkswagen", "modelo": "Virtus", "transmision": null, "precio_texto": "$13.190.000 (Rebajado 9%)", "precio": 13190000, "anio": 2024, "kilometros_texto": "20'043", "kilometros": 20043, "combustible": "Bencina", "raw": {"marca": "Volkswagen", "modelo": "Virtus", "precio": "$13.190.000 (Rebajado 9%)", "ano": "2024", "kilometros": "20'043", "combustible": "Bencina"}}
{"ad_id": "31755943", "url": "https://www.yapo.cl/autos-usados/chevrolet-tracker-2024/31755943", "titulo": "CHEVROLET TRACKER 2024", "fecha_publicado_texto": null, "fecha_publicado_iso": null, "marca": "Chevrolet", "modelo": "Tracker", "transmision": null, "precio_texto": "$11.990.000", "precio": 11990000, "anio": 2024, "kilometros_texto": "48'100", "kilometros": 48100, "combustible": "Bencina", "raw": {"marca": "Chevrolet", "modelo": "Tracker", "precio": "$11.990.000", "ano": "2024", "kilometros": "48'100", "combustible": "Bencina"}}
{"ad_id": "31758122", "url": "https://www.yapo.cl/autos-usados/suzuki-dzire-2023-dzire-gl-1-2/31758122", "titulo": "Suzuki Dzire 2023 Dzire Gl 1.2", "fecha_publicado_texto": null, "fecha_publicado_iso": null, "marca": "Suzuki", "modelo": "Dzire", "transmision": null, "precio_texto": "$8.490.000 (Rebajado 6%)", "precio": 8490000, "anio": 2023, "kilometros_texto": "62'348", "kilometros": 62348, "combustible": "Bencina", "raw": {"marca": "Suzuki", "modelo": "Dzire", "precio": "$8.490.000 (Rebajado 6%)", "ano": "2023", "kilometros": "62'348", "combustible": "Bencina"}}
{"ad_id": "31603886", "url": "https://www.yapo.cl/autos-usados/chevrolet-tracker-2024/31603886", "titulo": "CHEVROLET TRACKER 2024", "fecha_publicado_texto": null, "fecha_publicado_iso": null, "marca": "Chevrolet", "modelo": "Tracker", "transmision": null, "precio_texto": "$11.990.000", "precio": 11990000, "anio": 2024, "kilometros_texto": "33'809", "kilometros": 33809, "combustible": "Bencina", "raw": {"marca": "Chevrolet", "modelo": "Tracker", "precio": "$11.990.000", "ano": "2024", "kilometros": "33'809", "combustible": "Bencina"}}
{"ad_id": "31682094", "url": "https://www.yapo.cl/autos-usados/volkswagen-virtus-2023/31682094", "titulo": "VOLKSWAGEN VIRTUS 2023", "fecha_publicado_texto": null, "fecha_publicado_iso": null, "marca": "Volkswagen", "modelo": "Virtus", "transmision": null, "precio_texto": "$10.590.000", "precio": 10590000, "anio": 2023, "kilometros_texto": "60'742", "kilometros": 60742, "combustible": "Bencina", "raw": {"marca": "Volkswagen", "modelo": "Virtus", "precio": "$10.590.000", "ano": "2023", "kilometros": "60'742", "combustible": "Bencina"}}
{"ad_id": "31799984", "url": "https://www.yapo.cl/autos-usados/mg-zs/31799984", "titulo": "MG ZS", "fecha_publicado_texto": null, "fecha_publicado_iso": null, "marca": "MG", "modelo": "ZS", "transmision": null, "precio_texto": "$8.990.000", "precio": 8990000, "anio": 2021, "kilometros_texto": "59'000", "kilometros": 59000, "combustible": "Bencina", "raw": {"marca": "MG", "modelo": "ZS", "precio": "$8.990.000", "ano": "2021", "kilometros": "59'000", "combustible": "Bencina"}}
{"ad_id": "31732531", "url": "https://www.yapo.cl/autos-nuevos/great-wall-poer-azul-ano-2025/31732531", "titulo": null, "fecha_publicado_texto": null, "fecha_publicado_iso": null, "marca": "Great Wall", "modelo": "POER", "transmision": null, "precio_texto": "$16.430.687", "precio": 16430687, "anio": 2025, "kilometros_texto": "23", "kilometros": 23, "combustible": "Diesel", "raw": {"marca": "Great Wall", "modelo": "POER", "precio": "$16.430.687", "ano": "2025", "kilometros": "23", "combustible": "Diesel"}}
{"ad_id": "31643445", "url": "https://www.yapo.cl/autos-usados/suzuki-dzire-2022/31643445", "titulo": "SUZUKI DZIRE 2022", "fecha_publicado_texto": null, "fecha_publicado_iso": null, "marca": "Suzuki", "modelo": "Dzire", "transmision": null, "precio_texto": "$7.990.000", "precio": 7990000, "anio": 2022, "kilometros_texto": "98'400", "kilometros": 98400, "combustible": "Bencina", "raw": {"marca": "Suzuki", "modelo": "Dzire", "precio": "$7.990.000", "ano": "2022", "kilometros": "98'400", "combustible": "Bencina"}}
{"ad_id": "31758006", "url": "https://www.yapo.cl/autos-usados/chevrolet-spin-2023-spin-ltz-1-8-mt-3c/31758006", "titulo": "Chevrolet Spin 2023 Spin Ltz 1.8 Mt 3c", "fecha_publicado_texto": null, "fecha_publicado_iso": null, "marca": "Chevrolet", "modelo": "Spin", "transmision": null, "precio_texto": "$10.990.000", "precio": 10990000, "anio": 2023, "kilometros_texto": "70'250", "kilometros": 70250, "combustible": "Bencina", "raw": {"marca": "Chevrolet", "modelo": "Spin", "precio": "$10.990.000", "ano": "2023", "kilometros": "70'250", "combustible": "Bencina"}}
{"ad_id": "31478583", "url": "https://www.yapo.cl/autos-usados/chevrolet-tracker-2024/31478583", "titulo": "CHEVROLET TRACKER 2024", "fecha_publicado_texto": null, "fecha_publicado_iso": null, "marca": "Chevrolet", "modelo": "Tracker", "transmision": null, "precio_texto": "$12.490.000", "precio": 12490000, "anio": 2024, "kilometros_texto": "42'000", "kilometros": 42000, "combustible": "Bencina", "raw": {"marca": "Chevrolet", "modelo": "Tracker", "precio": "$12.490.000", "ano": "2024", "kilometros": "42'000", "combustible": "Bencina"}}
{"ad_id": "31449145", "url": "https://www.yapo.cl/autos-usados/maxus-t60-2023/31449145", "titulo": "MAXUS T60 2023", "fecha_publicado_texto": null, "fecha_publicado_iso": null, "marca": "Maxus", "modelo": "T60", "transmision": null, "precio_texto": "$11.500.000 (Rebajado 6%)", "precio": 11500000, "anio": 2023, "kilometros_texto": "108'000", "kilometros": 108000, "combustible": "Diesel", "raw": {"marca": "Maxus", "modelo": "T60", "precio": "$11.500.000 (Rebajado 6%)", "ano": "2023", "kilometros": "108'000", "combustible": "Diesel"}}
{"ad_id": "31534142", "url": "https://www.yapo.cl/autos-usados/mg-zx-2023/31534142", "titulo": "MG ZX 2023", "fecha_publicado_texto": null, "fecha_publicado_iso": null, "marca": null, "modelo": "ZX", "transmision": null, "precio_texto": "$10.590.000", "precio": 10590000, "anio": 2023, "kilometros_texto": "62'183", "kilometros": 62183, "combustible": "Bencina", "raw": {"modelo": "ZX", "precio": "$10.590.000", "ano": "2023", "kilometros": "62'183", "combustible": "Bencina"}}
{"ad_id": "31758014", "url": "https://www.yapo.cl/autos-usados/hyundai-elantra-2021-elantra-cn7-1-6-mt-plus/31758014", "titulo": "Hyundai Elantra 2021 Elantra Cn7 1.6 Mt Plus", "fecha_publicado_texto": null, "fecha_publicado_iso": null, "marca": "Hyundai", "modelo": "Elantra", "transmision": null, "precio_texto": "$11.580.000 (Rebajado 3%)", "precio": 11580000, "anio": 2021, "kilometros_texto": "93'200", "kilometros": 93200, "combustible": "Bencina", "raw": {"marca": "Hyundai", "modelo": "Elantra", "precio": "$11.580.000 (Rebajado 3%)", "ano": "2021", "kilometros": "93'200", "combustible": "Bencina"}}
{"ad_id": "31606080", "url": "https://www.yapo.cl/autos-usados/renault-express-2023/31606080", "titulo": "RENAULT EXPRESS 2023", "fecha_publicado_texto": null, "fecha_publicado_iso": null, "marca": "Renault", "modelo": "Express", "transmision": null, "precio_texto": "$9.200.000", "precio": 9200000, "anio": 2023, "kilometros_texto": "64'730", "kilometros": 64730, "combustible": "Diesel", "raw": {"marca": "Renault", "modelo": "Express", "precio": "$9.200.000", "ano": "2023", "kilometros": "64'730", "combustible": "Diesel"}}
{"ad_id": "31295682", "url": "https://www.yapo.cl/autos-usados/opel-corsa-2021/31295682", "titulo": "OPEL CORSA 2021", "fecha_publicado_texto": null, "fecha_publicado_iso": null, "marca": "Opel", "modelo": "Corsa", "transmision": null, "precio_texto": "$8.990.000 (Rebajado 9%)", "precio": 8990000, "anio": 2021, "kilometros_texto": "40'931", "kilometros": 40931, "combustible": "Bencina", "raw": {"marca": "Opel", "modelo": "Corsa", "precio": "$8.990.000 (Rebajado 9%)", "ano": "2021", "kilometros": "40'931", "combustible": "Bencina"}}
{"ad_id": "31321667", "url": "https://www.yapo.cl/autos-usados/mercedes-benz-c200/31321667", "titulo": "Mercedes Benz C200", "fecha_publicado_texto": "Publicado 13/01/2026", "fecha_publicado_iso": "2026-01-13", "marca": "Mercedes Benz", "modelo": "C200", "transmision": null, "precio_texto": "$8.990.000 (Rebajado 5%)", "precio": 8990000, "anio": 2009, "kilometros_texto": "118'000", "kilometros": 118000, "combustible": "Bencina", "raw": {"marca": "Mercedes Benz", "modelo": "C200", "precio": "$8.990.000 (Rebajado 5%)", "ano": "2009", "kilometros": "118'000", "combustible": "Bencina"}}
{"ad_id": "31765954", "url": "https://www.yapo.cl/autos-usados/chevrolet-captiva-2023/31765954", "titulo": "CHEVROLET CAPTIVA 2023", "fecha_publicado_texto": "Publicado 11/01/2026", "fecha_publicado_iso": "2026-01-11", "marca": "Chevrolet", "modelo": "Captiva", "transmision": null, "precio_texto": "$13.990.000", "precio": 13990000, "anio": 2023, "kilometros_texto": "28'326", "kilometros": 28326, "combustible": "Bencina", "raw": {"marca": "Chevrolet", "modelo": "Captiva", "precio": "$13.990.000", "ano": "2023", "kilometros": "28'326", "combustible": "Bencina"}}
{"ad_id": "31683017", "url": "https://www.yapo.cl/autos-usados/nissan-navara-2023/31683017", "titulo": "NISSAN NAVARA 2023", "fecha_publicado_texto": "Publicado 11/01/2026", "fecha_publicado_iso": "2026-01-11", "marca": "Nissan", "modelo": "Navara", "transmision": null, "precio_texto": "$18.100.000", "precio": 18100000, "anio": 2023, "kilometros_texto": "84'573", "kilometros": 84573, "combustible": "Diesel", "raw": {"marca": "Nissan", "modelo": "Navara", "precio": "$18.100.000", "ano": "2023", "kilometros": "84'573", "combustible": "Diesel"}}
{"ad_id": "29482062", "url": "https://www.yapo.cl/autos-usados/dfsk-d1-luxury-4x4/29482062", "titulo": "DFSK D1 LUXURY 4X4", "fecha_publicado_texto": "Publicado 07/01/2026", "fecha_publicado_iso": "2026-01-07", "marca": "DFSK", "modelo": "D1 LUXURY 4X4", "transmision": null, "precio_texto": "$21.884.100", "precio": 21884100, "anio": 2025, "kilometros_texto": "30", "kilometros": 30, "combustible": "Diesel", "raw": {"marca": "DFSK", "modelo": "D1 LUXURY 4X4", "precio": "$21.884.100", "ano": "2025", "kilometros": "30", "combustible": "Diesel"}}
{"ad_id": "31762652", "url": "https://www.yapo.cl/autos-usados/mg-zx-2023-mg-zx-1-5-cvt-dlx/31762652", "titulo": "MG Zx 2023 Mg Zx 1.5 Cvt Dlx", "fecha_publicado_texto": "Publicado 11/01/2026", "fecha_publicado_iso": "2026-01-11", "marca": null, "modelo": "ZX", "transmision": null, "precio_texto": "$11.690.000", "precio": 11690000, "anio": 2023, "kilometros_texto": "33'250", "kilometros": 33250, "combustible": "Bencina", "raw": {"modelo": "ZX", "precio": "$11.690.000", "ano": "2023", "kilometros": "33'250", "combustible": "Bencina"}}
{"ad_id": "30953560", "url": "https://www.yapo.cl/autos-usados/chevrolet-tracker-2024/30953560", "titulo": "CHEVROLET TRACKER 2024", "fecha_publicado_texto": "Publicado 11/01/2026", "fecha_publicado_iso": "2026-01-11", "marca": "Chevrolet", "modelo": "Tracker", "transmision": null, "precio_texto": "$11.490.000 (Rebajado 8%)", "precio": 11490000, "anio": 2024, "kilometros_texto": "49'277", "kilometros": 49277, "combustible": "Bencina", "raw": {"marca": "Chevrolet", "modelo": "Tracker", "precio": "$11.490.000 (Rebajado 8%)", "ano": "2024", "kilometros": "49'277", "combustible": "Bencina"}}
{"ad_id": "31543934", "url": "https://www.yapo.cl/autos-usados/chevrolet-tracker-2024/31543934", "titulo": "CHEVROLET TRACKER 2024", "fecha_publicado_texto": "Publicado 11/01/2026", "fecha_publicado_iso": "2026-01-11", "marca": "Chevrolet", "modelo": "Tracker", "transmision": null, "precio_texto": "$11.990.000 (Rebajado 4%)", "precio": 11990000, "anio": 2024, "kilometros_texto": "48'400", "kilometros": 48400, "combustible": "Bencina", "raw": {"marca": "Chevrolet", "modelo": "Tracker", "precio": "$11.990.000 (Rebajado 4%)", "ano": "2024", "kilometros": "48'400", "combustible": "Bencina"}}
{"ad_id": "31561186", "url": "https://www.yapo.cl/autos-usados/chevrolet-tracker-2024/31561186", "titulo": "CHEVROLET TRACKER 2024", "fecha_publicado_texto": "Publicado 11/01/2026", "fecha_publicado_iso": "2026-01-11", "marca": "Chevrolet", "modelo": "Tracker", "transmision": null, "precio_texto": "$11.990.000 (Rebajado 4%)", "precio": 11990000, "anio": 2024, "kilometros_texto": "49'260", "kilometros": 49260, "combustible": "Bencina", "raw": {"marca": "Chevrolet", "modelo": "Tracker", "precio": "$11.990.000 (Rebajado 4%)", "ano": "2024", "kilometros": "49'260", "combustible": "Bencina"}}
{"ad_id": "31594446", "url": "https://www.yapo.cl/autos-usados/hyundai-porter-2023/31594446", "titulo": "HYUNDAI PORTER 2023", "fecha_publicado_texto": "Publicado 11/01/2026", "fecha_publicado_iso": "2026-01-11", "marca": "Hyundai", "modelo": "Porter", "transmision": null, "precio_texto": "$17.600.000 (Rebajado 5%)", "precio": 17600000, "anio": 2023, "kilometros_texto": "61'000", "kilometros": 61000, "combustible": "Diesel", "raw": {"marca": "Hyundai", "modelo": "Porter", "precio": "$17.600.000 (Rebajado 5%)", "ano": "2023", "kilometros": "61'000", "combustible": "Diesel"}}
{"ad_id": "31761150", "url": "https://www.yapo.cl/autos-usados/peugeot-expert-2-0-hdi-premuim-2018/31761150", "titulo": "PEUGEOT EXPERT 2.0 HDI PREMUIM 2018", "fecha_publicado_texto": "Publicado 06/01/2026", "fecha_publicado_iso": "2026-01-06", "marca": "Peugeot", "modelo": "Expert", "transmision": null, "precio_texto": "$12.990.000", "precio": 12990000, "anio": 2018, "kilometros_texto": "170'000", "kilometros": 170000, "combustible": "Diesel", "raw": {"marca": "Peugeot", "modelo": "Expert", "precio": "$12.990.000", "ano": "2018", "kilometros": "170'000", "combustible": "Diesel"}}
{"ad_id": "31561188", "url": "https://www.yapo.cl/autos-usados/chevrolet-tracker-2024/31561188", "titulo": "CHEVROLET TRACKER 2024", "fecha_publicado_texto": "Publicado 11/01/2026", "fecha_publicado_iso": "2026-01-11", "marca": "Chevrolet", "modelo": "Tracker", "transmision": null, "precio_texto": "$11.990.000 (Rebajado 4%)", "precio": 11990000, "anio": 2024, "kilometros_texto": "55'448", "kilometros": 55448, "combustible": "Bencina", "raw": {"marca": "Chevrolet", "modelo": "Tracker", "precio": "$11.990.000 (Rebajado 4%)", "ano": "2024", "kilometros": "55'448", "combustible": "Bencina"}}
{"ad_id": "31702779", "url": "https://www.yapo.cl/autos-usados/nissan-kicks-2023/31702779", "titulo": "NISSAN KICKS 2023", "fecha_publicado_texto": "Publicado 11/01/2026", "fecha_publicado_iso": "2026-01-11", "marca": "Nissan", "modelo": "Kicks", "transmision": null, "precio_texto": "$15.990.000", "precio": 15990000, "anio": 2023, "kilometros_texto": "9'237", "kilometros": 9237, "combustible": "Bencina", "raw": {"marca": "Nissan", "modelo": "Kicks", "precio": "$15.990.000", "ano": "2023", "kilometros": "9'237", "combustible": "Bencina"}}
{"ad_id": "30935790", "url": "https://www.yapo.cl/autos-usados/peugeot-landtrek-2023/30935790", "titulo": "PEUGEOT LANDTREK 2023", "fecha_publicado_texto": "Publicado 11/01/2026", "fecha_publicado_iso": "2026-01-11", "marca": "Peugeot", "modelo": "Landtrek", "transmision": null, "precio_texto": "$13.600.000 (Rebajado 12%)", "precio": 13600000, "anio": 2023, "kilometros_texto": "103'356", "kilometros": 103356, "combustible": "Diesel", "raw": {"marca": "Peugeot", "modelo": "Landtrek", "precio": "$13.600.000 (Rebajado 12%)", "ano": "2023", "kilometros": "103'356", "combustible": "Diesel"}}
{"ad_id": "31767795", "url": "https://www.yapo.cl/autos-usados/hyundai-porter-2021/31767795", "titulo": "HYUNDAI PORTER 2021", "fecha_publicado_texto": "Publicado 11/01/2026", "fecha_publicado_iso": "2026-01-11", "marca": "Hyundai", "modelo": "Porter", "transmision": null, "precio_texto": "$13.400.000", "precio": 13400000, "anio": 2021, "kilometros_texto": "144'000", "kilometros": 144000, "combustible": "Diesel", "raw": {"marca": "Hyundai", "modelo": "Porter", "precio": "$13.400.000", "ano": "2021", "kilometros": "144'000", "combustible": "Diesel"}}
{"ad_id": "31731779", "url": "https://www.yapo.cl/autos-usados/citroen-c5-aircross-2020/31731779", "titulo": "CITROEN C5 AIRCROSS 2020", "fecha_publicado_texto": "Publicado 09/01/2026", "fecha_publicado_iso": "2026-01-09", "marca": "Citroen", "modelo": "C5 Aircross", "transmision": null, "precio_texto": "$12.980.000", "precio": 12980000, "anio": 2020, "kilometros_texto": "80'700", "kilometros": 80700, "combustible": "Bencina", "raw": {"marca": "Citroen", "modelo": "C5 Aircross", "precio": "$12.980.000", "ano": "2020", "kilometros": "80'700", "combustible": "Bencina"}}
{"ad_id": "31744200", "url": "https://www.yapo.cl/autos-usados/citroen-c3-2018-c3-aircross-bluehdi-1-6/31744200", "titulo": "Citroen C3 2018 C3 Aircross Bluehdi 1.6", "fecha_publicado_texto": "Publicado 11/01/2026", "fecha_publicado_iso": "2026-01-11", "marca": "Citroen", "modelo": "C3", "transmision": null, "precio_texto": "$10.490.000", "precio": 10490000, "anio": 2018, "kilometros_texto": "80'125", "kilometros": 80125, "combustible": "Diesel", "raw": {"marca": "Citroen", "modelo": "C3", "precio": "$10.490.000", "ano": "2018", "kilometros": "80'125", "combustible": "Diesel"}}
{"ad_id": "31678938", "url": "https://www.yapo.cl/autos-usados/chery-tiggo-7-pro-2022/31678938", "titulo": "CHERY TIGGO 7 PRO 2022", "fecha_publicado_texto": "Publicado 11/01/2026", "fecha_publicado_iso": "2026-01-11", "marca": "Chery", "modelo": "Tiggo 7 Pro", "transmision": null, "precio_texto": "$11.790.000 (Rebajado 5%)", "precio": 11790000, "anio": 2022, "kilometros_texto": "43'500", "kilometros": 43500, "combustible": "Bencina", "raw": {"marca": "Chery", "modelo": "Tiggo 7 Pro", "precio": "$11.790.000 (Rebajado 5%)", "ano": "2022", "kilometros": "43'500", "combustible": "Bencina"}}
{"ad_id": "31744215", "url": "https://www.yapo.cl/autos-usados/peugeot-allure-pack-puretech-100/31744215", "titulo": "Peugeot Allure Pack Puretech 100", "fecha_publicado_texto": "Publicado 11/01/2026", "fecha_publicado_iso": "2026-01-11", "marca": "Peugeot", "modelo": "208", "transmision": null, "precio_texto": "$12.690.000", "precio": 12690000, "anio": 2023, "kilometros_texto": "28'993", "kilometros": 28993, "combustible": "Bencina", "raw": {"marca": "Peugeot", "modelo": "208", "precio": "$12.690.000", "ano": "2023", "kilometros": "28'993", "combustible": "Bencina"}}
{"ad_id": "31758028", "url": "https://www.yapo.cl/autos-usados/mazda-cx-3-2019-new-cx-3-r-2-0-aut/31758028", "titulo": "Mazda Cx-3 2019 New Cx 3 R 2.0 Aut", "fecha_publicado_texto": "Publicado 11/01/2026", "fecha_publicado_iso": "2026-01-11", "marca": "Mazda", "modelo": "CX-3", "transmision": null, "precio_texto": "$13.990.000 (Rebajado 3%)", "precio": 13990000, "anio": 2019, "kilometros_texto": "72'657", "kilometros": 72657, "combustible": "Bencina", "raw": {"marca": "Mazda", "modelo": "CX-3", "precio": "$13.990.000 (Rebajado 3%)", "ano": "2019", "kilometros": "72'657", "combustible": "Bencina"}}
{"ad_id": "31614934", "url": "https://www.yapo.cl/autos-usados/chevrolet-tracker-2024/31614934", "titulo": "CHEVROLET TRACKER 2024", "fecha_publicado_texto": "Publicado 11/01/2026", "fecha_publicado_iso": "2026-01-11", "marca": "Chevrolet", "modelo": "Tracker", "transmision": null, "precio_texto": "$11.990.000", "precio": 11990000, "anio": 2024, "kilometros_texto": "39'670", "kilometros": 39670, "combustible": "Bencina", "raw": {"marca": "Chevrolet", "modelo": "Tracker", "precio": "$11.990.000", "ano": "2024", "kilometros": "39'670", "combustible": "Bencina"}}
{"ad_id": "31783166", "url": "https://www.yapo.cl/autos-usados/ford-territory-2024/31783166", "titulo": "FORD TERRITORY 2024", "fecha_publicado_texto": "Publicado 09/01/2026", "fecha_publicado_iso": "2026-01-09", "marca": "Ford", "modelo": "Territory", "transmision": null, "precio_texto": "$15.980.000", "precio": 15980000, "anio": 2024, "kilometros_texto": "37'900", "kilometros": 37900, "combustible": "Bencina", "raw": {"marca": "Ford", "modelo": "Territory", "precio": "$15.980.000", "ano": "2024", "kilometros": "37'900", "combustible": "Bencina"}}
{"ad_id": "31140088", "url": "https://www.yapo.cl/autos-usados/dfsk-cargo-box-2023-a-c/31140088", "titulo": "DFSK CARGO BOX 2023 A/C", "fecha_publicado_texto": "Publicado 12/01/2026", "fecha_publicado_iso": "2026-01-12", "marca": "DFSK", "modelo": "CARGO BOX", "transmision": null, "precio_texto": "$6.790.000 (Rebajado 7%)", "precio": 6790000, "anio": 2023, "kilometros_texto": "37'000", "kilometros": 37000, "combustible": "Bencina", "raw": {"marca": "DFSK", "modelo": "CARGO BOX", "precio": "$6.790.000 (Rebajado 7%)", "ano": "2023", "kilometros": "37'000", "combustible": "Bencina"}}
{"ad_id": "31250902", "url": "https://www.yapo.cl/autos-usados/hyundai-tucson-2023/31250902", "titulo": "HYUNDAI TUCSON 2023", "fecha_publicado_texto": "Publicado 07/01/2026", "fecha_publicado_iso": "2026-01-07", "marca": "Hyundai", "modelo": "Tucson", "transmision": null, "precio_texto": "$16.490.000 (Rebajado 7%)", "precio": 16490000, "anio": 2023, "kilometros_texto": "70'879", "kilometros": 70879, "combustible": "Bencina", "raw": {"marca": "Hyundai", "modelo": "Tucson", "precio": "$16.490.000 (Rebajado 7%)", "ano": "2023", "kilometros": "70'879", "combustible": "Bencina"}}
{"ad_id": "31659110", "url": "https://www.yapo.cl/autos-usados/maxus-t60-2023/31659110", "titulo": "MAXUS T60 2023", "fecha_publicado_texto": "Publicado 11/01/2026", "fecha_publicado_iso": "2026-01-11", "marca": "Maxus", "modelo": "T60", "transmision": null, "precio_texto": "$11.000.000", "precio": 11000000, "anio": 2023, "kilometros_texto": "125'463", "kilometros": 125463, "combustible": "Diesel", "raw": {"marca": "Maxus", "modelo": "T60", "precio": "$11.000.000", "ano": "2023", "kilometros": "125'463", "combustible": "Diesel"}}
{"ad_id": "31611228", "url": "https://www.yapo.cl/autos-usados/chevrolet-onix-2023/31611228", "titulo": "CHEVROLET ONIX 2023", "fecha_publicado_texto": "Publicado 11/01/2026", "fecha_publicado_iso": "2026-01-11", "marca": "Chevrolet", "modelo": "Onix", "transmision": null, "precio_texto": "$9.890.000", "precio": 9890000, "anio": 2023, "kilometros_texto": "22'350", "kilometros": 22350, "combustible": "Bencina", "raw": {"marca": "Chevrolet", "modelo": "Onix", "precio": "$9.890.000", "ano": "2023", "kilometros": "22'350", "combustible": "Bencina"}}
{"ad_id": "31800015", "url": "https://www.yapo.cl/autos-usados/maxus-t60-glx/31800015", "titulo": "MAXUS T60 GLX", "fecha_publicado_texto": "Publicado 09/01/2026", "fecha_publicado_iso": "2026-01-09", "marca": "Maxus", "modelo": "T60", "transmision": null, "precio_texto": "$15.900.000", "precio": 15900000, "anio": 2022, "kilometros_texto": "189'000", "kilometros": 189000, "combustible": "Diesel", "raw": {"marca": "Maxus", "modelo": "T60", "precio": "$15.900.000", "ano": "2022", "kilometros": "189'000", "combustible": "Diesel"}}
{"ad_id": "31643387", "url": "https://www.yapo.cl/autos-usados/chevrolet-tracker-2024/31643387", "titulo": "CHEVROLET TRACKER 2024", "fecha_publicado_texto": "Publicado 07/01/2026", "fecha_publicado_iso": "2026-01-07", "marca": "Chevrolet", "modelo": "Tracker", "transmision": null, "precio_texto": "$11.990.000", "precio": 11990000, "anio": 2024, "kilometros_texto": "46'827", "kilometros": 46827, "combustible": "Bencina", "raw": {"marca": "Chevrolet", "modelo": "Tracker", "precio": "$11.990.000", "ano": "2024", "kilometros": "46'827", "combustible": "Bencina"}}
{"ad_id": "31505389", "url": "https://www.yapo.cl/autos-usados/omoda-c5-luxury/31505389", "titulo": "Omoda C5 Luxury", "fecha_publicado_texto": "Publicado 08/01/2026", "fecha_publicado_iso": "2026-01-08", "marca": "Omoda", "modelo": "C5 Luxury", "transmision": null, "precio_texto": "$12.900.000", "precio": 12900000, "anio": 2024, "kilometros_texto": "41'000", "kilometros": 41000, "combustible": "Bencina", "raw": {"marca": "Omoda", "modelo": "C5 Luxury", "precio": "$12.900.000", "ano": "2024", "kilometros": "41'000", "combustible": "Bencina"}}
{"ad_id": "31775182", "url": "https://www.yapo.cl/autos-usados/mitsubishi-montero-4x4-3-8-cc/31775182", "titulo": "MITSUBISHI MONTERO 4X4 3.8 CC", "fecha_publicado_texto": "Publicado 10/01/2026", "fecha_publicado_iso": "2026-01-10", "marca": "Mitsubishi", "modelo": "Montero GLS", "transmision": null, "precio_texto": "$5.200.000", "precio": 5200000, "anio": 2003, "kilometros_texto": "150'000", "kilometros": 150000, "combustible": "Bencina", "raw": {"marca": "Mitsubishi", "modelo": "Montero GLS", "precio": "$5.200.000", "ano": "2003", "kilometros": "150'000", "combustible": "Bencina"}}
{"ad_id": "30278308", "url": "https://www.yapo.cl/autos-usados/volkswagen-amarok-2022/30278308", "titulo": "VOLKSWAGEN AMAROK 2022", "fecha_publicado_texto": "Publicado 04/01/2026", "fecha_publicado_iso": "2026-01-04", "marca": "Volkswagen", "modelo": "Amarok", "transmision": null, "precio_texto": "$17.990.000", "precio": 17990000, "anio": 2022, "kilometros_texto": "145'000", "kilometros": 145000, "combustible": "Diesel", "raw": {"marca": "Volkswagen", "modelo": "Amarok", "precio": "$17.990.000", "ano": "2022", "kilometros": "145'000", "combustible": "Diesel"}}
{"ad_id": "31740143", "url": "https://www.yapo.cl/autos-usados/honda-hr-v-lx-1-8-at/31740143", "titulo": "Honda HR V LX 1.8 AT", "fecha_publicado_texto": "Publicado 04/01/2026", "fecha_publicado_iso": "2026-01-04", "marca": "Honda", "modelo": "HR-V", "transmision": null, "precio_texto": "$12.590.000", "precio": 12590000, "anio": 2018, "kilometros_texto": "95'032", "kilometros": 95032, "combustible": "Bencina", "raw": {"marca": "Honda", "modelo": "HR-V", "precio": "$12.590.000", "ano": "2018", "kilometros": "95'032", "combustible": "Bencina"}}
{"ad_id": "31626294", "url": "https://www.yapo.cl/autos-usados/toyota-yaris-2015/31626294", "titulo": "TOYOTA YARIS 2015", "fecha_publicado_texto": "Publicado 07/01/2026", "fecha_publicado_iso": "2026-01-07", "marca": "Toyota", "modelo": "Yaris", "transmision": null, "precio_texto": "$6.490.000", "precio": 6490000, "anio": 2015, "kilometros_texto": "40'094", "kilometros": 40094, "combustible": "Bencina", "raw": {"marca": "Toyota", "modelo": "Yaris", "precio": "$6.490.000", "ano": "2015", "kilometros": "40'094", "combustible": "Bencina"}}
{"ad_id": "31471322", "url": "https://www.yapo.cl/autos-usados/chevrolet-tracker-2025/31471322", "titulo": "CHEVROLET TRACKER 2025", "fecha_publicado_texto": "Publicado 07/01/2026", "fecha_publicado_iso": "2026-01-07", "marca": "Chevrolet", "modelo": "Tracker", "transmision": null, "precio_texto": "$16.890.000 (Rebajado 2%)", "precio": 16890000, "anio": 2025, "kilometros_texto": "5'037", "kilometros": 5037, "combustible": "Bencina", "raw": {"marca": "Chevrolet", "modelo": "Tracker", "precio": "$16.890.000 (Rebajado 2%)", "ano": "2025", "kilometros": "5'037", "combustible": "Bencina"}}
{"ad_id": "31856069", "url": "https://www.yapo.cl/autos-nuevos/chevrolet-sail-sedan/31856069", "titulo": null, "fecha_publicado_texto": "Publicado 13/01/2026", "fecha_publicado_iso": "2026-01-13", "marca": "Chevrolet", "modelo": "Sail", "transmision": null, "precio_texto": "$9.990.000", "precio": 9990000, "anio": 2026, "kilometros_texto": null, "kilometros": null, "combustible": "Bencina", "raw": {"marca": "Chevrolet", "modelo": "Sail", "precio": "$9.990.000", "ano": "2026", "combustible": "Bencina"}}
{"ad_id": "31776858", "url": "https://www.yapo.cl/autos-usados/chevrolet-colorado-2023/31776858", "titulo": "CHEVROLET COLORADO 2023", "fecha_publicado_texto": "Publicado 07/01/2026", "fecha_publicado_iso": "2026-01-07", "marca": "Chevrolet", "modelo": "Colorado", "transmision": null, "precio_texto": "$22.100.000", "precio": 22100000, "anio": 2023, "kilometros_texto": "63'000", "kilometros": 63000, "combustible": "Diesel", "raw": {"marca": "Chevrolet", "modelo": "Colorado", "precio": "$22.100.000", "ano": "2023", "kilometros": "63'000", "combustible": "Diesel"}}
{"ad_id": "31596354", "url": "https://www.yapo.cl/autos-usados/kia-seltos-2024/31596354", "titulo": "KIA SELTOS 2024", "fecha_publicado_texto": "Publicado 06/01/2026", "fecha_publicado_iso": "2026-01-06", "marca": "Kia", "modelo": "Seltos", "transmision": null, "precio_texto": "$15.990.000", "precio": 15990000, "anio": 2024, "kilometros_texto": "39'000", "kilometros": 39000, "combustible": "Bencina", "raw": {"marca": "Kia", "modelo": "Seltos", "precio": "$15.990.000", "ano": "2024", "kilometros": "39'000", "combustible": "Bencina"}}
{"ad_id": "30317375", "url": "https://www.yapo.cl/autos-usados/chevrolet-onix-2024/30317375", "titulo": "CHEVROLET ONIX 2024", "fecha_publicado_texto": "Publicado 07/01/2026", "fecha_publicado_iso": "2026-01-07", "marca": "Chevrolet", "modelo": "Onix", "transmision": null, "precio_texto": "$10.990.000 (Rebajado 1%)", "precio": 10990000, "anio": 2024, "kilometros_texto": "3'840", "kilometros": 3840, "combustible": "Bencina", "raw": {"marca": "Chevrolet", "modelo": "Onix", "precio": "$10.990.000 (Rebajado 1%)", "ano": "2024", "kilometros": "3'840", "combustible": "Bencina"}}
{"ad_id": "31825991", "url": "https://www.yapo.cl/autos-usados/chevrolet-tracker-2024/31825991", "titulo": "CHEVROLET TRACKER 2024", "fecha_publicado_texto": "Publicado 07/01/2026", "fecha_publicado_iso": "2026-01-07", "marca": "Chevrolet", "modelo": "Tracker", "transmision": null, "precio_texto": "$11.990.000", "precio": 11990000, "anio": 2024, "kilometros_texto": "33'590", "kilometros": 33590, "combustible": "Bencina", "raw": {"marca": "Chevrolet", "modelo": "Tracker", "precio": "$11.990.000", "ano": "2024", "kilometros": "33'590", "combustible": "Bencina"}}
{"ad_id": "31588080", "url": "https://www.yapo.cl/autos-usados/mg-3-2022/31588080", "titulo": "MG 3 2022", "fecha_publicado_texto": "Publicado 05/01/2026", "fecha_publicado_iso": "2026-01-05", "marca": null, "modelo": "MG3", "transmision": null, "precio_texto": "$7.690.000", "precio": 7690000, "anio": 2022, "kilometros_texto": "38'764", "kilometros": 38764, "combustible": "Bencina", "raw": {"modelo": "MG3", "precio": "$7.690.000", "ano": "2022", "kilometros": "38'764", "combustible": "Bencina"}}
{"ad_id": "31078446", "url": "https://www.yapo.cl/autos-usados/peugeot-2008-2023/31078446", "titulo": "PEUGEOT 2008 2023", "fecha_publicado_texto": "Publicado 05/01/2026", "fecha_publicado_iso": "2026-01-05", "marca": "Peugeot", "modelo": "2008", "transmision": null, "precio_texto": "$12.990.000 (Rebajado 2%)", "precio": 12990000, "anio": 2023, "kilometros_texto": "52'173", "kilometros": 52173, "combustible": "Bencina", "raw": {"marca": "Peugeot", "modelo": "2008", "precio": "$12.990.000 (Rebajado 2%)", "ano": "2023", "kilometros": "52'173", "combustible": "Bencina"}}
{"ad_id": "31829306", "url": "https://www.yapo.cl/autos-usados/maxus-c35-l/31829306", "titulo": "MAXUS C35 L", "fecha_publicado_texto": "Publicado 07/01/2026", "fecha_publicado_iso": "2026-01-07", "marca": "Maxus", "modelo": "C35", "transmision": null, "precio_texto": "$15.900.000", "precio": 15900000, "anio": 2023, "kilometros_texto": "71'000", "kilometros": 71000, "combustible": "Diesel", "raw": {"marca": "Maxus", "modelo": "C35", "precio": "$15.900.000", "ano": "2023", "kilometros": "71'000", "combustible": "Diesel"}}
{"ad_id": "31746092", "url": "https://www.yapo.cl/autos-usados/furgon-marca-renault-modelo-dokker-iii-1-6-ano-2017/31746092", "titulo": "FURGON MARCA RENAULT MODELO DOKKER III 1.6 AÑO 2017", "fecha_publicado_texto": "Publicado 05/01/2026", "fecha_publicado_iso": "2026-01-05", "marca": "Renault", "modelo": "Dokker", "transmision": null, "precio_texto": "$4.500.000", "precio": 4500000, "anio": 2018, "kilometros_texto": "166'677", "kilometros": 166677, "combustible": "Bencina", "raw": {"marca": "Renault", "modelo": "Dokker", "precio": "$4.500.000", "ano": "2018", "kilometros": "166'677", "combustible": "Bencina"}}
{"ad_id": "31585324", "url": "https://www.yapo.cl/autos-usados/volkswagen-saveiro-2024/31585324", "titulo": "VOLKSWAGEN SAVEIRO 2024", "fecha_publicado_texto": "Publicado 06/01/2026", "fecha_publicado_iso": "2026-01-06", "marca": "Volkswagen", "modelo": "Saveiro", "transmision": null, "precio_texto": "$13.990.000", "precio": 13990000, "anio": 2024, "kilometros_texto": "8'588", "kilometros": 8588, "combustible": "Bencina", "raw": {"marca": "Volkswagen", "modelo": "Saveiro", "precio": "$13.990.000", "ano": "2024", "kilometros": "8'588", "combustible": "Bencina"}}
{"ad_id": "31730086", "url": "https://www.yapo.cl/autos-usados/toyota-rush-2023/31730086", "titulo": "TOYOTA RUSH 2023", "fecha_publicado_texto": "Publicado 07/01/2026", "fecha_publicado_iso": "2026-01-07", "marca": "Toyota", "modelo": "Rush", "transmision": null, "precio_texto": "$11.790.000", "precio": 11790000, "anio": 2023, "kilometros_texto": "35'425", "kilometros": 35425, "combustible": "Bencina", "raw": {"marca": "Toyota", "modelo": "Rush", "precio": "$11.790.000", "ano": "2023", "kilometros": "35'425", "combustible": "Bencina"}}
{"ad_id": "31483343", "url": "https://www.yapo.cl/autos-usados/fiat-pulse-2023/31483343", "titulo": "FIAT PULSE 2023", "fecha_publicado_texto": "Publicado 07/01/2026", "fecha_publicado_iso": "2026-01-07", "marca": "Fiat", "modelo": "Pulse", "transmision": null, "precio_texto": "$13.290.000", "precio": 13290000, "anio": 2023, "kilometros_texto": "44'600", "kilometros": 44600, "combustible": "Bencina", "raw": {"marca": "Fiat", "modelo": "Pulse", "precio": "$13.290.000", "ano": "2023", "kilometros": "44'600", "combustible": "Bencina"}}
{"ad_id": "31772868", "url": "https://www.yapo.cl/autos-usados/toyota-raize-2025/31772868", "titulo": "TOYOTA RAIZE 2025", "fecha_publicado_texto": "Publicado 06/01/2026", "fecha_publicado_iso": "2026-01-06", "marca": "Toyota", "modelo": "Raize", "transmision": null, "precio_texto": "$12.500.000", "precio": 12500000, "anio": 2025, "kilometros_texto": "22'168", "kilometros": 22168, "combustible": "Bencina", "raw": {"marca": "Toyota", "modelo": "Raize", "precio": "$12.500.000", "ano": "2025", "kilometros": "22'168", "combustible": "Bencina"}}
{"ad_id": "31747890", "url": "https://www.yapo.cl/autos-usados/furgon-marca-fiat-modelo-fiorino-fire-elx-1-4-ano-2017/31747890", "titulo": "FURGON MARCA FIAT MODELO FIORINO FIRE ELX 1.4 AÑO 2017", "fecha_publicado_texto": "Publicado 05/01/2026", "fecha_publicado_iso": "2026-01-05", "marca": "Fiat", "modelo": "Fiorino", "transmision": null, "precio_texto": "$3.200.000", "precio": 3200000, "anio": 2017, "kilometros_texto": "131'898", "kilometros": 131898, "combustible": "Bencina", "raw": {"marca": "Fiat", "modelo": "Fiorino", "precio": "$3.200.000", "ano": "2017", "kilometros": "131'898", "combustible": "Bencina"}}
{"ad_id": "31672129", "url": "https://www.yapo.cl/autos-usados/peugeot-3008/31672129", "titulo": "Peugeot 3008", "fecha_publicado_texto": "Publicado 07/01/2026", "fecha_publicado_iso": "2026-01-07", "marca": "Peugeot", "modelo": "3008", "transmision": null, "precio_texto": "$19.990.000", "precio": 19990000, "anio": 2025, "kilometros_texto": "46", "kilometros": 46, "combustible": "Bencina", "raw": {"marca": "Peugeot", "modelo": "3008", "precio": "$19.990.000", "ano": "2025", "kilometros": "46", "combustible": "Bencina"}}
{"ad_id": "31696556", "url": "https://www.yapo.cl/autos-usados/hyundai-i30-2013-full-1-6-gls-crdi-diesel/31696556", "titulo": "Hyundai i30 2013 Full 1.6 GLS CRDI Diesel", "fecha_publicado_texto": "Publicado 05/01/2026", "fecha_publicado_iso": "2026-01-05", "marca": "Hyundai", "modelo": "i30", "transmision": null, "precio_texto": "$10.500.000", "precio": 10500000, "anio": 2013, "kilometros_texto": "87'544", "kilometros": 87544, "combustible": "Diesel", "raw": {"marca": "Hyundai", "modelo": "i30", "precio": "$10.500.000", "ano": "2013", "kilometros": "87'544", "combustible": "Diesel"}}
{"ad_id": "31760864", "url": "https://www.yapo.cl/autos-usados/suzuki-jimny-2022/31760864", "titulo": "SUZUKI JIMNY 2022", "fecha_publicado_texto": "Publicado 06/01/2026", "fecha_publicado_iso": "2026-01-06", "marca": "Suzuki", "modelo": "Jimny", "transmision": null, "precio_texto": "$12.500.000", "precio": 12500000, "anio": 2022, "kilometros_texto": "91'940", "kilometros": 91940, "combustible": "Bencina", "raw": {"marca": "Suzuki", "modelo": "Jimny", "precio": "$12.500.000", "ano": "2022", "kilometros": "91'940", "combustible": "Bencina"}}
{"ad_id": "31678202", "url": "https://www.yapo.cl/autos-usados/toyota-hilux-2023/31678202", "titulo": "TOYOTA HILUX 2023", "fecha_publicado_texto": "Publicado 07/01/2026", "fecha_publicado_iso": "2026-01-07", "marca": "Toyota", "modelo": "Hilux", "transmision": null, "precio_texto": "$17.000.000", "precio": 17000000, "anio": 2023, "kilometros_texto": "65'680", "kilometros": 65680, "combustible": "Diesel", "raw": {"marca": "Toyota", "modelo": "Hilux", "precio": "$17.000.000", "ano": "2023", "kilometros": "65'680", "combustible": "Diesel"}}
{"ad_id": "31788188", "url": "https://www.yapo.cl/autos-usados/kia-morning-2023/31788188", "titulo": "KIA MORNING 2023", "fecha_publicado_texto": "Publicado 05/01/2026", "fecha_publicado_iso": "2026-01-05", "marca": "Kia", "modelo": "Morning", "transmision": null, "precio_texto": "$9.290.000", "precio": 9290000, "anio": 2023, "kilometros_texto": "13'963", "kilometros": 13963, "combustible": "Bencina", "raw": {"marca": "Kia", "modelo": "Morning", "precio": "$9.290.000", "ano": "2023", "kilometros": "13'963", "combustible": "Bencina"}}
{"ad_id": "31856224", "url": "https://www.yapo.cl/autos-nuevos/chevrolet-silverado/31856224", "titulo": null, "fecha_publicado_texto": "Publicado 13/01/2026", "fecha_publicado_iso": "2026-01-13", "marca": "Chevrolet", "modelo": "Silverado", "transmision": null, "precio_texto": "$41.990.000", "precio": 41990000, "anio": 2026, "kilometros_texto": null, "kilometros": null, "combustible": "Bencina", "raw": {"marca": "Chevrolet", "modelo": "Silverado", "precio": "$41.990.000", "ano": "2026", "combustible": "Bencina"}}
{"ad_id": "31803647", "url": "https://www.yapo.cl/autos-usados/citroen-c3-2023/31803647", "titulo": "CITROEN C3 2023", "fecha_publicado_texto": "Publicado 07/01/2026", "fecha_publicado_iso": "2026-01-07", "marca": "Citroen", "modelo": "C3", "transmision": null, "precio_texto": "$10.190.000", "precio": 10190000, "anio": 2023, "kilometros_texto": "75'000", "kilometros": 75000, "combustible": "Diesel", "raw": {"marca": "Citroen", "modelo": "C3", "precio": "$10.190.000", "ano": "2023", "kilometros": "75'000", "combustible": "Diesel"}}
{"ad_id": "31426218", "url": "https://www.yapo.cl/autos-usados/nissan-versa-sence-2015-automatico/31426218", "titulo": "Nissan Versa sence 2015 automático", "fecha_publicado_texto": "Publicado 05/01/2026", "fecha_publicado_iso": "2026-01-05", "marca": "Nissan", "modelo": "Versa", "transmision": null, "precio_texto": "$8.500.000", "precio": 8500000, "anio": 2015, "kilometros_texto": "92'000", "kilometros": 92000, "combustible": "Bencina", "raw": {"marca": "Nissan", "modelo": "Versa", "precio": "$8.500.000", "ano": "2015", "kilometros": "92'000", "combustible": "Bencina"}}
{"ad_id": "31801578", "url": "https://www.yapo.cl/autos-usados/suzuki-grand-nomade-glx-sport-2-4-2013/31801578", "titulo": "Suzuki Grand Nomade Glx Sport 2.4 2013", "fecha_publicado_texto": "Publicado 06/01/2026", "fecha_publicado_iso": "2026-01-06", "marca": "Suzuki", "modelo": "Grand Nomade", "transmision": null, "precio_texto": "$10.990.000", "precio": 10990000, "anio": 2013, "kilometros_texto": "27'000", "kilometros": 27000, "combustible": "Bencina", "raw": {"marca": "Suzuki", "modelo": "Grand Nomade", "precio": "$10.990.000", "ano": "2013", "kilometros": "27'000", "combustible": "Bencina"}}
{"ad_id": "31844911", "url": "https://www.yapo.cl/autos-usados/honda-city-lx-2014/31844911", "titulo": "Honda City LX 2014", "fecha_publicado_texto": "Publicado 10/01/2026", "fecha_publicado_iso": "2026-01-10", "marca": "Honda", "modelo": "City", "transmision": null, "precio_texto": "$6.490.000", "precio": 6490000, "anio": 2014, "kilometros_texto": "142'000", "kilometros": 142000, "combustible": "Bencina", "raw": {"marca": "Honda", "modelo": "City", "precio": "$6.490.000", "ano": "2014", "kilometros": "142'000", "combustible": "Bencina"}}
{"ad_id": "31359151", "url": "https://www.yapo.cl/autos-usados/opel-corsa-2020/31359151", "titulo": "OPEL CORSA 2020", "fecha_publicado_texto": "Publicado 07/01/2026", "fecha_publicado_iso": "2026-01-07", "marca": "Opel", "modelo": "Corsa", "transmision": null, "precio_texto": "$10.990.000", "precio": 10990000, "anio": 2020, "kilometros_texto": "41'775", "kilometros": 41775, "combustible": "Bencina", "raw": {"marca": "Opel", "modelo": "Corsa", "precio": "$10.990.000", "ano": "2020", "kilometros": "41'775", "combustible": "Bencina"}}
{"ad_id": "31791643", "url": "https://www.yapo.cl/autos-usados/mitsubishi-outlander-2019/31791643", "titulo": "MITSUBISHI OUTLANDER 2019", "fecha_publicado_texto": "Publicado 06/01/2026", "fecha_publicado_iso": "2026-01-06", "marca": "Mitsubishi", "modelo": "Outlander", "transmision": null, "precio_texto": "$11.490.000", "precio": 11490000, "anio": 2019, "kilometros_texto": "76'000", "kilometros": 76000, "combustible": "Bencina", "raw": {"marca": "Mitsubishi", "modelo": "Outlander", "precio": "$11.490.000", "ano": "2019", "kilometros": "76'000", "combustible": "Bencina"}}
{"ad_id": "31732580", "url": "https://www.yapo.cl/autos-usados/kia-sonet-2024/31732580", "titulo": "KIA SONET 2024", "fecha_publicado_texto": "Publicado 05/01/2026", "fecha_publicado_iso": "2026-01-05", "marca": "Kia", "modelo": "Sonet", "transmision": null, "precio_texto": "$14.490.000 (Rebajado 9%)", "precio": 14490000, "anio": 2024, "kilometros_texto": "47'268", "kilometros": 47268, "combustible": "Bencina", "raw": {"marca": "Kia", "modelo": "Sonet", "precio": "$14.490.000 (Rebajado 9%)", "ano": "2024", "kilometros": "47'268", "combustible": "Bencina"}}
{"ad_id": "31740170", "url": "https://www.yapo.cl/autos-usados/chevrolet-onix-2024/31740170", "titulo": "CHEVROLET ONIX 2024", "fecha_publicado_texto": "Publicado 07/01/2026", "fecha_publicado_iso": "2026-01-07", "marca": "Chevrolet", "modelo": "Onix", "transmision": null, "precio_texto": "$12.790.000", "precio": 12790000, "anio": 2024, "kilometros_texto": "38'880", "kilometros": 38880, "combustible": "Bencina", "raw": {"marca": "Chevrolet", "modelo": "Onix", "precio": "$12.790.000", "ano": "2024", "kilometros": "38'880", "combustible": "Bencina"}}
{"ad_id": "31713813", "url": "https://www.yapo.cl/autos-usados/peugeot-2008-2022/31713813", "titulo": "PEUGEOT 2008 2022", "fecha_publicado_texto": "Publicado 12/01/2026", "fecha_publicado_iso": "2026-01-12", "marca": "Peugeot", "modelo": "2008", "transmision": null, "precio_texto": "$15.990.000", "precio": 15990000, "anio": 2022, "kilometros_texto": "52'118", "kilometros": 52118, "combustible": "Diesel", "raw": {"marca": "Peugeot", "modelo": "2008", "precio": "$15.990.000", "ano": "2022", "kilometros": "52'118", "combustible": "Diesel"}}
{"ad_id": "31764459", "url": "https://www.yapo.cl/autos-usados/toyota-raize-2025/31764459", "titulo": "TOYOTA RAIZE 2025", "fecha_publicado_texto": "Publicado 06/01/2026", "fecha_publicado_iso": "2026-01-06", "marca": "Toyota", "modelo": "Raize", "transmision": null, "precio_texto": "$12.500.000", "precio": 12500000, "anio": 2025, "kilometros_texto": "20'316", "kilometros": 20316, "combustible": "Bencina", "raw": {"marca": "Toyota", "modelo": "Raize", "precio": "$12.500.000", "ano": "2025", "kilometros": "20'316", "combustible": "Bencina"}}
{"ad_id": "31796751", "url": "https://www.yapo.cl/autos-usados/subaru-forester-cvt-4x4-au/31796751", "titulo": "SUBARU Forester CVT 4x4 Au", "fecha_publicado_texto": "Publicado 13/01/2026", "fecha_publicado_iso": "2026-01-13", "marca": "Subaru", "modelo": "Forester", "transmision": null, "precio_texto": "$17.990.000", "precio": 17990000, "anio": 2020, "kilometros_texto": "87'931", "kilometros": 87931, "combustible": "Bencina", "raw": {"marca": "Subaru", "modelo": "Forester", "precio": "$17.990.000", "ano": "2020", "kilometros": "87'931", "combustible": "Bencina"}}
{"ad_id": "31518267", "url": "https://www.yapo.cl/autos-usados/fiat/31518267", "titulo": "Fiat", "fecha_publicado_texto": "Publicado 07/01/2026", "fecha_publicado_iso": "2026-01-07", "marca": "Fiat", "modelo": "500", "transmision": null, "precio_texto": "$5.390.000 (Rebajado 2%)", "precio": 5390000, "anio": 2015, "kilometros_texto": "181'000", "kilometros": 181000, "combustible": "Bencina", "raw": {"marca": "Fiat", "modelo": "500", "precio": "$5.390.000 (Rebajado 2%)", "ano": "2015", "kilometros": "181'000", "combustible": "Bencina"}}
{"ad_id": "31795924", "url": "https://www.yapo.cl/autos-usados/peugeot-208-2022/31795924", "titulo": "PEUGEOT 208 2022", "fecha_publicado_texto": "Publicado 07/01/2026", "fecha_publicado_iso": "2026-01-07", "marca": "Peugeot", "modelo": "208", "transmision": null, "precio_texto": "$11.990.000", "precio": 11990000, "anio": 2022, "kilometros_texto": "22'000", "kilometros": 22000, "combustible": "Bencina", "raw": {"marca": "Peugeot", "modelo": "208", "precio": "$11.990.000", "ano": "2022", "kilometros": "22'000", "combustible": "Bencina"}}
{"ad_id": "31740172", "url": "https://www.yapo.cl/autos-usados/chevrolet-onix-2024/31740172", "titulo": "CHEVROLET ONIX 2024", "fecha_publicado_texto": "Publicado 07/01/2026", "fecha_publicado_iso": "2026-01-07", "marca": "Chevrolet", "modelo": "Onix", "transmision": null, "precio_texto": "$12.790.000", "precio": 12790000, "anio": 2024, "kilometros_texto": "32'343", "kilometros": 32343, "combustible": "Bencina", "raw": {"marca": "Chevrolet", "modelo": "Onix", "precio": "$12.790.000", "ano": "2024", "kilometros": "32'343", "combustible": "Bencina"}}
{"ad_id": "31797994", "url": "https://www.yapo.cl/autos-usados/ford-new-ranger-ltd-2-5/31797994", "titulo": "Ford New Ranger LTD 2.5", "fecha_publicado_texto": "Publicado 13/01/2026", "fecha_publicado_iso": "2026-01-13", "marca": "Ford", "modelo": "Ranger", "transmision": null, "precio_texto": "$19.990.000", "precio": 19990000, "anio": 2021, "kilometros_texto": "50'298", "kilometros": 50298, "combustible": "Bencina", "raw": {"marca": "Ford", "modelo": "Ranger", "precio": "$19.990.000", "ano": "2021", "kilometros": "50'298", "combustible": "Bencina"}}
{"ad_id": "31578025", "url": "https://www.yapo.cl/autos-usados/jmc-vigus-work-2-5-2023/31578025", "titulo": "Jmc Vigus Work 2.5 2023", "fecha_publicado_texto": "Publicado 07/01/2026", "fecha_publicado_iso": "2026-01-07", "marca": "JMC", "modelo": "Vigus", "transmision": null, "precio_texto": "$9.990.000", "precio": 9990000, "anio": 2023, "kilometros_texto": "142'000", "kilometros": 142000, "combustible": "Diesel", "raw": {"marca": "JMC", "modelo": "Vigus", "precio": "$9.990.000", "ano": "2023", "kilometros": "142'000", "combustible": "Diesel"}}
{"ad_id": "31400696", "url": "https://www.yapo.cl/autos-usados/chevrolet-tracker-2024/31400696", "titulo": "CHEVROLET TRACKER 2024", "fecha_publicado_texto": "Publicado 07/01/2026", "fecha_publicado_iso": "2026-01-07", "marca": "Chevrolet", "modelo": "Tracker", "transmision": null, "precio_texto": "$11.000.000 (Rebajado 8%)", "precio": 11000000, "anio": 2024, "kilometros_texto": "35'284", "kilometros": 35284, "combustible": "Bencina", "raw": {"marca": "Chevrolet", "modelo": "Tracker", "precio": "$11.000.000 (Rebajado 8%)", "ano": "2024", "kilometros": "35'284", "combustible": "Bencina"}}
{"ad_id": "31768053", "url": "https://www.yapo.cl/autos-usados/chevrolet-onix-2024/31768053", "titulo": "CHEVROLET ONIX 2024", "fecha_publicado_texto": "Publicado 07/01/2026", "fecha_publicado_iso": "2026-01-07", "marca": "Chevrolet", "modelo": "Onix", "transmision": null, "precio_texto": "$13.490.000", "precio": 13490000, "anio": 2024, "kilometros_texto": "40'410", "kilometros": 40410, "combustible": "Bencina", "raw": {"marca": "Chevrolet", "modelo": "Onix", "precio": "$13.490.000", "ano": "2024", "kilometros": "40'410", "combustible": "Bencina"}}
{"ad_id": "31784889", "url": "https://www.yapo.cl/autos-usados/great-wall-poer-4x2-mt-2-0/31784889", "titulo": "Great Wall Poer 4x2 MT 2.0", "fecha_publicado_texto": "Publicado 06/01/2026", "fecha_publicado_iso": "2026-01-06", "marca": "Great Wall", "modelo": "POER", "transmision": null, "precio_texto": "$18.490.000", "precio": 18490000, "anio": 2025, "kilometros_texto": "38'179", "kilometros": 38179, "combustible": "Diesel", "raw": {"marca": "Great Wall", "modelo": "POER", "precio": "$18.490.000", "ano": "2025", "kilometros": "38'179", "combustible": "Diesel"}}
{"ad_id": "31633227", "url": "https://www.yapo.cl/autos-usados/hyundai-accent-2016/31633227", "titulo": "Hyundai Accent 2016", "fecha_publicado_texto": "Publicado 04/01/2026", "fecha_publicado_iso": "2026-01-04", "marca": "Hyundai", "modelo": "Accent", "transmision": null, "precio_texto": "$7.990.000", "precio": 7990000, "anio": 2016, "kilometros_texto": "193'554", "kilometros": 193554, "combustible": "Bencina", "raw": {"marca": "Hyundai", "modelo": "Accent", "precio": "$7.990.000", "ano": "2016", "kilometros": "193'554", "combustible": "Bencina"}}
{"ad_id": "31757152", "url": "https://www.yapo.cl/autos-usados/vendo-subaru-station-wagon-xv-cvt-2-0-aut-poco-uso-32600-km/31757152", "titulo": "Vendo Subaru Station Wagon XV CVT 2.0 AUT. POCO USO. 32600 km", "fecha_publicado_texto": "Publicado 05/01/2026", "fecha_publicado_iso": "2026-01-05", "marca": "Subaru", "modelo": "XV", "transmision": null, "precio_texto": "$17.800.000", "precio": 17800000, "anio": 2021, "kilometros_texto": "32'600", "kilometros": 32600, "combustible": "Bencina", "raw": {"marca": "Subaru", "modelo": "XV", "precio": "$17.800.000", "ano": "2021", "kilometros": "32'600", "combustible": "Bencina"}}
{"ad_id": "31746112", "url": "https://www.yapo.cl/autos-usados/furgon-marca-renault-modelo-dokker-iii-1-5-ano-2016/31746112", "titulo": "FURGON MARCA RENAULT MODELO DOKKER III 1.5 AÑO 2016", "fecha_publicado_texto": "Publicado 05/01/2026", "fecha_publicado_iso": "2026-01-05", "marca": "Renault", "modelo": "Dokker", "transmision": null, "precio_texto": "$3.900.000", "precio": 3900000, "anio": 2016, "kilometros_texto": "253'798", "kilometros": 253798, "combustible": "Diesel", "raw": {"marca": "Renault", "modelo": "Dokker", "precio": "$3.900.000", "ano": "2016", "kilometros": "253'798", "combustible": "Diesel"}}
{"ad_id": "31544357", "url": "https://www.yapo.cl/autos-usados/auto-bmw-2019-modelo-118/31544357", "titulo": "Auto BMW 2019 modelo 118", "fecha_publicado_texto": "Publicado 07/01/2026", "fecha_publicado_iso": "2026-01-07", "marca": "BMW", "modelo": "118i", "transmision": null, "precio_texto": "$13.900.000 (Rebajado 5%)", "precio": 13900000, "anio": 2019, "kilometros_texto": "94'000", "kilometros": 94000, "combustible": "Bencina", "raw": {"marca": "BMW", "modelo": "118i", "precio": "$13.900.000 (Rebajado 5%)", "ano": "2019", "kilometros": "94'000", "combustible": "Bencina"}}
{"ad_id": "30892997", "url": "https://www.yapo.cl/autos-usados/ds-ds-3-2023/30892997", "titulo": "DS DS 3 2023", "fecha_publicado_texto": "Publicado 06/01/2026", "fecha_publicado_iso": "2026-01-06", "marca": "DS", "modelo": "3", "transmision": null, "precio_texto": "$22.990.000 (Rebajado 22%)", "precio": 22990000, "anio": 2023, "kilometros_texto": "18'469", "kilometros": 18469, "combustible": "Eléctrico", "raw": {"marca": "DS", "modelo": "3", "precio": "$22.990.000 (Rebajado 22%)", "ano": "2023", "kilometros": "18'469", "combustible": "Eléctrico"}}
{"ad_id": "31651032", "url": "https://www.yapo.cl/autos-usados/mg-hs-2023/31651032", "titulo": "MG HS 2023", "fecha_publicado_texto": "Publicado 05/01/2026", "fecha_publicado_iso": "2026-01-05", "marca": null, "modelo": "HS", "transmision": null, "precio_texto": "$11.890.000", "precio": 11890000, "anio": 2023, "kilometros_texto": "16'000", "kilometros": 16000, "combustible": "Bencina", "raw": {"modelo": "HS", "precio": "$11.890.000", "ano": "2023", "kilometros": "16'000", "combustible": "Bencina"}}
{"ad_id": "31682083", "url": "https://www.yapo.cl/autos-usados/chevrolet-traverse-2016/31682083", "titulo": "CHEVROLET TRAVERSE 2016", "fecha_publicado_texto": "Publicado 07/01/2026", "fecha_publicado_iso": "2026-01-07", "marca": "Chevrolet", "modelo": "Traverse", "transmision": null, "precio_texto": "$11.990.000", "precio": 11990000, "anio": 2016, "kilometros_texto": "86'272", "kilometros": 86272, "combustible": "Bencina", "raw": {"marca": "Chevrolet", "modelo": "Traverse", "precio": "$11.990.000", "ano": "2016", "kilometros": "86'272", "combustible": "Bencina"}}
{"ad_id": "31788067", "url": "https://www.yapo.cl/autos-usados/kia-rio-4-2021/31788067", "titulo": "KIA RIO 4 2021", "fecha_publicado_texto": "Publicado 05/01/2026", "fecha_publicado_iso": "2026-01-05", "marca": "Kia", "modelo": "other", "transmision": null, "precio_texto": "$10.590.000", "precio": 10590000, "anio": 2021, "kilometros_texto": "75'384", "kilometros": 75384, "combustible": "Bencina", "raw": {"marca": "Kia", "modelo": "other", "precio": "$10.590.000", "ano": "2021", "kilometros": "75'384", "combustible": "Bencina"}}
{"ad_id": "31594455", "url": "https://www.yapo.cl/autos-usados/kia-seltos-2024/31594455", "titulo": "KIA SELTOS 2024", "fecha_publicado_texto": "Publicado 05/01/2026", "fecha_publicado_iso": "2026-01-05", "marca": "Kia", "modelo": "Seltos", "transmision": null, "precio_texto": "$19.290.000 (Rebajado 4%)", "precio": 19290000, "anio": 2024, "kilometros_texto": "40'158", "kilometros": 40158, "combustible": "Bencina", "raw": {"marca": "Kia", "modelo": "Seltos", "precio": "$19.290.000 (Rebajado 4%)", "ano": "2024", "kilometros": "40'158", "combustible": "Bencina"}}
{"ad_id": "31686778", "url": "https://www.yapo.cl/autos-usados/volvo-xc60-t6-awd-r-desing-2020/31686778", "titulo": "VOLVO XC60 T6 AWD R-DESING 2020", "fecha_publicado_texto": "Publicado 04/01/2026", "fecha_publicado_iso": "2026-01-04", "marca": "Volvo", "modelo": "XC60", "transmision": null, "precio_texto": "$27.990.000 (Rebajado 6%)", "precio": 27990000, "anio": 2020, "kilometros_texto": "155'000", "kilometros": 155000, "combustible": "Bencina", "raw": {"marca": "Volvo", "modelo": "XC60", "precio": "$27.990.000 (Rebajado 6%)", "ano": "2020", "kilometros": "155'000", "combustible": "Bencina"}}
{"ad_id": "31709134", "url": "https://www.yapo.cl/autos-usados/jeep-grand-cherokee-2022/31709134", "titulo": "JEEP GRAND CHEROKEE 2022", "fecha_publicado_texto": "Publicado 07/01/2026", "fecha_publicado_iso": "2026-01-07", "marca": "Jeep", "modelo": "Grand Cherokee", "transmision": null, "precio_texto": "$28.990.000", "precio": 28990000, "anio": 2022, "kilometros_texto": "71'557", "kilometros": 71557, "combustible": "Bencina", "raw": {"marca": "Jeep", "modelo": "Grand Cherokee", "precio": "$28.990.000", "ano": "2022", "kilometros": "71'557", "combustible": "Bencina"}}
{"ad_id": "31792486", "url": "https://www.yapo.cl/autos-usados/crevrolet-cruze-1-8-2010-full-automatico/31792486", "titulo": "Crevrolet Cruze 1.8 2010 full automático", "fecha_publicado_texto": "Publicado 06/01/2026", "fecha_publicado_iso": "2026-01-06", "marca": "Chevrolet", "modelo": "Cruze", "transmision": null, "precio_texto": "$2.500.000 (Rebajado 11%)", "precio": 2500000, "anio": 2010, "kilometros_texto": "106'000", "kilometros": 106000, "combustible": "Bencina", "raw": {"marca": "Chevrolet", "modelo": "Cruze", "precio": "$2.500.000 (Rebajado 11%)", "ano": "2010", "kilometros": "106'000", "combustible": "Bencina"}}
{"ad_id": "31750811", "url": "https://www.yapo.cl/autos-usados/chevrolet-sail-2020/31750811", "titulo": "CHEVROLET SAIL 2020", "fecha_publicado_texto": "Publicado 07/01/2026", "fecha_publicado_iso": "2026-01-07", "marca": "Chevrolet", "modelo": "Sail", "transmision": null, "precio_texto": "$6.990.000", "precio": 6990000, "anio": 2020, "kilometros_texto": "68'981", "kilometros": 68981, "combustible": "Bencina", "raw": {"marca": "Chevrolet", "modelo": "Sail", "precio": "$6.990.000", "ano": "2020", "kilometros": "68'981", "combustible": "Bencina"}}
{"ad_id": "31837476", "url": "https://www.yapo.cl/autos-usados/kia-cerato-5-2020/31837476", "titulo": "KIA CERATO 5 2020", "fecha_publicado_texto": "Publicado 12/01/2026", "fecha_publicado_iso": "2026-01-12", "marca": "Kia", "modelo": "Cerato", "transmision": null, "precio_texto": "$14.490.000", "precio": 14490000, "anio": 2020, "kilometros_texto": "57'773", "kilometros": 57773, "combustible": "Bencina", "raw": {"marca": "Kia", "modelo": "Cerato", "precio": "$14.490.000", "ano": "2020", "kilometros": "57'773", "combustible": "Bencina"}}
{"ad_id": "31488061", "url": "https://www.yapo.cl/autos-usados/ram-1000-2021/31488061", "titulo": "RAM 1000 2021", "fecha_publicado_texto": "Publicado 06/01/2026", "fecha_publicado_iso": "2026-01-06", "marca": "Ram", "modelo": "1000", "transmision": null, "precio_texto": "$12.490.000 (Rebajado 7%)", "precio": 12490000, "anio": 2021, "kilometros_texto": "109'567", "kilometros": 109567, "combustible": "Bencina", "raw": {"marca": "Ram", "modelo": "1000", "precio": "$12.490.000 (Rebajado 7%)", "ano": "2021", "kilometros": "109'567", "combustible": "Bencina"}}
{"ad_id": "31521595", "url": "https://www.yapo.cl/autos-usados/chevrolet-groove-2023/31521595", "titulo": "CHEVROLET GROOVE 2023", "fecha_publicado_texto": "Publicado 07/01/2026", "fecha_publicado_iso": "2026-01-07", "marca": "Chevrolet", "modelo": "Groove", "transmision": null, "precio_texto": "$9.690.000", "precio": 9690000, "anio": 2023, "kilometros_texto": "8'000", "kilometros": 8000, "combustible": "Bencina", "raw": {"marca": "Chevrolet", "modelo": "Groove", "precio": "$9.690.000", "ano": "2023", "kilometros": "8'000", "combustible": "Bencina"}}
{"ad_id": "31785314", "url": "https://www.yapo.cl/autos-usados/opel-corsa-2022/31785314", "titulo": "OPEL CORSA 2022", "fecha_publicado_texto": "Publicado 07/01/2026", "fecha_publicado_iso": "2026-01-07", "marca": "Opel", "modelo": "Corsa", "transmision": null, "precio_texto": "$10.730.000", "precio": 10730000, "anio": 2022, "kilometros_texto": "29'503", "kilometros": 29503, "combustible": "Bencina", "raw": {"marca": "Opel", "modelo": "Corsa", "precio": "$10.730.000", "ano": "2022", "kilometros": "29'503", "combustible": "Bencina"}}
{"ad_id": "31188327", "url": "https://www.yapo.cl/autos-usados/opel-crossland-edition-1-2t-mt/31188327", "titulo": "OPEL CROSSLAND EDITION 1.2T MT", "fecha_publicado_texto": "Publicado 04/01/2026", "fecha_publicado_iso": "2026-01-04", "marca": "Opel", "modelo": "Crossland", "transmision": null, "precio_texto": "$11.990.000 (Rebajado 4%)", "precio": 11990000, "anio": 2023, "kilometros_texto": "32'660", "kilometros": 32660, "combustible": "Bencina", "raw": {"marca": "Opel", "modelo": "Crossland", "precio": "$11.990.000 (Rebajado 4%)", "ano": "2023", "kilometros": "32'660", "combustible": "Bencina"}}
{"ad_id": "31678641", "url": "https://www.yapo.cl/autos-usados/suzuki-swift-2023/31678641", "titulo": "SUZUKI SWIFT 2023", "fecha_publicado_texto": "Publicado 07/01/2026", "fecha_publicado_iso": "2026-01-07", "marca": "Suzuki", "modelo": "Swift", "transmision": null, "precio_texto": "$9.990.000", "precio": 9990000, "anio": 2023, "kilometros_texto": "56'000", "kilometros": 56000, "combustible": "Bencina", "raw": {"marca": "Suzuki", "modelo": "Swift", "precio": "$9.990.000", "ano": "2023", "kilometros": "56'000", "combustible": "Bencina"}}
{"ad_id": "31497311", "url": "https://www.yapo.cl/autos-usados/chevrolet-tracker-2024/31497311", "titulo": "CHEVROLET TRACKER 2024", "fecha_publicado_texto": "Publicado 07/01/2026", "fecha_publicado_iso": "2026-01-07", "marca": "Chevrolet", "modelo": "Tracker", "transmision": null, "precio_texto": "$12.190.000 (Rebajado 2%)", "precio": 12190000, "anio": 2024, "kilometros_texto": "52'487", "kilometros": 52487, "combustible": "Bencina", "raw": {"marca": "Chevrolet", "modelo": "Tracker", "precio": "$12.190.000 (Rebajado 2%)", "ano": "2024", "kilometros": "52'487", "combustible": "Bencina"}}
{"ad_id": "31584390", "url": "https://www.yapo.cl/autos-usados/chevrolet-onix-2024/31584390", "titulo": "CHEVROLET ONIX 2024", "fecha_publicado_texto": "Publicado 07/01/2026", "fecha_publicado_iso": "2026-01-07", "marca": "Chevrolet", "modelo": "Onix", "transmision": null, "precio_texto": "$13.490.000", "precio": 13490000, "anio": 2024, "kilometros_texto": "44'497", "kilometros": 44497, "combustible": "Bencina", "raw": {"marca": "Chevrolet", "modelo": "Onix", "precio": "$13.490.000", "ano": "2024", "kilometros": "44'497", "combustible": "Bencina"}}
{"ad_id": "31819129", "url": "https://www.yapo.cl/autos-usados/chevrolet-onix-2024/31819129", "titulo": "CHEVROLET ONIX 2024", "fecha_publicado_texto": "Publicado 07/01/2026", "fecha_publicado_iso": "2026-01-07", "marca": "Chevrolet", "modelo": "Onix", "transmision": null, "precio_texto": "$13.490.000", "precio": 13490000, "anio": 2024, "kilometros_texto": "29'818", "kilometros": 29818, "combustible": "Bencina", "raw": {"marca": "Chevrolet", "modelo": "Onix", "precio": "$13.490.000", "ano": "2024", "kilometros": "29'818", "combustible": "Bencina"}}
{"ad_id": "31566452", "url": "https://www.yapo.cl/autos-usados/chevrolet-montana-2023/31566452", "titulo": "CHEVROLET MONTANA 2023", "fecha_publicado_texto": "Publicado 07/01/2026", "fecha_publicado_iso": "2026-01-07", "marca": "Chevrolet", "modelo": "Montana", "transmision": null, "precio_texto": "$15.490.000", "precio": 15490000, "anio": 2023, "kilometros_texto": "60'520", "kilometros": 60520, "combustible": "Bencina", "raw": {"marca": "Chevrolet", "modelo": "Montana", "precio": "$15.490.000", "ano": "2023", "kilometros": "60'520", "combustible": "Bencina"}}
{"ad_id": "31579148", "url": "https://www.yapo.cl/autos-usados/hyundai-porter-2022/31579148", "titulo": "HYUNDAI PORTER 2022", "fecha_publicado_texto": "Publicado 07/01/2026", "fecha_publicado_iso": "2026-01-07", "marca": "Hyundai", "modelo": "Porter", "transmision": null, "precio_texto": "$15.990.000", "precio": 15990000, "anio": 2022, "kilometros_texto": "149'245", "kilometros": 149245, "combustible": "Diesel", "raw": {"marca": "Hyundai", "modelo": "Porter", "precio": "$15.990.000", "ano": "2022", "kilometros": "149'245", "combustible": "Diesel"}}
{"ad_id": "31796912", "url": "https://www.yapo.cl/autos-usados/chevrolet-tracker-2025/31796912", "titulo": "CHEVROLET TRACKER 2025", "fecha_publicado_texto": "Publicado 07/01/2026", "fecha_publicado_iso": "2026-01-07", "marca": "Chevrolet", "modelo": "Tracker", "transmision": null, "precio_texto": "$16.090.000", "precio": 16090000, "anio": 2025, "kilometros_texto": "21'229", "kilometros": 21229, "combustible": "Bencina", "raw": {"marca": "Chevrolet", "modelo": "Tracker", "precio": "$16.090.000", "ano": "2025", "kilometros": "21'229", "combustible": "Bencina"}}
{"ad_id": "31756340", "url": "https://www.yapo.cl/autos-usados/toyota-raize-2022/31756340", "titulo": "TOYOTA RAIZE 2022", "fecha_publicado_texto": "Publicado 07/01/2026", "fecha_publicado_iso": "2026-01-07", "marca": "Toyota", "modelo": "Raize", "transmision": null, "precio_texto": "$10.790.000", "precio": 10790000, "anio": 2022, "kilometros_texto": "94'293", "kilometros": 94293, "combustible": "Bencina", "raw": {"marca": "Toyota", "modelo": "Raize", "precio": "$10.790.000", "ano": "2022", "kilometros": "94'293", "combustible": "Bencina"}}
{"ad_id": "31664432", "url": "https://www.yapo.cl/autos-usados/great-wall-poer-plus-4x4-2-0-at/31664432", "titulo": "GREAT WALL POER PLUS 4x4 2.0 AT", "fecha_publicado_texto": "Publicado 06/01/2026", "fecha_publicado_iso": "2026-01-06", "marca": "Great Wall", "modelo": "POER", "transmision": null, "precio_texto": "$21.690.000 (Rebajado 1%)", "precio": 21690000, "anio": 2024, "kilometros_texto": "24'090", "kilometros": 24090, "combustible": "Diesel", "raw": {"marca": "Great Wall", "modelo": "POER", "precio": "$21.690.000 (Rebajado 1%)", "ano": "2024", "kilometros": "24'090", "combustible": "Diesel"}}
{"ad_id": "31730259", "url": "https://www.yapo.cl/autos-usados/toyota-yaris-2017/31730259", "titulo": "TOYOTA YARIS 2017", "fecha_publicado_texto": "Publicado 06/01/2026", "fecha_publicado_iso": "2026-01-06", "marca": "Toyota", "modelo": "Yaris", "transmision": null, "precio_texto": "$8.990.000", "precio": 8990000, "anio": 2017, "kilometros_texto": "68'321", "kilometros": 68321, "combustible": "Bencina", "raw": {"marca": "Toyota", "modelo": "Yaris", "precio": "$8.990.000", "ano": "2017", "kilometros": "68'321", "combustible": "Bencina"}}
{"ad_id": "31819131", "url": "https://www.yapo.cl/autos-usados/chevrolet-onix-2024/31819131", "titulo": "CHEVROLET ONIX 2024", "fecha_publicado_texto": "Publicado 07/01/2026", "fecha_publicado_iso": "2026-01-07", "marca": "Chevrolet", "modelo": "Onix", "transmision": null, "precio_texto": "$13.690.000", "precio": 13690000, "anio": 2024, "kilometros_texto": "36'901", "kilometros": 36901, "combustible": "Bencina", "raw": {"marca": "Chevrolet", "modelo": "Onix", "precio": "$13.690.000", "ano": "2024", "kilometros": "36'901", "combustible": "Bencina"}}
{"ad_id": "31266718", "url": "https://www.yapo.cl/autos-usados/toyota-hilux-2023/31266718", "titulo": "TOYOTA HILUX 2023", "fecha_publicado_texto": "Publicado 07/01/2026", "fecha_publicado_iso": "2026-01-07", "marca": "Toyota", "modelo": "Hilux", "transmision": null, "precio_texto": "$15.900.000", "precio": 15900000, "anio": 2023, "kilometros_texto": "61'853", "kilometros": 61853, "combustible": "Diesel", "raw": {"marca": "Toyota", "modelo": "Hilux", "precio": "$15.900.000", "ano": "2023", "kilometros": "61'853", "combustible": "Diesel"}}
{"ad_id": "31477585", "url": "https://www.yapo.cl/autos-usados/kia-sportage-2021-81-751-kms/31477585", "titulo": "Kia Sportage 2021, 81.751 Kms", "fecha_publicado_texto": "Publicado 04/01/2026", "fecha_publicado_iso": "2026-01-04", "marca": "Kia", "modelo": "Sportage", "transmision": null, "precio_texto": "$15.990.000", "precio": 15990000, "anio": 2021, "kilometros_texto": "81'751", "kilometros": 81751, "combustible": "Bencina", "raw": {"marca": "Kia", "modelo": "Sportage", "precio": "$15.990.000", "ano": "2021", "kilometros": "81'751", "combustible": "Bencina"}}
{"ad_id": "31669682", "url": "https://www.yapo.cl/autos-usados/mg-5-2022/31669682", "titulo": "MG 5 2022", "fecha_publicado_texto": "Publicado 05/01/2026", "fecha_publicado_iso": "2026-01-05", "marca": null, "modelo": "other", "transmision": null, "precio_texto": "$7.890.000", "precio": 7890000, "anio": 2022, "kilometros_texto": "63'870", "kilometros": 63870, "combustible": "Bencina", "raw": {"modelo": "other", "precio": "$7.890.000", "ano": "2022", "kilometros": "63'870", "combustible": "Bencina"}}
{"ad_id": "31796091", "url": "https://www.yapo.cl/autos-usados/peugeot-partner-2023/31796091", "titulo": "PEUGEOT PARTNER 2023", "fecha_publicado_texto": "Publicado 07/01/2026", "fecha_publicado_iso": "2026-01-07", "marca": "Peugeot", "modelo": "Partner", "transmision": null, "precio_texto": "$12.990.000 (Rebajado 4%)", "precio": 12990000, "anio": 2023, "kilometros_texto": "87'000", "kilometros": 87000, "combustible": "Diesel", "raw": {"marca": "Peugeot", "modelo": "Partner", "precio": "$12.990.000 (Rebajado 4%)", "ano": "2023", "kilometros": "87'000", "combustible": "Diesel"}}
{"ad_id": "31537893", "url": "https://www.yapo.cl/autos-usados/citroen-c3-2023/31537893", "titulo": "CITROEN C3 2023", "fecha_publicado_texto": "Publicado 07/01/2026", "fecha_publicado_iso": "2026-01-07", "marca": "Citroen", "modelo": "C3", "transmision": null, "precio_texto": "$9.590.000 (Rebajado 7%)", "precio": 9590000, "anio": 2023, "kilometros_texto": "77'119", "kilometros": 77119, "combustible": "Diesel", "raw": {"marca": "Citroen", "modelo": "C3", "precio": "$9.590.000 (Rebajado 7%)", "ano": "2023", "kilometros": "77'119", "combustible": "Diesel"}}
{"ad_id": "31572809", "url": "https://www.yapo.cl/autos-usados/chevrolet-captiva-2022/31572809", "titulo": "CHEVROLET CAPTIVA 2022", "fecha_publicado_texto": "Publicado 06/01/2026", "fecha_publicado_iso": "2026-01-06", "marca": "Chevrolet", "modelo": "Captiva", "transmision": null, "precio_texto": "$11.990.000 (Rebajado 4%)", "precio": 11990000, "anio": 2022, "kilometros_texto": "41'000", "kilometros": 41000, "combustible": "Bencina", "raw": {"marca": "Chevrolet", "modelo": "Captiva", "precio": "$11.990.000 (Rebajado 4%)", "ano": "2022", "kilometros": "41'000", "combustible": "Bencina"}}
{"ad_id": "31790435", "url": "https://www.yapo.cl/autos-usados/mg-zx-2023/31790435", "titulo": "MG ZX 2023", "fecha_publicado_texto": "Publicado 05/01/2026", "fecha_publicado_iso": "2026-01-05", "marca": null, "modelo": "ZX", "transmision": null, "precio_texto": "$9.240.000", "precio": 9240000, "anio": 2023, "kilometros_texto": "60'868", "kilometros": 60868, "combustible": "Bencina", "raw": {"modelo": "ZX", "precio": "$9.240.000", "ano": "2023", "kilometros": "60'868", "combustible": "Bencina"}}
{"ad_id": "31469863", "url": "https://www.yapo.cl/autos-usados/peugeot-landtrek-2023/31469863", "titulo": "PEUGEOT LANDTREK 2023", "fecha_publicado_texto": "Publicado 06/01/2026", "fecha_publicado_iso": "2026-01-06", "marca": "Peugeot", "modelo": "Landtrek", "transmision": null, "precio_texto": "$12.900.000", "precio": 12900000, "anio": 2023, "kilometros_texto": "76'370", "kilometros": 76370, "combustible": "Diesel", "raw": {"marca": "Peugeot", "modelo": "Landtrek", "precio": "$12.900.000", "ano": "2023", "kilometros": "76'370", "combustible": "Diesel"}}
{"ad_id": "31436743", "url": "https://www.yapo.cl/autos-usados/oportunidad-ford-explores-2022/31436743", "titulo": "OPORTUNIDAD, FORD EXPLORES 2022", "fecha_publicado_texto": "Publicado 13/01/2026", "fecha_publicado_iso": "2026-01-13", "marca": "Ford", "modelo": "Explorer", "transmision": null, "precio_texto": "$28.000.000 (Rebajado 7%)", "precio": 28000000, "anio": 2022, "kilometros_texto": "33'000", "kilometros": 33000, "combustible": "Bencina", "raw": {"marca": "Ford", "modelo": "Explorer", "precio": "$28.000.000 (Rebajado 7%)", "ano": "2022", "kilometros": "33'000", "combustible": "Bencina"}}
{"ad_id": "31693425", "url": "https://www.yapo.cl/autos-usados/renault-symbol-2022/31693425", "titulo": "RENAULT SYMBOL 2022", "fecha_publicado_texto": "Publicado 07/01/2026", "fecha_publicado_iso": "2026-01-07", "marca": "Renault", "modelo": "Symbol", "transmision": null, "precio_texto": "$6.990.000 (Rebajado 7%)", "precio": 6990000, "anio": 2022, "kilometros_texto": "40'231", "kilometros": 40231, "combustible": "Bencina", "raw": {"marca": "Renault", "modelo": "Symbol", "precio": "$6.990.000 (Rebajado 7%)", "ano": "2022", "kilometros": "40'231", "combustible": "Bencina"}}
{"ad_id": "31701291", "url": "https://www.yapo.cl/autos-usados/chevrolet-groove-2021/31701291", "titulo": "CHEVROLET GROOVE 2021", "fecha_publicado_texto": "Publicado 05/01/2026", "fecha_publicado_iso": "2026-01-05", "marca": "Chevrolet", "modelo": "Groove", "transmision": null, "precio_texto": "$10.290.000", "precio": 10290000, "anio": 2021, "kilometros_texto": "43'066", "kilometros": 43066, "combustible": "Bencina", "raw": {"marca": "Chevrolet", "modelo": "Groove", "precio": "$10.290.000", "ano": "2021", "kilometros": "43'066", "combustible": "Bencina"}}
{"ad_id": "31770431", "url": "https://www.yapo.cl/autos-usados/hyundai-porter-2021/31770431", "titulo": "HYUNDAI PORTER 2021", "fecha_publicado_texto": "Publicado 07/01/2026", "fecha_publicado_iso": "2026-01-07", "marca": "Hyundai", "modelo": "Porter", "transmision": null, "precio_texto": "$13.890.000", "precio": 13890000, "anio": 2021, "kilometros_texto": "103'065", "kilometros": 103065, "combustible": "Diesel", "raw": {"marca": "Hyundai", "modelo": "Porter", "precio": "$13.890.000", "ano": "2021", "kilometros": "103'065", "combustible": "Diesel"}}
{"ad_id": "31756081", "url": "https://www.yapo.cl/autos-usados/great-wall-poer-4x4-2-0-mt/31756081", "titulo": "Great Wall Poer 4x4 2.0 MT", "fecha_publicado_texto": "Publicado 06/01/2026", "fecha_publicado_iso": "2026-01-06", "marca": "Great Wall", "modelo": "POER", "transmision": null, "precio_texto": "$19.990.000", "precio": 19990000, "anio": 2025, "kilometros_texto": "34'207", "kilometros": 34207, "combustible": "Diesel", "raw": {"marca": "Great Wall", "modelo": "POER", "precio": "$19.990.000", "ano": "2025", "kilometros": "34'207", "combustible": "Diesel"}}
{"ad_id": "31824806", "url": "https://www.yapo.cl/autos-usados/citroen-c3-2023/31824806", "titulo": "CITROEN C3 2023", "fecha_publicado_texto": "Publicado 07/01/2026", "fecha_publicado_iso": "2026-01-07", "marca": "Citroen", "modelo": "C3", "transmision": null, "precio_texto": "$8.990.000", "precio": 8990000, "anio": 2023, "kilometros_texto": "70'768", "kilometros": 70768, "combustible": "Bencina", "raw": {"marca": "Citroen", "modelo": "C3", "precio": "$8.990.000", "ano": "2023", "kilometros": "70'768", "combustible": "Bencina"}}
{"ad_id": "31205048", "url": "https://www.yapo.cl/autos-usados/mercedes-benz-c-300-2-0-coupe-2019/31205048", "titulo": "Mercedes Benz C 300 2.0 Coupe 2019", "fecha_publicado_texto": "Publicado 07/01/2026", "fecha_publicado_iso": "2026-01-07", "marca": "Mercedes Benz", "modelo": "C 300", "transmision": null, "precio_texto": "$32.990.000 (Rebajado 6%)", "precio": 32990000, "anio": 2019, "kilometros_texto": "42'000", "kilometros": 42000, "combustible": "Bencina", "raw": {"marca": "Mercedes Benz", "modelo": "C 300", "precio": "$32.990.000 (Rebajado 6%)", "ano": "2019", "kilometros": "42'000", "combustible": "Bencina"}}
{"ad_id": "31740213", "url": "https://www.yapo.cl/autos-usados/citroen-c3-2024/31740213", "titulo": "CITROEN C3 2024", "fecha_publicado_texto": "Publicado 06/01/2026", "fecha_publicado_iso": "2026-01-06", "marca": "Citroen", "modelo": "C3", "transmision": null, "precio_texto": "$12.790.000", "precio": 12790000, "anio": 2024, "kilometros_texto": "38'331", "kilometros": 38331, "combustible": "Diesel", "raw": {"marca": "Citroen", "modelo": "C3", "precio": "$12.790.000", "ano": "2024", "kilometros": "38'331", "combustible": "Diesel"}}
{"ad_id": "31436889", "url": "https://www.yapo.cl/autos-usados/volkswagen-saveiro-2021/31436889", "titulo": "VOLKSWAGEN SAVEIRO 2021", "fecha_publicado_texto": "Publicado 07/01/2026", "fecha_publicado_iso": "2026-01-07", "marca": "Volkswagen", "modelo": "Saveiro", "transmision": null, "precio_texto": "$6.490.000 (Rebajado 20%)", "precio": 6490000, "anio": 2021, "kilometros_texto": "88'047", "kilometros": 88047, "combustible": "Bencina", "raw": {"marca": "Volkswagen", "modelo": "Saveiro", "precio": "$6.490.000 (Rebajado 20%)", "ano": "2021", "kilometros": "88'047", "combustible": "Bencina"}}
